wandb: Starting wandb agent 🕵️
2026-01-10 17:35:00,294 - wandb.wandb_agent - INFO - Running runs: []
2026-01-10 17:35:00,823 - wandb.wandb_agent - INFO - Agent received command: run
2026-01-10 17:35:00,823 - wandb.wandb_agent - INFO - Agent starting run with config:
	batch_size: 64
	label_smoothing: 0.033205772026742485
	lr: 5.184267534930401e-05
	optimizer: AdamW
	weight_decay: 3.511185669273328e-06
2026-01-10 17:35:00,825 - wandb.wandb_agent - INFO - About to run command: /usr/bin/env python train.py --batch_size=64 --label_smoothing=0.033205772026742485 --lr=5.184267534930401e-05 --optimizer=AdamW --weight_decay=3.511185669273328e-06
wandb: Currently logged in as: arnaumarcosalmansa (mcv-team-6) to https://api.wandb.ai. Use `wandb login --relogin` to force relogin
wandb: WARNING Ignoring project 'C3-Week3' when running a sweep.
wandb: WARNING Ignoring entity 'mcv-team-6' when running a sweep.
wandb: Tracking run with wandb version 0.23.1
wandb: Run data is saved locally in /export/home/group06/workspace/project-team-6/Week3/wandb/run-20260110_173505-6quutuqb
wandb: Run `wandb offline` to turn off syncing.
wandb: Syncing run Sweep run
wandb: ⭐️ View project at https://wandb.ai/mcv-team-6/C3-Week3
wandb: 🧹 View sweep at https://wandb.ai/mcv-team-6/C3-Week3/sweeps/k5ns8jzl
wandb: 🚀 View run at https://wandb.ai/mcv-team-6/C3-Week3/runs/6quutuqb
2026-01-10 17:35:05,831 - wandb.wandb_agent - INFO - Running runs: ['6quutuqb']
TRAINING THE MODEL:   0%|          | 0/500 [00:00<?, ?it/s]TRAINING THE MODEL:   0%|          | 1/500 [00:04<36:49,  4.43s/it]TRAINING THE MODEL:   0%|          | 2/500 [00:07<30:02,  3.62s/it]TRAINING THE MODEL:   1%|          | 3/500 [00:10<27:53,  3.37s/it]TRAINING THE MODEL:   1%|          | 4/500 [00:13<27:00,  3.27s/it]TRAINING THE MODEL:   1%|          | 5/500 [00:16<26:30,  3.21s/it]TRAINING THE MODEL:   1%|          | 6/500 [00:19<26:03,  3.16s/it]TRAINING THE MODEL:   1%|▏         | 7/500 [00:22<25:43,  3.13s/it]TRAINING THE MODEL:   2%|▏         | 8/500 [00:25<25:31,  3.11s/it]TRAINING THE MODEL:   2%|▏         | 9/500 [00:29<25:20,  3.10s/it]TRAINING THE MODEL:   2%|▏         | 10/500 [00:32<25:13,  3.09s/it]TRAINING THE MODEL:   2%|▏         | 11/500 [00:35<25:10,  3.09s/it]TRAINING THE MODEL:   2%|▏         | 12/500 [00:38<25:11,  3.10s/it]TRAINING THE MODEL:   3%|▎         | 13/500 [00:41<25:11,  3.10s/it]TRAINING THE MODEL:   3%|▎         | 14/500 [00:44<25:09,  3.10s/it]TRAINING THE MODEL:   3%|▎         | 15/500 [00:47<25:05,  3.10s/it]TRAINING THE MODEL:   3%|▎         | 16/500 [00:50<25:03,  3.11s/it]TRAINING THE MODEL:   3%|▎         | 17/500 [00:53<25:01,  3.11s/it]TRAINING THE MODEL:   4%|▎         | 18/500 [00:56<24:52,  3.10s/it]TRAINING THE MODEL:   4%|▍         | 19/500 [01:00<24:46,  3.09s/it]TRAINING THE MODEL:   4%|▍         | 20/500 [01:03<26:09,  3.27s/it]TRAINING THE MODEL:   4%|▍         | 21/500 [01:06<25:40,  3.22s/it]TRAINING THE MODEL:   4%|▍         | 22/500 [01:09<25:16,  3.17s/it]TRAINING THE MODEL:   5%|▍         | 23/500 [01:12<25:00,  3.15s/it]TRAINING THE MODEL:   5%|▍         | 24/500 [01:16<24:46,  3.12s/it]TRAINING THE MODEL:   5%|▌         | 25/500 [01:19<24:38,  3.11s/it]TRAINING THE MODEL:   5%|▌         | 26/500 [01:22<25:54,  3.28s/it]TRAINING THE MODEL:   5%|▌         | 27/500 [01:25<25:32,  3.24s/it]TRAINING THE MODEL:   6%|▌         | 28/500 [01:29<25:08,  3.20s/it]TRAINING THE MODEL:   6%|▌         | 29/500 [01:32<24:49,  3.16s/it]TRAINING THE MODEL:   6%|▌         | 30/500 [01:35<25:53,  3.31s/it]TRAINING THE MODEL:   6%|▌         | 31/500 [01:38<25:19,  3.24s/it]TRAINING THE MODEL:   6%|▋         | 32/500 [01:42<25:10,  3.23s/it]TRAINING THE MODEL:   7%|▋         | 33/500 [01:45<24:46,  3.18s/it]TRAINING THE MODEL:   7%|▋         | 34/500 [01:48<24:37,  3.17s/it]TRAINING THE MODEL:   7%|▋         | 35/500 [01:51<24:22,  3.15s/it]TRAINING THE MODEL:   7%|▋         | 36/500 [01:54<24:10,  3.13s/it]TRAINING THE MODEL:   7%|▋         | 37/500 [01:57<24:09,  3.13s/it]TRAINING THE MODEL:   8%|▊         | 38/500 [02:00<24:08,  3.14s/it]TRAINING THE MODEL:   8%|▊         | 39/500 [02:03<24:05,  3.14s/it]TRAINING THE MODEL:   8%|▊         | 40/500 [02:07<25:22,  3.31s/it]TRAINING THE MODEL:   8%|▊         | 40/500 [02:10<25:03,  3.27s/it]
wandb: updating run metadata
wandb: uploading output.log
wandb: uploading history steps 36-40, summary, console lines 37-47
wandb: 
wandb: Run history:
wandb:          epoch ▁▁▁▂▂▂▂▂▂▃▃▃▃▃▃▄▄▄▄▄▅▅▅▅▅▅▆▆▆▆▆▆▇▇▇▇▇▇██
wandb:  test_accuracy ▁▄▆▇▇███████████████████████████████████
wandb:      test_loss █▇▅▄▃▂▂▂▁▁▁▁▁▁▁▁▁▁▁▁▁▁▁▁▁▁▁▁▁▁▁▁▁▁▁▁▁▁▁▁
wandb: train_accuracy ▁▅▆▇▇▇▇█████████████████████████████████
wandb:     train_loss █▆▅▄▃▃▂▂▂▂▂▁▁▁▁▁▁▁▁▁▁▁▁▁▁▁▁▁▁▁▁▁▁▁▁▁▁▁▁▁
wandb: 
wandb: Run summary:
wandb:          epoch 40
wandb:  test_accuracy 0.941
wandb:      test_loss 0.36241
wandb: train_accuracy 0.9925
wandb:     train_loss 0.21977
wandb: 
wandb: 🚀 View run Sweep run at: https://wandb.ai/mcv-team-6/C3-Week3/runs/6quutuqb
wandb: ⭐️ View project at: https://wandb.ai/mcv-team-6/C3-Week3
wandb: Synced 5 W&B file(s), 0 media file(s), 0 artifact file(s) and 0 other file(s)
wandb: Find logs at: ./wandb/run-20260110_173505-6quutuqb/logs
2026-01-10 17:37:24,850 - wandb.wandb_agent - INFO - Cleaning up finished run: 6quutuqb
wandb: Terminating and syncing runs. Press ctrl-c to kill.
