wandb: Starting wandb agent 🕵️
2026-01-10 22:16:39,840 - wandb.wandb_agent - INFO - Running runs: []
2026-01-10 22:16:40,161 - wandb.wandb_agent - INFO - Agent received command: run
2026-01-10 22:16:40,161 - wandb.wandb_agent - INFO - Agent starting run with config:
	affine: 0.999824786754584
	blur: 0.10983470335439773
	brightness: 1.2400722211311936
	contrast: 0.9547946380331328
	crop: 0.5609661763328506
	crop_scale: 0.4451243212683578
	flip: 0.02440622768183509
	gaussian_blur_kernel: 9
	gaussian_noise_std: 0.20531301569800708
	grey: 0.8065608870372918
	hue: 0.2342078898597952
	jiggle: 0.7417223496620315
	rotate: 0.018627559839616836
	rotation: 48
	saturation: 0.7854478649924003
	scale: 0.9103397998747704
	shear: 3
	translate_x: 0.2341371309128909
	translate_y: 0.2963064548170859
2026-01-10 22:16:40,165 - wandb.wandb_agent - INFO - About to run command: /usr/bin/env python train_data.py --affine=0.999824786754584 --blur=0.10983470335439773 --brightness=1.2400722211311936 --contrast=0.9547946380331328 --crop=0.5609661763328506 --crop_scale=0.4451243212683578 --flip=0.02440622768183509 --gaussian_blur_kernel=9 --gaussian_noise_std=0.20531301569800708 --grey=0.8065608870372918 --hue=0.2342078898597952 --jiggle=0.7417223496620315 --rotate=0.018627559839616836 --rotation=48 --saturation=0.7854478649924003 --scale=0.9103397998747704 --shear=3 --translate_x=0.2341371309128909 --translate_y=0.2963064548170859
wandb: Currently logged in as: arnaumarcosalmansa (mcv-team-6) to https://api.wandb.ai. Use `wandb login --relogin` to force relogin
wandb: WARNING Ignoring project 'C3-Week3' when running a sweep.
wandb: WARNING Ignoring entity 'mcv-team-6' when running a sweep.
2026-01-10 22:16:45,172 - wandb.wandb_agent - INFO - Running runs: ['xjjr2hx3']
wandb: Tracking run with wandb version 0.23.1
wandb: Run data is saved locally in /export/home/group06/workspace/project-team-6/Week3/wandb/run-20260110_221644-xjjr2hx3
wandb: Run `wandb offline` to turn off syncing.
wandb: Syncing run Sweep run
wandb: ⭐️ View project at https://wandb.ai/mcv-team-6/C3-Week3
wandb: 🧹 View sweep at https://wandb.ai/mcv-team-6/C3-Week3/sweeps/ig5z7cnx
wandb: 🚀 View run at https://wandb.ai/mcv-team-6/C3-Week3/runs/xjjr2hx3
TRAINING THE MODEL:   0%|          | 0/500 [00:00<?, ?it/s]TRAINING THE MODEL:   0%|          | 1/500 [00:04<37:19,  4.49s/it]TRAINING THE MODEL:   0%|          | 2/500 [00:07<30:53,  3.72s/it]TRAINING THE MODEL:   1%|          | 3/500 [00:10<28:52,  3.49s/it]TRAINING THE MODEL:   1%|          | 4/500 [00:14<27:54,  3.38s/it]TRAINING THE MODEL:   1%|          | 5/500 [00:17<27:19,  3.31s/it]TRAINING THE MODEL:   1%|          | 6/500 [00:20<26:49,  3.26s/it]TRAINING THE MODEL:   1%|▏         | 7/500 [00:23<26:36,  3.24s/it]TRAINING THE MODEL:   2%|▏         | 8/500 [00:26<26:22,  3.22s/it]TRAINING THE MODEL:   2%|▏         | 9/500 [00:30<26:19,  3.22s/it]TRAINING THE MODEL:   2%|▏         | 10/500 [00:33<26:13,  3.21s/it]TRAINING THE MODEL:   2%|▏         | 11/500 [00:36<26:08,  3.21s/it]TRAINING THE MODEL:   2%|▏         | 12/500 [00:39<26:14,  3.23s/it]TRAINING THE MODEL:   3%|▎         | 13/500 [00:42<26:08,  3.22s/it]TRAINING THE MODEL:   3%|▎         | 14/500 [00:46<26:14,  3.24s/it]TRAINING THE MODEL:   3%|▎         | 15/500 [00:49<26:11,  3.24s/it]TRAINING THE MODEL:   3%|▎         | 16/500 [00:52<26:08,  3.24s/it]TRAINING THE MODEL:   3%|▎         | 17/500 [00:55<26:05,  3.24s/it]TRAINING THE MODEL:   4%|▎         | 18/500 [00:59<26:00,  3.24s/it]TRAINING THE MODEL:   4%|▍         | 19/500 [01:02<25:54,  3.23s/it]TRAINING THE MODEL:   4%|▍         | 20/500 [01:06<27:12,  3.40s/it]TRAINING THE MODEL:   4%|▍         | 21/500 [01:09<26:46,  3.35s/it]TRAINING THE MODEL:   4%|▍         | 22/500 [01:12<26:26,  3.32s/it]TRAINING THE MODEL:   5%|▍         | 23/500 [01:15<26:13,  3.30s/it]TRAINING THE MODEL:   5%|▍         | 24/500 [01:19<26:04,  3.29s/it]TRAINING THE MODEL:   5%|▌         | 25/500 [01:22<25:50,  3.26s/it]TRAINING THE MODEL:   5%|▌         | 26/500 [01:25<25:44,  3.26s/it]TRAINING THE MODEL:   5%|▌         | 27/500 [01:28<25:36,  3.25s/it]TRAINING THE MODEL:   6%|▌         | 28/500 [01:32<25:36,  3.26s/it]TRAINING THE MODEL:   6%|▌         | 29/500 [01:35<25:31,  3.25s/it]TRAINING THE MODEL:   6%|▌         | 30/500 [01:39<26:51,  3.43s/it]TRAINING THE MODEL:   6%|▌         | 31/500 [01:42<26:20,  3.37s/it]TRAINING THE MODEL:   6%|▋         | 32/500 [01:45<26:00,  3.33s/it]TRAINING THE MODEL:   7%|▋         | 33/500 [01:48<25:45,  3.31s/it]TRAINING THE MODEL:   7%|▋         | 34/500 [01:52<25:33,  3.29s/it]TRAINING THE MODEL:   7%|▋         | 35/500 [01:55<25:17,  3.26s/it]TRAINING THE MODEL:   7%|▋         | 36/500 [01:58<25:09,  3.25s/it]TRAINING THE MODEL:   7%|▋         | 37/500 [02:01<25:19,  3.28s/it]TRAINING THE MODEL:   8%|▊         | 38/500 [02:05<25:06,  3.26s/it]TRAINING THE MODEL:   8%|▊         | 39/500 [02:08<24:57,  3.25s/it]TRAINING THE MODEL:   8%|▊         | 40/500 [02:12<26:13,  3.42s/it]TRAINING THE MODEL:   8%|▊         | 41/500 [02:15<25:41,  3.36s/it]TRAINING THE MODEL:   8%|▊         | 42/500 [02:18<25:17,  3.31s/it]TRAINING THE MODEL:   9%|▊         | 43/500 [02:21<24:59,  3.28s/it]TRAINING THE MODEL:   9%|▉         | 44/500 [02:25<24:46,  3.26s/it]TRAINING THE MODEL:   9%|▉         | 45/500 [02:28<24:34,  3.24s/it]TRAINING THE MODEL:   9%|▉         | 46/500 [02:31<24:28,  3.24s/it]TRAINING THE MODEL:   9%|▉         | 47/500 [02:34<24:25,  3.23s/it]TRAINING THE MODEL:  10%|▉         | 48/500 [02:37<24:19,  3.23s/it]TRAINING THE MODEL:  10%|▉         | 49/500 [02:41<24:13,  3.22s/it]TRAINING THE MODEL:  10%|█         | 50/500 [02:44<25:03,  3.34s/it]TRAINING THE MODEL:  10%|█         | 51/500 [02:47<24:44,  3.31s/it]TRAINING THE MODEL:  10%|█         | 52/500 [02:51<24:38,  3.30s/it]TRAINING THE MODEL:  11%|█         | 53/500 [02:54<24:36,  3.30s/it]TRAINING THE MODEL:  11%|█         | 54/500 [02:57<24:32,  3.30s/it]TRAINING THE MODEL:  11%|█         | 55/500 [03:01<24:18,  3.28s/it]TRAINING THE MODEL:  11%|█         | 56/500 [03:04<24:05,  3.26s/it]TRAINING THE MODEL:  11%|█▏        | 57/500 [03:07<23:55,  3.24s/it]TRAINING THE MODEL:  12%|█▏        | 58/500 [03:10<23:44,  3.22s/it]TRAINING THE MODEL:  12%|█▏        | 59/500 [03:13<23:42,  3.23s/it]TRAINING THE MODEL:  12%|█▏        | 60/500 [03:17<24:50,  3.39s/it]TRAINING THE MODEL:  12%|█▏        | 60/500 [03:20<24:33,  3.35s/it]
wandb: updating run metadata
wandb: uploading output.log; uploading config.yaml
wandb: uploading history steps 58-60, summary, console lines 59-67
wandb: 
wandb: Run history:
wandb:          epoch ▁▁▂▂▂▂▂▂▃▃▃▃▃▃▄▄▄▄▄▄▅▅▅▅▅▅▆▆▆▆▇▇▇▇▇▇▇███
wandb:  test_accuracy ▁▄▅▆▆▇▇▇████████████████████████████████
wandb:      test_loss █▇▆▃▃▂▂▂▂▂▁▁▁▁▁▁▁▁▁▁▁▁▁▁▁▁▁▁▁▁▁▁▁▁▁▁▁▁▁▁
wandb: train_accuracy ▁▂▄▅▆▇▇▇▇▇▇▇▇▇▇█████████████████████████
wandb:     train_loss █▇▆▆▅▄▄▃▂▂▂▂▂▂▁▁▂▁▁▁▂▁▁▁▁▁▁▁▁▁▁▁▁▁▁▁▁▁▁▁
wandb: 
wandb: Run summary:
wandb:          epoch 60
wandb:  test_accuracy 0.93269
wandb:      test_loss 0.33297
wandb: train_accuracy 0.975
wandb:     train_loss 0.20777
wandb: 
wandb: 🚀 View run Sweep run at: https://wandb.ai/mcv-team-6/C3-Week3/runs/xjjr2hx3
wandb: ⭐️ View project at: https://wandb.ai/mcv-team-6/C3-Week3
wandb: Synced 5 W&B file(s), 0 media file(s), 0 artifact file(s) and 0 other file(s)
wandb: Find logs at: ./wandb/run-20260110_221644-xjjr2hx3/logs
2026-01-10 22:20:16,245 - wandb.wandb_agent - INFO - Cleaning up finished run: xjjr2hx3
wandb: Terminating and syncing runs. Press ctrl-c to kill.
