wandb: Starting wandb agent 🕵️
2026-01-10 20:47:53,560 - wandb.wandb_agent - INFO - Running runs: []
2026-01-10 20:47:53,951 - wandb.wandb_agent - INFO - Agent received command: run
2026-01-10 20:47:53,951 - wandb.wandb_agent - INFO - Agent starting run with config:
	affine: 0.950656406024262
	blur: 0.0769869826156514
	brightness: 0.6528439649025348
	contrast: 1.2819918743099783
	crop: 0.39767358603158287
	crop_scale: 0.5796712763230438
	flip: 0.21301916577543537
	gaussian_blur_kernel: 9
	gaussian_noise_std: 1.5433407849834038
	grey: 0.9807003415674972
	hue: 0.09501189405761772
	jiggle: 0.8306905509062777
	rotate: 0.12454748639983836
	rotation: 43
	saturation: 1.1464796168107263
	scale: 1.0646081138533046
	shear: 22
	translate_x: 0.3554011435398099
	translate_y: 0.2711081795169576
2026-01-10 20:47:53,955 - wandb.wandb_agent - INFO - About to run command: /usr/bin/env python train_data.py --affine=0.950656406024262 --blur=0.0769869826156514 --brightness=0.6528439649025348 --contrast=1.2819918743099783 --crop=0.39767358603158287 --crop_scale=0.5796712763230438 --flip=0.21301916577543537 --gaussian_blur_kernel=9 --gaussian_noise_std=1.5433407849834038 --grey=0.9807003415674972 --hue=0.09501189405761772 --jiggle=0.8306905509062777 --rotate=0.12454748639983836 --rotation=43 --saturation=1.1464796168107263 --scale=1.0646081138533046 --shear=22 --translate_x=0.3554011435398099 --translate_y=0.2711081795169576
wandb: Currently logged in as: arnaumarcosalmansa (mcv-team-6) to https://api.wandb.ai. Use `wandb login --relogin` to force relogin
wandb: WARNING Ignoring project 'C3-Week3' when running a sweep.
wandb: WARNING Ignoring entity 'mcv-team-6' when running a sweep.
2026-01-10 20:47:58,961 - wandb.wandb_agent - INFO - Running runs: ['l8txzdzd']
wandb: setting up run l8txzdzd
wandb: Tracking run with wandb version 0.23.1
wandb: Run data is saved locally in /export/home/group06/workspace/project-team-6/Week3/wandb/run-20260110_204758-l8txzdzd
wandb: Run `wandb offline` to turn off syncing.
wandb: Syncing run Sweep run
wandb: ⭐️ View project at https://wandb.ai/mcv-team-6/C3-Week3
wandb: 🧹 View sweep at https://wandb.ai/mcv-team-6/C3-Week3/sweeps/8yeenlu8
wandb: 🚀 View run at https://wandb.ai/mcv-team-6/C3-Week3/runs/l8txzdzd
TRAINING THE MODEL:   0%|          | 0/500 [00:00<?, ?it/s]TRAINING THE MODEL:   0%|          | 1/500 [00:04<37:13,  4.48s/it]TRAINING THE MODEL:   0%|          | 2/500 [00:07<31:00,  3.74s/it]TRAINING THE MODEL:   1%|          | 3/500 [00:10<29:05,  3.51s/it]TRAINING THE MODEL:   1%|          | 4/500 [00:14<28:07,  3.40s/it]TRAINING THE MODEL:   1%|          | 5/500 [00:17<27:56,  3.39s/it]TRAINING THE MODEL:   1%|          | 6/500 [00:20<27:32,  3.34s/it]TRAINING THE MODEL:   1%|▏         | 7/500 [00:23<27:05,  3.30s/it]TRAINING THE MODEL:   2%|▏         | 8/500 [00:27<27:05,  3.30s/it]TRAINING THE MODEL:   2%|▏         | 9/500 [00:30<26:47,  3.27s/it]TRAINING THE MODEL:   2%|▏         | 10/500 [00:33<26:32,  3.25s/it]TRAINING THE MODEL:   2%|▏         | 11/500 [00:37<26:47,  3.29s/it]TRAINING THE MODEL:   2%|▏         | 12/500 [00:40<27:16,  3.35s/it]TRAINING THE MODEL:   3%|▎         | 13/500 [00:43<27:08,  3.34s/it]TRAINING THE MODEL:   3%|▎         | 14/500 [00:47<26:49,  3.31s/it]TRAINING THE MODEL:   3%|▎         | 15/500 [00:50<26:36,  3.29s/it]TRAINING THE MODEL:   3%|▎         | 16/500 [00:53<26:41,  3.31s/it]TRAINING THE MODEL:   3%|▎         | 17/500 [00:57<26:46,  3.33s/it]TRAINING THE MODEL:   4%|▎         | 18/500 [01:00<26:36,  3.31s/it]TRAINING THE MODEL:   4%|▍         | 19/500 [01:03<26:46,  3.34s/it]TRAINING THE MODEL:   4%|▍         | 20/500 [01:07<27:57,  3.50s/it]TRAINING THE MODEL:   4%|▍         | 21/500 [01:10<27:25,  3.43s/it]TRAINING THE MODEL:   4%|▍         | 22/500 [01:14<27:40,  3.47s/it]TRAINING THE MODEL:   5%|▍         | 23/500 [01:17<27:03,  3.40s/it]TRAINING THE MODEL:   5%|▍         | 24/500 [01:21<26:41,  3.36s/it]TRAINING THE MODEL:   5%|▌         | 25/500 [01:24<26:14,  3.31s/it]TRAINING THE MODEL:   5%|▌         | 26/500 [01:27<26:01,  3.29s/it]TRAINING THE MODEL:   5%|▌         | 27/500 [01:30<25:54,  3.29s/it]TRAINING THE MODEL:   6%|▌         | 28/500 [01:33<25:42,  3.27s/it]TRAINING THE MODEL:   6%|▌         | 29/500 [01:37<25:34,  3.26s/it]TRAINING THE MODEL:   6%|▌         | 30/500 [01:40<26:33,  3.39s/it]TRAINING THE MODEL:   6%|▌         | 31/500 [01:44<26:06,  3.34s/it]TRAINING THE MODEL:   6%|▋         | 32/500 [01:47<25:45,  3.30s/it]TRAINING THE MODEL:   7%|▋         | 33/500 [01:50<25:29,  3.28s/it]TRAINING THE MODEL:   7%|▋         | 34/500 [01:53<25:15,  3.25s/it]TRAINING THE MODEL:   7%|▋         | 35/500 [01:56<25:08,  3.24s/it]TRAINING THE MODEL:   7%|▋         | 36/500 [02:00<25:01,  3.24s/it]TRAINING THE MODEL:   7%|▋         | 37/500 [02:03<24:53,  3.23s/it]TRAINING THE MODEL:   8%|▊         | 38/500 [02:07<25:55,  3.37s/it]TRAINING THE MODEL:   8%|▊         | 39/500 [02:10<25:31,  3.32s/it]TRAINING THE MODEL:   8%|▊         | 40/500 [02:13<26:11,  3.42s/it]TRAINING THE MODEL:   8%|▊         | 41/500 [02:17<25:39,  3.35s/it]TRAINING THE MODEL:   8%|▊         | 42/500 [02:20<25:16,  3.31s/it]TRAINING THE MODEL:   9%|▊         | 43/500 [02:23<25:02,  3.29s/it]TRAINING THE MODEL:   9%|▉         | 44/500 [02:26<24:48,  3.26s/it]TRAINING THE MODEL:   9%|▉         | 45/500 [02:30<25:00,  3.30s/it]TRAINING THE MODEL:   9%|▉         | 46/500 [02:33<24:54,  3.29s/it]TRAINING THE MODEL:   9%|▉         | 47/500 [02:36<24:39,  3.27s/it]TRAINING THE MODEL:  10%|▉         | 48/500 [02:39<24:32,  3.26s/it]TRAINING THE MODEL:  10%|▉         | 49/500 [02:44<27:07,  3.61s/it]TRAINING THE MODEL:  10%|█         | 50/500 [02:48<28:20,  3.78s/it]TRAINING THE MODEL:  10%|█         | 51/500 [02:51<27:14,  3.64s/it]TRAINING THE MODEL:  10%|█         | 52/500 [02:55<26:22,  3.53s/it]TRAINING THE MODEL:  11%|█         | 53/500 [02:58<25:37,  3.44s/it]TRAINING THE MODEL:  11%|█         | 54/500 [03:01<25:04,  3.37s/it]TRAINING THE MODEL:  11%|█         | 55/500 [03:04<24:39,  3.32s/it]TRAINING THE MODEL:  11%|█         | 56/500 [03:07<24:20,  3.29s/it]TRAINING THE MODEL:  11%|█▏        | 57/500 [03:11<24:23,  3.30s/it]TRAINING THE MODEL:  12%|█▏        | 58/500 [03:14<24:22,  3.31s/it]TRAINING THE MODEL:  12%|█▏        | 59/500 [03:17<24:07,  3.28s/it]TRAINING THE MODEL:  12%|█▏        | 60/500 [03:21<24:52,  3.39s/it]TRAINING THE MODEL:  12%|█▏        | 61/500 [03:24<24:34,  3.36s/it]TRAINING THE MODEL:  12%|█▏        | 62/500 [03:27<24:11,  3.31s/it]TRAINING THE MODEL:  13%|█▎        | 63/500 [03:31<24:09,  3.32s/it]TRAINING THE MODEL:  13%|█▎        | 64/500 [03:34<24:00,  3.30s/it]TRAINING THE MODEL:  13%|█▎        | 64/500 [03:37<24:44,  3.41s/it]
wandb: updating run metadata
wandb: uploading output.log; uploading config.yaml
wandb: uploading history steps 61-64, summary, console lines 62-71
wandb: 
wandb: Run history:
wandb:          epoch ▁▁▁▁▁▂▂▂▂▃▃▃▃▃▃▄▄▄▄▄▅▅▅▅▅▆▆▆▆▆▆▇▇▇▇▇▇███
wandb:  test_accuracy ▁▂▄▅▆▇▇▇▇▇▇▆▆▇█▇██▇███▇▇█▇▇▇████████████
wandb:      test_loss █▆▅▅▄▄▃▃▂▂▃▃▃▂▂▁▁▂▁▁▂▁▂▁▂▁▁▁▁▁▁▂▁▂▁▁▁▁▁▂
wandb: train_accuracy ▁▆▆▇▇▇▇▇▇▇▇█▇▇██████████████████████████
wandb:     train_loss █▆▅▅▄▃▃▂▂▂▂▂▂▂▂▁▁▁▁▁▁▁▁▁▁▁▁▁▁▁▁▁▁▁▁▁▁▁▁▁
wandb: 
wandb: Run summary:
wandb:          epoch 64
wandb:  test_accuracy 0.86582
wandb:      test_loss 0.48391
wandb: train_accuracy 0.9775
wandb:     train_loss 0.23103
wandb: 
wandb: 🚀 View run Sweep run at: https://wandb.ai/mcv-team-6/C3-Week3/runs/l8txzdzd
wandb: ⭐️ View project at: https://wandb.ai/mcv-team-6/C3-Week3
wandb: Synced 5 W&B file(s), 0 media file(s), 0 artifact file(s) and 0 other file(s)
wandb: Find logs at: ./wandb/run-20260110_204758-l8txzdzd/logs
2026-01-10 20:51:45,556 - wandb.wandb_agent - INFO - Cleaning up finished run: l8txzdzd
wandb: Terminating and syncing runs. Press ctrl-c to kill.
