wandb: Starting wandb agent 🕵️
2026-01-10 20:57:54,702 - wandb.wandb_agent - INFO - Running runs: []
2026-01-10 20:57:55,043 - wandb.wandb_agent - INFO - Agent received command: run
2026-01-10 20:57:55,043 - wandb.wandb_agent - INFO - Agent starting run with config:
	affine: 0.7467089178903502
	blur: 0.3997597230559825
	brightness: 1.1425657457066796
	contrast: 1.0244755272614636
	crop: 0.6304784787720048
	crop_scale: 0.9162185311885812
	flip: 0.5073371564036556
	gaussian_blur_kernel: 7
	gaussian_noise_std: 0.44229507405520785
	grey: 0.9343386443519776
	hue: 0.08160810533112417
	jiggle: 0.5537791956886484
	rotate: 0.6495030084392116
	rotation: 25
	saturation: 0.8547134069219867
	scale: 1.198868719416379
	shear: 11
	translate_x: 0.06996355035578619
	translate_y: 0.07955594379579983
2026-01-10 20:57:55,047 - wandb.wandb_agent - INFO - About to run command: /usr/bin/env python train_data.py --affine=0.7467089178903502 --blur=0.3997597230559825 --brightness=1.1425657457066796 --contrast=1.0244755272614636 --crop=0.6304784787720048 --crop_scale=0.9162185311885812 --flip=0.5073371564036556 --gaussian_blur_kernel=7 --gaussian_noise_std=0.44229507405520785 --grey=0.9343386443519776 --hue=0.08160810533112417 --jiggle=0.5537791956886484 --rotate=0.6495030084392116 --rotation=25 --saturation=0.8547134069219867 --scale=1.198868719416379 --shear=11 --translate_x=0.06996355035578619 --translate_y=0.07955594379579983
wandb: Currently logged in as: arnaumarcosalmansa (mcv-team-6) to https://api.wandb.ai. Use `wandb login --relogin` to force relogin
wandb: WARNING Ignoring project 'C3-Week3' when running a sweep.
wandb: WARNING Ignoring entity 'mcv-team-6' when running a sweep.
2026-01-10 20:58:00,053 - wandb.wandb_agent - INFO - Running runs: ['ck2aciud']
wandb: setting up run ck2aciud
wandb: Tracking run with wandb version 0.23.1
wandb: Run data is saved locally in /export/home/group06/workspace/project-team-6/Week3/wandb/run-20260110_205759-ck2aciud
wandb: Run `wandb offline` to turn off syncing.
wandb: Syncing run Sweep run
wandb: ⭐️ View project at https://wandb.ai/mcv-team-6/C3-Week3
wandb: 🧹 View sweep at https://wandb.ai/mcv-team-6/C3-Week3/sweeps/ig5z7cnx
wandb: 🚀 View run at https://wandb.ai/mcv-team-6/C3-Week3/runs/ck2aciud
TRAINING THE MODEL:   0%|          | 0/500 [00:00<?, ?it/s]TRAINING THE MODEL:   0%|          | 1/500 [00:04<37:42,  4.53s/it]TRAINING THE MODEL:   0%|          | 2/500 [00:07<30:57,  3.73s/it]TRAINING THE MODEL:   1%|          | 3/500 [00:10<28:45,  3.47s/it]TRAINING THE MODEL:   1%|          | 4/500 [00:14<27:48,  3.36s/it]TRAINING THE MODEL:   1%|          | 5/500 [00:17<27:16,  3.31s/it]TRAINING THE MODEL:   1%|          | 6/500 [00:20<26:56,  3.27s/it]TRAINING THE MODEL:   1%|▏         | 7/500 [00:23<26:42,  3.25s/it]TRAINING THE MODEL:   2%|▏         | 8/500 [00:26<26:29,  3.23s/it]TRAINING THE MODEL:   2%|▏         | 9/500 [00:30<26:25,  3.23s/it]TRAINING THE MODEL:   2%|▏         | 10/500 [00:33<26:20,  3.22s/it]TRAINING THE MODEL:   2%|▏         | 11/500 [00:36<26:11,  3.21s/it]TRAINING THE MODEL:   2%|▏         | 12/500 [00:39<26:09,  3.22s/it]TRAINING THE MODEL:   3%|▎         | 13/500 [00:42<26:11,  3.23s/it]TRAINING THE MODEL:   3%|▎         | 14/500 [00:46<26:13,  3.24s/it]TRAINING THE MODEL:   3%|▎         | 15/500 [00:49<26:13,  3.24s/it]TRAINING THE MODEL:   3%|▎         | 16/500 [00:52<26:11,  3.25s/it]TRAINING THE MODEL:   3%|▎         | 17/500 [00:55<26:07,  3.24s/it]TRAINING THE MODEL:   4%|▎         | 18/500 [00:59<26:03,  3.24s/it]TRAINING THE MODEL:   4%|▍         | 19/500 [01:02<25:56,  3.24s/it]TRAINING THE MODEL:   4%|▍         | 20/500 [01:06<27:30,  3.44s/it]TRAINING THE MODEL:   4%|▍         | 21/500 [01:09<27:05,  3.39s/it]TRAINING THE MODEL:   4%|▍         | 22/500 [01:12<26:46,  3.36s/it]TRAINING THE MODEL:   5%|▍         | 23/500 [01:16<26:41,  3.36s/it]TRAINING THE MODEL:   5%|▍         | 24/500 [01:19<26:38,  3.36s/it]TRAINING THE MODEL:   5%|▌         | 25/500 [01:22<26:20,  3.33s/it]TRAINING THE MODEL:   5%|▌         | 26/500 [01:26<26:02,  3.30s/it]TRAINING THE MODEL:   5%|▌         | 27/500 [01:29<25:56,  3.29s/it]TRAINING THE MODEL:   6%|▌         | 28/500 [01:32<25:49,  3.28s/it]TRAINING THE MODEL:   6%|▌         | 29/500 [01:35<25:47,  3.29s/it]TRAINING THE MODEL:   6%|▌         | 30/500 [01:39<27:11,  3.47s/it]TRAINING THE MODEL:   6%|▌         | 31/500 [01:43<26:38,  3.41s/it]TRAINING THE MODEL:   6%|▋         | 32/500 [01:46<27:16,  3.50s/it]TRAINING THE MODEL:   7%|▋         | 33/500 [01:50<26:39,  3.42s/it]TRAINING THE MODEL:   7%|▋         | 34/500 [01:53<26:15,  3.38s/it]TRAINING THE MODEL:   7%|▋         | 35/500 [01:56<25:55,  3.34s/it]TRAINING THE MODEL:   7%|▋         | 36/500 [01:59<25:37,  3.31s/it]TRAINING THE MODEL:   7%|▋         | 37/500 [02:03<25:24,  3.29s/it]TRAINING THE MODEL:   8%|▊         | 38/500 [02:06<25:14,  3.28s/it]TRAINING THE MODEL:   8%|▊         | 39/500 [02:09<25:13,  3.28s/it]TRAINING THE MODEL:   8%|▊         | 40/500 [02:13<26:16,  3.43s/it]TRAINING THE MODEL:   8%|▊         | 41/500 [02:16<25:55,  3.39s/it]TRAINING THE MODEL:   8%|▊         | 42/500 [02:19<25:32,  3.35s/it]TRAINING THE MODEL:   9%|▊         | 43/500 [02:23<25:26,  3.34s/it]TRAINING THE MODEL:   9%|▉         | 44/500 [02:26<25:10,  3.31s/it]TRAINING THE MODEL:   9%|▉         | 45/500 [02:29<25:01,  3.30s/it]TRAINING THE MODEL:   9%|▉         | 46/500 [02:33<24:49,  3.28s/it]TRAINING THE MODEL:   9%|▉         | 47/500 [02:36<24:39,  3.27s/it]TRAINING THE MODEL:  10%|▉         | 48/500 [02:39<24:37,  3.27s/it]TRAINING THE MODEL:  10%|▉         | 49/500 [02:42<24:34,  3.27s/it]TRAINING THE MODEL:  10%|█         | 50/500 [02:46<25:34,  3.41s/it]TRAINING THE MODEL:  10%|█         | 51/500 [02:49<25:08,  3.36s/it]TRAINING THE MODEL:  10%|█         | 52/500 [02:53<24:49,  3.33s/it]TRAINING THE MODEL:  11%|█         | 53/500 [02:56<24:37,  3.30s/it]TRAINING THE MODEL:  11%|█         | 54/500 [02:59<24:35,  3.31s/it]TRAINING THE MODEL:  11%|█         | 55/500 [03:03<25:01,  3.37s/it]TRAINING THE MODEL:  11%|█         | 56/500 [03:07<27:45,  3.75s/it]TRAINING THE MODEL:  11%|█▏        | 57/500 [03:11<26:48,  3.63s/it]TRAINING THE MODEL:  12%|█▏        | 58/500 [03:14<26:00,  3.53s/it]TRAINING THE MODEL:  12%|█▏        | 59/500 [03:17<25:25,  3.46s/it]TRAINING THE MODEL:  12%|█▏        | 60/500 [03:21<26:52,  3.66s/it]TRAINING THE MODEL:  12%|█▏        | 61/500 [03:25<25:56,  3.54s/it]TRAINING THE MODEL:  12%|█▏        | 62/500 [03:28<25:27,  3.49s/it]TRAINING THE MODEL:  13%|█▎        | 63/500 [03:31<25:04,  3.44s/it]TRAINING THE MODEL:  13%|█▎        | 64/500 [03:35<24:56,  3.43s/it]TRAINING THE MODEL:  13%|█▎        | 65/500 [03:38<24:36,  3.40s/it]TRAINING THE MODEL:  13%|█▎        | 66/500 [03:41<24:15,  3.35s/it]TRAINING THE MODEL:  13%|█▎        | 67/500 [03:45<24:00,  3.33s/it]TRAINING THE MODEL:  14%|█▎        | 68/500 [03:48<23:51,  3.31s/it]TRAINING THE MODEL:  14%|█▍        | 69/500 [03:51<23:40,  3.30s/it]TRAINING THE MODEL:  14%|█▍        | 69/500 [03:55<24:30,  3.41s/it]
wandb: updating run metadata
wandb: uploading output.log; uploading config.yaml
wandb: uploading history steps 66-69, summary, console lines 67-76
wandb: 
wandb: Run history:
wandb:          epoch ▁▁▁▁▂▂▂▂▃▃▃▃▃▃▃▄▄▄▄▅▅▅▅▅▅▆▆▆▆▆▆▇▇▇▇▇▇███
wandb:  test_accuracy ▁▄▅▆▇███████████████████████████████████
wandb:      test_loss █▇▆▅▄▄▃▂▂▁▁▁▁▁▁▁▁▁▁▁▁▁▁▁▁▁▁▁▁▁▁▁▁▁▁▁▁▁▁▁
wandb: train_accuracy ▁▃▅▇▇▇▇▇▇▇███▇██████████████████████████
wandb:     train_loss █▆▆▅▄▃▃▃▂▂▂▂▂▂▂▂▂▂▂▁▁▁▁▁▁▁▁▁▁▁▁▁▁▁▁▁▁▁▁▁
wandb: 
wandb: Run summary:
wandb:          epoch 69
wandb:  test_accuracy 0.93575
wandb:      test_loss 0.33334
wandb: train_accuracy 0.9875
wandb:     train_loss 0.19566
wandb: 
wandb: 🚀 View run Sweep run at: https://wandb.ai/mcv-team-6/C3-Week3/runs/ck2aciud
wandb: ⭐️ View project at: https://wandb.ai/mcv-team-6/C3-Week3
wandb: Synced 5 W&B file(s), 0 media file(s), 0 artifact file(s) and 0 other file(s)
wandb: Find logs at: ./wandb/run-20260110_205759-ck2aciud/logs
2026-01-10 21:02:02,103 - wandb.wandb_agent - INFO - Cleaning up finished run: ck2aciud
wandb: Terminating and syncing runs. Press ctrl-c to kill.
