wandb: Starting wandb agent 🕵️
2026-01-10 21:10:37,130 - wandb.wandb_agent - INFO - Running runs: []
2026-01-10 21:10:37,435 - wandb.wandb_agent - INFO - Agent received command: run
2026-01-10 21:10:37,435 - wandb.wandb_agent - INFO - Agent starting run with config:
	affine: 0.448222993468265
	blur: 0.07592758904647645
	brightness: 0.9038941431460208
	contrast: 0.6664791259221062
	crop: 0.25566425401510484
	crop_scale: 0.7037934868717601
	flip: 0.7413403739663961
	gaussian_blur_kernel: 3
	gaussian_noise_std: 1.849702639944633
	grey: 0.9371728530689438
	hue: 0.29765575780022213
	jiggle: 0.9775432805938992
	rotate: 0.5596660524876547
	rotation: 9
	saturation: 0.8721512611419281
	scale: 1.0457385898990683
	shear: 24
	translate_x: 0.20438157744996477
	translate_y: 0.22847906584145228
2026-01-10 21:10:37,439 - wandb.wandb_agent - INFO - About to run command: /usr/bin/env python train_data.py --affine=0.448222993468265 --blur=0.07592758904647645 --brightness=0.9038941431460208 --contrast=0.6664791259221062 --crop=0.25566425401510484 --crop_scale=0.7037934868717601 --flip=0.7413403739663961 --gaussian_blur_kernel=3 --gaussian_noise_std=1.849702639944633 --grey=0.9371728530689438 --hue=0.29765575780022213 --jiggle=0.9775432805938992 --rotate=0.5596660524876547 --rotation=9 --saturation=0.8721512611419281 --scale=1.0457385898990683 --shear=24 --translate_x=0.20438157744996477 --translate_y=0.22847906584145228
wandb: Currently logged in as: arnaumarcosalmansa (mcv-team-6) to https://api.wandb.ai. Use `wandb login --relogin` to force relogin
wandb: WARNING Ignoring project 'C3-Week3' when running a sweep.
wandb: WARNING Ignoring entity 'mcv-team-6' when running a sweep.
2026-01-10 21:10:42,446 - wandb.wandb_agent - INFO - Running runs: ['ztc5mmed']
wandb: setting up run ztc5mmed
wandb: Tracking run with wandb version 0.23.1
wandb: Run data is saved locally in /export/home/group06/workspace/project-team-6/Week3/wandb/run-20260110_211041-ztc5mmed
wandb: Run `wandb offline` to turn off syncing.
wandb: Syncing run Sweep run
wandb: ⭐️ View project at https://wandb.ai/mcv-team-6/C3-Week3
wandb: 🧹 View sweep at https://wandb.ai/mcv-team-6/C3-Week3/sweeps/ig5z7cnx
wandb: 🚀 View run at https://wandb.ai/mcv-team-6/C3-Week3/runs/ztc5mmed
TRAINING THE MODEL:   0%|          | 0/500 [00:00<?, ?it/s]TRAINING THE MODEL:   0%|          | 1/500 [00:04<38:10,  4.59s/it]TRAINING THE MODEL:   0%|          | 2/500 [00:07<31:24,  3.78s/it]TRAINING THE MODEL:   1%|          | 3/500 [00:11<29:16,  3.53s/it]TRAINING THE MODEL:   1%|          | 4/500 [00:14<28:15,  3.42s/it]TRAINING THE MODEL:   1%|          | 5/500 [00:17<27:39,  3.35s/it]TRAINING THE MODEL:   1%|          | 6/500 [00:20<27:23,  3.33s/it]TRAINING THE MODEL:   1%|▏         | 7/500 [00:24<27:12,  3.31s/it]TRAINING THE MODEL:   2%|▏         | 8/500 [00:27<27:12,  3.32s/it]TRAINING THE MODEL:   2%|▏         | 9/500 [00:30<27:20,  3.34s/it]TRAINING THE MODEL:   2%|▏         | 10/500 [00:34<27:18,  3.34s/it]TRAINING THE MODEL:   2%|▏         | 11/500 [00:37<27:37,  3.39s/it]TRAINING THE MODEL:   2%|▏         | 12/500 [00:41<27:34,  3.39s/it]TRAINING THE MODEL:   3%|▎         | 13/500 [00:44<27:42,  3.41s/it]TRAINING THE MODEL:   3%|▎         | 14/500 [00:47<27:35,  3.41s/it]TRAINING THE MODEL:   3%|▎         | 15/500 [00:51<27:50,  3.44s/it]TRAINING THE MODEL:   3%|▎         | 16/500 [00:54<27:36,  3.42s/it]TRAINING THE MODEL:   3%|▎         | 17/500 [00:58<27:33,  3.42s/it]TRAINING THE MODEL:   4%|▎         | 18/500 [01:01<27:53,  3.47s/it]TRAINING THE MODEL:   4%|▍         | 19/500 [01:05<28:09,  3.51s/it]TRAINING THE MODEL:   4%|▍         | 20/500 [01:09<29:12,  3.65s/it]TRAINING THE MODEL:   4%|▍         | 21/500 [01:12<28:50,  3.61s/it]TRAINING THE MODEL:   4%|▍         | 22/500 [01:16<28:18,  3.55s/it]TRAINING THE MODEL:   5%|▍         | 23/500 [01:19<27:52,  3.51s/it]TRAINING THE MODEL:   5%|▍         | 24/500 [01:23<27:39,  3.49s/it]TRAINING THE MODEL:   5%|▌         | 25/500 [01:26<27:22,  3.46s/it]TRAINING THE MODEL:   5%|▌         | 26/500 [01:29<27:11,  3.44s/it]TRAINING THE MODEL:   5%|▌         | 27/500 [01:33<27:06,  3.44s/it]TRAINING THE MODEL:   6%|▌         | 28/500 [01:36<27:02,  3.44s/it]TRAINING THE MODEL:   6%|▌         | 29/500 [01:40<27:16,  3.47s/it]TRAINING THE MODEL:   6%|▌         | 30/500 [01:44<28:17,  3.61s/it]TRAINING THE MODEL:   6%|▌         | 31/500 [01:47<27:46,  3.55s/it]TRAINING THE MODEL:   6%|▋         | 32/500 [01:51<27:19,  3.50s/it]TRAINING THE MODEL:   7%|▋         | 33/500 [01:54<27:31,  3.54s/it]TRAINING THE MODEL:   7%|▋         | 34/500 [01:58<27:19,  3.52s/it]TRAINING THE MODEL:   7%|▋         | 35/500 [02:01<27:36,  3.56s/it]TRAINING THE MODEL:   7%|▋         | 36/500 [02:05<27:25,  3.55s/it]TRAINING THE MODEL:   7%|▋         | 37/500 [02:09<28:01,  3.63s/it]TRAINING THE MODEL:   8%|▊         | 38/500 [02:12<27:34,  3.58s/it]TRAINING THE MODEL:   8%|▊         | 39/500 [02:16<27:06,  3.53s/it]TRAINING THE MODEL:   8%|▊         | 40/500 [02:20<28:50,  3.76s/it]TRAINING THE MODEL:   8%|▊         | 41/500 [02:23<27:50,  3.64s/it]TRAINING THE MODEL:   8%|▊         | 42/500 [02:27<27:15,  3.57s/it]TRAINING THE MODEL:   9%|▊         | 43/500 [02:30<27:19,  3.59s/it]TRAINING THE MODEL:   9%|▉         | 44/500 [02:34<27:13,  3.58s/it]TRAINING THE MODEL:   9%|▉         | 45/500 [02:37<26:51,  3.54s/it]TRAINING THE MODEL:   9%|▉         | 46/500 [02:41<26:34,  3.51s/it]TRAINING THE MODEL:   9%|▉         | 47/500 [02:44<26:45,  3.54s/it]TRAINING THE MODEL:  10%|▉         | 48/500 [02:48<26:40,  3.54s/it]TRAINING THE MODEL:  10%|▉         | 49/500 [02:51<26:23,  3.51s/it]TRAINING THE MODEL:  10%|█         | 50/500 [02:55<27:47,  3.71s/it]TRAINING THE MODEL:  10%|█         | 51/500 [02:59<27:06,  3.62s/it]TRAINING THE MODEL:  10%|█         | 52/500 [03:02<26:50,  3.59s/it]TRAINING THE MODEL:  11%|█         | 53/500 [03:06<26:23,  3.54s/it]TRAINING THE MODEL:  11%|█         | 54/500 [03:10<26:38,  3.58s/it]TRAINING THE MODEL:  11%|█         | 55/500 [03:13<26:10,  3.53s/it]TRAINING THE MODEL:  11%|█         | 56/500 [03:16<25:51,  3.49s/it]TRAINING THE MODEL:  11%|█▏        | 57/500 [03:20<25:34,  3.46s/it]TRAINING THE MODEL:  12%|█▏        | 58/500 [03:23<25:29,  3.46s/it]TRAINING THE MODEL:  12%|█▏        | 59/500 [03:27<25:20,  3.45s/it]TRAINING THE MODEL:  12%|█▏        | 60/500 [03:31<26:24,  3.60s/it]TRAINING THE MODEL:  12%|█▏        | 61/500 [03:34<26:05,  3.57s/it]TRAINING THE MODEL:  12%|█▏        | 62/500 [03:37<25:30,  3.49s/it]TRAINING THE MODEL:  13%|█▎        | 63/500 [03:41<25:35,  3.51s/it]TRAINING THE MODEL:  13%|█▎        | 64/500 [03:44<25:13,  3.47s/it]TRAINING THE MODEL:  13%|█▎        | 65/500 [03:48<25:00,  3.45s/it]TRAINING THE MODEL:  13%|█▎        | 66/500 [03:51<25:00,  3.46s/it]TRAINING THE MODEL:  13%|█▎        | 66/500 [03:55<25:47,  3.57s/it]
wandb: updating run metadata
wandb: uploading output.log; uploading config.yaml
wandb: uploading history steps 63-66, summary, console lines 64-73
wandb: 
wandb: Run history:
wandb:          epoch ▁▁▁▁▂▂▂▂▂▂▃▃▃▃▃▃▄▄▄▄▅▅▅▅▅▆▆▆▆▆▇▇▇▇▇▇████
wandb:  test_accuracy ▁▄▆▇▇▇▇████████████████████████▇████████
wandb:      test_loss █▇▆▄▄▃▂▂▂▂▁▁▁▁▁▁▁▁▁▁▁▁▁▁▁▁▁▁▁▁▁▁▁▂▁▁▁▁▁▁
wandb: train_accuracy ▁▅▆▆▇▇▇▇▇▇██████████████████████████████
wandb:     train_loss █▇▆▆▅▄▄▃▃▃▂▂▂▂▂▂▂▂▁▁▁▁▁▁▁▁▁▁▁▁▁▁▁▁▁▁▁▁▁▁
wandb: 
wandb: Run summary:
wandb:          epoch 66
wandb:  test_accuracy 0.92089
wandb:      test_loss 0.35927
wandb: train_accuracy 0.995
wandb:     train_loss 0.16794
wandb: 
wandb: 🚀 View run Sweep run at: https://wandb.ai/mcv-team-6/C3-Week3/runs/ztc5mmed
wandb: ⭐️ View project at: https://wandb.ai/mcv-team-6/C3-Week3
wandb: Synced 5 W&B file(s), 0 media file(s), 0 artifact file(s) and 0 other file(s)
wandb: Find logs at: ./wandb/run-20260110_211041-ztc5mmed/logs
2026-01-10 21:14:49,622 - wandb.wandb_agent - INFO - Cleaning up finished run: ztc5mmed
wandb: Terminating and syncing runs. Press ctrl-c to kill.
