wandb: Starting wandb agent 🕵️
2026-01-10 20:18:02,711 - wandb.wandb_agent - INFO - Running runs: []
2026-01-10 20:18:03,281 - wandb.wandb_agent - INFO - Agent received command: run
2026-01-10 20:18:03,281 - wandb.wandb_agent - INFO - Agent starting run with config:
	affine: 0.27094625759558877
	blur: 0.12835643811789588
	brightness: 0.938456849729346
	contrast: 0.7716305044400854
	crop: 0.7912483303486485
	crop_scale: 0.5221601155007042
	flip: 0.5894851310786119
	gaussian_blur_kernel: 9
	gaussian_noise_std: 2.4724082003919188
	grey: 0.36263293845221345
	hue: 0.05053466500264417
	jiggle: 0.26902779263132315
	rotate: 0.5830848330764855
	rotation: 20
	saturation: 1.1324880977212506
	scale: 1.000653130063082
	shear: 9
	translate_x: 0.3666881078874368
	translate_y: 0.3324092921886187
2026-01-10 20:18:03,284 - wandb.wandb_agent - INFO - About to run command: /usr/bin/env python train_data.py --affine=0.27094625759558877 --blur=0.12835643811789588 --brightness=0.938456849729346 --contrast=0.7716305044400854 --crop=0.7912483303486485 --crop_scale=0.5221601155007042 --flip=0.5894851310786119 --gaussian_blur_kernel=9 --gaussian_noise_std=2.4724082003919188 --grey=0.36263293845221345 --hue=0.05053466500264417 --jiggle=0.26902779263132315 --rotate=0.5830848330764855 --rotation=20 --saturation=1.1324880977212506 --scale=1.000653130063082 --shear=9 --translate_x=0.3666881078874368 --translate_y=0.3324092921886187
wandb: Currently logged in as: arnaumarcosalmansa (mcv-team-6) to https://api.wandb.ai. Use `wandb login --relogin` to force relogin
wandb: WARNING Ignoring project 'C3-Week3' when running a sweep.
wandb: WARNING Ignoring entity 'mcv-team-6' when running a sweep.
wandb: setting up run 3xzoj67f
wandb: Tracking run with wandb version 0.23.1
wandb: Run data is saved locally in /export/home/group06/workspace/project-team-6/Week3/wandb/run-20260110_201807-3xzoj67f
wandb: Run `wandb offline` to turn off syncing.
wandb: Syncing run Sweep run
wandb: ⭐️ View project at https://wandb.ai/mcv-team-6/C3-Week3
wandb: 🧹 View sweep at https://wandb.ai/mcv-team-6/C3-Week3/sweeps/g5vb4edr
wandb: 🚀 View run at https://wandb.ai/mcv-team-6/C3-Week3/runs/3xzoj67f
2026-01-10 20:18:08,291 - wandb.wandb_agent - INFO - Running runs: ['3xzoj67f']
TRAINING THE MODEL:   0%|          | 0/500 [00:00<?, ?it/s]TRAINING THE MODEL:   0%|          | 1/500 [00:04<38:23,  4.62s/it]TRAINING THE MODEL:   0%|          | 2/500 [00:07<31:24,  3.78s/it]TRAINING THE MODEL:   1%|          | 3/500 [00:11<29:09,  3.52s/it]TRAINING THE MODEL:   1%|          | 4/500 [00:14<28:04,  3.40s/it]TRAINING THE MODEL:   1%|          | 5/500 [00:17<27:23,  3.32s/it]TRAINING THE MODEL:   1%|          | 6/500 [00:20<26:58,  3.28s/it]TRAINING THE MODEL:   1%|▏         | 7/500 [00:23<26:39,  3.24s/it]TRAINING THE MODEL:   2%|▏         | 8/500 [00:27<26:31,  3.24s/it]TRAINING THE MODEL:   2%|▏         | 9/500 [00:30<26:46,  3.27s/it]TRAINING THE MODEL:   2%|▏         | 10/500 [00:33<26:42,  3.27s/it]TRAINING THE MODEL:   2%|▏         | 11/500 [00:36<26:27,  3.25s/it]TRAINING THE MODEL:   2%|▏         | 12/500 [00:40<26:22,  3.24s/it]TRAINING THE MODEL:   3%|▎         | 13/500 [00:43<26:17,  3.24s/it]TRAINING THE MODEL:   3%|▎         | 14/500 [00:46<26:15,  3.24s/it]TRAINING THE MODEL:   3%|▎         | 15/500 [00:49<26:13,  3.24s/it]TRAINING THE MODEL:   3%|▎         | 16/500 [00:53<26:09,  3.24s/it]TRAINING THE MODEL:   3%|▎         | 17/500 [00:56<26:05,  3.24s/it]TRAINING THE MODEL:   4%|▎         | 18/500 [00:59<26:02,  3.24s/it]TRAINING THE MODEL:   4%|▍         | 19/500 [01:02<26:01,  3.25s/it]TRAINING THE MODEL:   4%|▍         | 20/500 [01:06<27:11,  3.40s/it]TRAINING THE MODEL:   4%|▍         | 21/500 [01:09<26:46,  3.35s/it]TRAINING THE MODEL:   4%|▍         | 22/500 [01:13<26:28,  3.32s/it]TRAINING THE MODEL:   5%|▍         | 23/500 [01:16<26:13,  3.30s/it]TRAINING THE MODEL:   5%|▍         | 24/500 [01:19<26:12,  3.30s/it]TRAINING THE MODEL:   5%|▌         | 25/500 [01:23<26:39,  3.37s/it]TRAINING THE MODEL:   5%|▌         | 26/500 [01:26<26:28,  3.35s/it]TRAINING THE MODEL:   5%|▌         | 27/500 [01:29<26:43,  3.39s/it]TRAINING THE MODEL:   6%|▌         | 28/500 [01:33<27:05,  3.44s/it]TRAINING THE MODEL:   6%|▌         | 29/500 [01:37<27:50,  3.55s/it]TRAINING THE MODEL:   6%|▌         | 30/500 [01:41<28:56,  3.70s/it]TRAINING THE MODEL:   6%|▌         | 31/500 [01:45<29:04,  3.72s/it]TRAINING THE MODEL:   6%|▋         | 32/500 [01:48<28:34,  3.66s/it]TRAINING THE MODEL:   7%|▋         | 33/500 [01:52<28:09,  3.62s/it]TRAINING THE MODEL:   7%|▋         | 34/500 [01:55<27:17,  3.51s/it]TRAINING THE MODEL:   7%|▋         | 35/500 [01:58<27:06,  3.50s/it]TRAINING THE MODEL:   7%|▋         | 36/500 [02:02<26:30,  3.43s/it]TRAINING THE MODEL:   7%|▋         | 37/500 [02:05<26:01,  3.37s/it]TRAINING THE MODEL:   8%|▊         | 38/500 [02:08<25:38,  3.33s/it]TRAINING THE MODEL:   8%|▊         | 39/500 [02:12<26:08,  3.40s/it]TRAINING THE MODEL:   8%|▊         | 40/500 [02:16<27:20,  3.57s/it]TRAINING THE MODEL:   8%|▊         | 41/500 [02:19<26:32,  3.47s/it]TRAINING THE MODEL:   8%|▊         | 42/500 [02:22<25:59,  3.40s/it]TRAINING THE MODEL:   9%|▊         | 43/500 [02:25<25:33,  3.36s/it]TRAINING THE MODEL:   9%|▉         | 44/500 [02:29<25:17,  3.33s/it]TRAINING THE MODEL:   9%|▉         | 45/500 [02:32<25:36,  3.38s/it]TRAINING THE MODEL:   9%|▉         | 46/500 [02:35<25:14,  3.34s/it]TRAINING THE MODEL:   9%|▉         | 47/500 [02:39<25:24,  3.36s/it]TRAINING THE MODEL:  10%|▉         | 48/500 [02:42<25:04,  3.33s/it]TRAINING THE MODEL:  10%|▉         | 49/500 [02:45<24:50,  3.31s/it]TRAINING THE MODEL:  10%|█         | 50/500 [02:49<25:49,  3.44s/it]TRAINING THE MODEL:  10%|█         | 51/500 [02:52<25:52,  3.46s/it]TRAINING THE MODEL:  10%|█         | 52/500 [02:56<25:22,  3.40s/it]TRAINING THE MODEL:  11%|█         | 53/500 [02:59<25:00,  3.36s/it]TRAINING THE MODEL:  11%|█         | 54/500 [03:02<24:54,  3.35s/it]TRAINING THE MODEL:  11%|█         | 55/500 [03:06<24:45,  3.34s/it]TRAINING THE MODEL:  11%|█         | 56/500 [03:09<24:48,  3.35s/it]TRAINING THE MODEL:  11%|█▏        | 57/500 [03:12<24:36,  3.33s/it]TRAINING THE MODEL:  12%|█▏        | 58/500 [03:16<24:32,  3.33s/it]TRAINING THE MODEL:  12%|█▏        | 59/500 [03:19<24:31,  3.34s/it]TRAINING THE MODEL:  12%|█▏        | 60/500 [03:23<25:58,  3.54s/it]TRAINING THE MODEL:  12%|█▏        | 61/500 [03:26<25:20,  3.46s/it]TRAINING THE MODEL:  12%|█▏        | 62/500 [03:30<24:46,  3.39s/it]TRAINING THE MODEL:  13%|█▎        | 63/500 [03:33<24:22,  3.35s/it]TRAINING THE MODEL:  13%|█▎        | 64/500 [03:36<24:11,  3.33s/it]TRAINING THE MODEL:  13%|█▎        | 65/500 [03:39<23:57,  3.30s/it]TRAINING THE MODEL:  13%|█▎        | 66/500 [03:43<23:54,  3.31s/it]TRAINING THE MODEL:  13%|█▎        | 67/500 [03:46<23:46,  3.29s/it]TRAINING THE MODEL:  14%|█▎        | 68/500 [03:49<23:51,  3.31s/it]TRAINING THE MODEL:  14%|█▍        | 69/500 [03:53<23:44,  3.31s/it]TRAINING THE MODEL:  14%|█▍        | 70/500 [03:56<25:04,  3.50s/it]TRAINING THE MODEL:  14%|█▍        | 71/500 [04:00<24:39,  3.45s/it]TRAINING THE MODEL:  14%|█▍        | 72/500 [04:03<24:09,  3.39s/it]TRAINING THE MODEL:  15%|█▍        | 73/500 [04:06<23:50,  3.35s/it]TRAINING THE MODEL:  15%|█▍        | 74/500 [04:10<23:33,  3.32s/it]TRAINING THE MODEL:  15%|█▌        | 75/500 [04:13<23:22,  3.30s/it]TRAINING THE MODEL:  15%|█▌        | 76/500 [04:16<23:17,  3.30s/it]TRAINING THE MODEL:  15%|█▌        | 77/500 [04:20<23:28,  3.33s/it]TRAINING THE MODEL:  16%|█▌        | 78/500 [04:23<23:24,  3.33s/it]TRAINING THE MODEL:  16%|█▌        | 79/500 [04:26<23:15,  3.31s/it]TRAINING THE MODEL:  16%|█▌        | 80/500 [04:30<24:22,  3.48s/it]TRAINING THE MODEL:  16%|█▌        | 81/500 [04:33<24:16,  3.48s/it]TRAINING THE MODEL:  16%|█▋        | 82/500 [04:37<24:14,  3.48s/it]TRAINING THE MODEL:  17%|█▋        | 83/500 [04:40<23:47,  3.42s/it]TRAINING THE MODEL:  17%|█▋        | 84/500 [04:44<23:28,  3.39s/it]TRAINING THE MODEL:  17%|█▋        | 85/500 [04:47<23:24,  3.38s/it]TRAINING THE MODEL:  17%|█▋        | 85/500 [04:50<23:39,  3.42s/it]
wandb: updating run metadata
wandb: uploading output.log; uploading config.yaml
wandb: uploading history steps 83-85, summary, console lines 84-92
wandb: 
wandb: Run history:
wandb:          epoch ▁▁▁▁▁▂▂▂▂▃▃▃▃▃▃▄▄▄▄▅▅▅▅▅▅▆▆▆▆▆▆▆▇▇▇▇▇▇██
wandb:  test_accuracy ▁▄▆▆▇▇▇█████████████████████████████████
wandb:      test_loss █▅▄▃▃▂▂▂▂▂▁▁▁▁▁▁▁▁▁▁▁▁▁▁▁▁▁▁▁▁▁▁▁▁▁▁▁▁▁▁
wandb: train_accuracy ▁▂▄▄▅▆▇▆▇▇▇▇▇█▇██▇██████████████████████
wandb:     train_loss █▇▇▅▄▃▃▃▃▃▂▂▂▂▂▁▂▂▂▂▁▁▁▁▁▁▁▁▁▁▁▁▁▁▁▁▁▁▁▁
wandb: 
wandb: Run summary:
wandb:          epoch 85
wandb:  test_accuracy 0.93051
wandb:      test_loss 0.48465
wandb: train_accuracy 0.9825
wandb:     train_loss 0.38555
wandb: 
wandb: 🚀 View run Sweep run at: https://wandb.ai/mcv-team-6/C3-Week3/runs/3xzoj67f
wandb: ⭐️ View project at: https://wandb.ai/mcv-team-6/C3-Week3
wandb: Synced 5 W&B file(s), 0 media file(s), 0 artifact file(s) and 0 other file(s)
wandb: Find logs at: ./wandb/run-20260110_201807-3xzoj67f/logs
2026-01-10 20:23:06,927 - wandb.wandb_agent - INFO - Cleaning up finished run: 3xzoj67f
wandb: Terminating and syncing runs. Press ctrl-c to kill.
