wandb: Starting wandb agent 🕵️
2026-01-10 19:53:27,797 - wandb.wandb_agent - INFO - Running runs: []
2026-01-10 19:53:28,285 - wandb.wandb_agent - INFO - Agent received command: run
2026-01-10 19:53:28,285 - wandb.wandb_agent - INFO - Agent starting run with config:
	affine: 0.25270942612185043
	blur: 0.5730798439587753
	brightness: 0.9265175744639088
	contrast: 0.8690298686197135
	crop: 0.6366652866490292
	crop_scale: 0.9511756089129696
	flip: 0.05239717885965067
	gaussian_blur_kernel: 3
	gaussian_noise_std: 0.9707185586249844
	grey: 0.5882297156047104
	hue: 0.032044387493720655
	jiggle: 0.6244853930254023
	rotate: 0.22058065116290915
	rotation: 45
	saturation: 0.7870779188762747
	scale: 0.8583811662038738
	shear: 0
	translate_x: 0.3309113944167759
	translate_y: 0.3296883644213974
2026-01-10 19:53:28,289 - wandb.wandb_agent - INFO - About to run command: /usr/bin/env python train_data.py --affine=0.25270942612185043 --blur=0.5730798439587753 --brightness=0.9265175744639088 --contrast=0.8690298686197135 --crop=0.6366652866490292 --crop_scale=0.9511756089129696 --flip=0.05239717885965067 --gaussian_blur_kernel=3 --gaussian_noise_std=0.9707185586249844 --grey=0.5882297156047104 --hue=0.032044387493720655 --jiggle=0.6244853930254023 --rotate=0.22058065116290915 --rotation=45 --saturation=0.7870779188762747 --scale=0.8583811662038738 --shear=0 --translate_x=0.3309113944167759 --translate_y=0.3296883644213974
wandb: Currently logged in as: arnaumarcosalmansa (mcv-team-6) to https://api.wandb.ai. Use `wandb login --relogin` to force relogin
wandb: WARNING Ignoring project 'C3-Week3' when running a sweep.
wandb: WARNING Ignoring entity 'mcv-team-6' when running a sweep.
2026-01-10 19:53:33,295 - wandb.wandb_agent - INFO - Running runs: ['nanfc3p5']
wandb: setting up run nanfc3p5
wandb: Tracking run with wandb version 0.23.1
wandb: Run data is saved locally in /export/home/group06/workspace/project-team-6/Week3/wandb/run-20260110_195332-nanfc3p5
wandb: Run `wandb offline` to turn off syncing.
wandb: Syncing run Sweep run
wandb: ⭐️ View project at https://wandb.ai/mcv-team-6/C3-Week3
wandb: 🧹 View sweep at https://wandb.ai/mcv-team-6/C3-Week3/sweeps/g5vb4edr
wandb: 🚀 View run at https://wandb.ai/mcv-team-6/C3-Week3/runs/nanfc3p5
TRAINING THE MODEL:   0%|          | 0/500 [00:00<?, ?it/s]TRAINING THE MODEL:   0%|          | 1/500 [00:04<37:53,  4.56s/it]TRAINING THE MODEL:   0%|          | 2/500 [00:07<31:15,  3.77s/it]TRAINING THE MODEL:   1%|          | 3/500 [00:10<29:02,  3.51s/it]TRAINING THE MODEL:   1%|          | 4/500 [00:14<28:00,  3.39s/it]TRAINING THE MODEL:   1%|          | 5/500 [00:17<27:21,  3.32s/it]TRAINING THE MODEL:   1%|          | 6/500 [00:20<27:21,  3.32s/it]TRAINING THE MODEL:   1%|▏         | 7/500 [00:23<26:55,  3.28s/it]TRAINING THE MODEL:   2%|▏         | 8/500 [00:27<26:38,  3.25s/it]TRAINING THE MODEL:   2%|▏         | 9/500 [00:30<26:29,  3.24s/it]TRAINING THE MODEL:   2%|▏         | 10/500 [00:33<26:20,  3.22s/it]TRAINING THE MODEL:   2%|▏         | 11/500 [00:36<26:28,  3.25s/it]TRAINING THE MODEL:   2%|▏         | 12/500 [00:40<26:57,  3.31s/it]TRAINING THE MODEL:   3%|▎         | 13/500 [00:43<27:46,  3.42s/it]TRAINING THE MODEL:   3%|▎         | 14/500 [00:47<28:41,  3.54s/it]TRAINING THE MODEL:   3%|▎         | 15/500 [00:51<28:52,  3.57s/it]TRAINING THE MODEL:   3%|▎         | 16/500 [00:54<28:18,  3.51s/it]TRAINING THE MODEL:   3%|▎         | 17/500 [00:58<27:48,  3.45s/it]TRAINING THE MODEL:   4%|▎         | 18/500 [01:01<27:40,  3.44s/it]TRAINING THE MODEL:   4%|▍         | 19/500 [01:04<27:11,  3.39s/it]TRAINING THE MODEL:   4%|▍         | 20/500 [01:09<29:22,  3.67s/it]TRAINING THE MODEL:   4%|▍         | 21/500 [01:12<28:23,  3.56s/it]TRAINING THE MODEL:   4%|▍         | 22/500 [01:15<27:43,  3.48s/it]TRAINING THE MODEL:   5%|▍         | 23/500 [01:18<27:09,  3.42s/it]TRAINING THE MODEL:   5%|▍         | 24/500 [01:22<26:43,  3.37s/it]TRAINING THE MODEL:   5%|▌         | 25/500 [01:25<27:06,  3.42s/it]TRAINING THE MODEL:   5%|▌         | 26/500 [01:29<27:06,  3.43s/it]TRAINING THE MODEL:   5%|▌         | 27/500 [01:33<28:46,  3.65s/it]TRAINING THE MODEL:   6%|▌         | 28/500 [01:37<28:52,  3.67s/it]TRAINING THE MODEL:   6%|▌         | 29/500 [01:40<28:22,  3.61s/it]TRAINING THE MODEL:   6%|▌         | 30/500 [01:44<28:34,  3.65s/it]TRAINING THE MODEL:   6%|▌         | 31/500 [01:47<27:34,  3.53s/it]TRAINING THE MODEL:   6%|▋         | 32/500 [01:51<28:00,  3.59s/it]TRAINING THE MODEL:   7%|▋         | 33/500 [01:54<27:17,  3.51s/it]TRAINING THE MODEL:   7%|▋         | 34/500 [01:58<27:13,  3.50s/it]TRAINING THE MODEL:   7%|▋         | 35/500 [02:01<26:38,  3.44s/it]TRAINING THE MODEL:   7%|▋         | 36/500 [02:04<26:33,  3.43s/it]TRAINING THE MODEL:   7%|▋         | 37/500 [02:08<26:04,  3.38s/it]TRAINING THE MODEL:   8%|▊         | 38/500 [02:11<26:08,  3.40s/it]TRAINING THE MODEL:   8%|▊         | 39/500 [02:14<26:11,  3.41s/it]TRAINING THE MODEL:   8%|▊         | 40/500 [02:18<27:03,  3.53s/it]TRAINING THE MODEL:   8%|▊         | 41/500 [02:21<26:24,  3.45s/it]TRAINING THE MODEL:   8%|▊         | 42/500 [02:25<25:51,  3.39s/it]TRAINING THE MODEL:   9%|▊         | 43/500 [02:28<25:33,  3.36s/it]TRAINING THE MODEL:   9%|▉         | 44/500 [02:31<25:39,  3.38s/it]TRAINING THE MODEL:   9%|▉         | 45/500 [02:35<25:15,  3.33s/it]TRAINING THE MODEL:   9%|▉         | 46/500 [02:38<25:34,  3.38s/it]TRAINING THE MODEL:   9%|▉         | 47/500 [02:42<25:48,  3.42s/it]TRAINING THE MODEL:  10%|▉         | 48/500 [02:45<25:19,  3.36s/it]TRAINING THE MODEL:  10%|▉         | 49/500 [02:48<25:10,  3.35s/it]TRAINING THE MODEL:  10%|█         | 50/500 [02:52<26:03,  3.48s/it]TRAINING THE MODEL:  10%|█         | 51/500 [02:55<25:28,  3.40s/it]TRAINING THE MODEL:  10%|█         | 52/500 [02:58<25:03,  3.36s/it]TRAINING THE MODEL:  11%|█         | 53/500 [03:02<24:43,  3.32s/it]TRAINING THE MODEL:  11%|█         | 54/500 [03:05<24:34,  3.31s/it]TRAINING THE MODEL:  11%|█         | 55/500 [03:08<24:27,  3.30s/it]TRAINING THE MODEL:  11%|█         | 56/500 [03:12<24:23,  3.30s/it]TRAINING THE MODEL:  11%|█▏        | 57/500 [03:15<24:22,  3.30s/it]TRAINING THE MODEL:  12%|█▏        | 58/500 [03:18<24:15,  3.29s/it]TRAINING THE MODEL:  12%|█▏        | 59/500 [03:22<24:28,  3.33s/it]TRAINING THE MODEL:  12%|█▏        | 60/500 [03:26<25:54,  3.53s/it]TRAINING THE MODEL:  12%|█▏        | 61/500 [03:29<25:11,  3.44s/it]TRAINING THE MODEL:  12%|█▏        | 62/500 [03:32<24:40,  3.38s/it]TRAINING THE MODEL:  13%|█▎        | 63/500 [03:35<24:18,  3.34s/it]TRAINING THE MODEL:  13%|█▎        | 64/500 [03:38<24:01,  3.31s/it]TRAINING THE MODEL:  13%|█▎        | 65/500 [03:42<23:48,  3.28s/it]TRAINING THE MODEL:  13%|█▎        | 66/500 [03:45<23:38,  3.27s/it]TRAINING THE MODEL:  13%|█▎        | 67/500 [03:48<23:38,  3.28s/it]TRAINING THE MODEL:  14%|█▎        | 68/500 [03:51<23:27,  3.26s/it]TRAINING THE MODEL:  14%|█▍        | 69/500 [03:55<23:18,  3.24s/it]TRAINING THE MODEL:  14%|█▍        | 70/500 [03:58<24:28,  3.42s/it]TRAINING THE MODEL:  14%|█▍        | 71/500 [04:02<23:59,  3.36s/it]TRAINING THE MODEL:  14%|█▍        | 71/500 [04:05<24:43,  3.46s/it]
wandb: updating run metadata
wandb: uploading config.yaml
wandb: uploading history steps 69-71, summary, console lines 70-78
wandb: 
wandb: Run history:
wandb:          epoch ▁▁▁▁▁▂▂▂▂▂▂▃▃▃▃▃▄▄▄▄▄▄▅▅▅▅▅▅▅▆▆▆▇▇▇▇▇███
wandb:  test_accuracy ▁▃▄▅▆▇██████████████████████████████████
wandb:      test_loss █▆▅▄▄▃▂▂▂▂▂▁▁▁▁▁▁▁▁▁▁▁▁▁▁▁▁▁▁▁▁▁▁▁▁▁▁▁▁▁
wandb: train_accuracy ▁▄▅▅▆▇▇▇▇▇█▇▇█▇█████████████████████████
wandb:     train_loss █▇▆▆▅▄▄▄▃▃▂▂▂▂▂▂▂▂▂▂▂▁▁▁▁▁▁▁▁▁▁▁▁▁▁▁▁▁▁▁
wandb: 
wandb: Run summary:
wandb:          epoch 71
wandb:  test_accuracy 0.93575
wandb:      test_loss 0.46783
wandb: train_accuracy 0.985
wandb:     train_loss 0.37239
wandb: 
wandb: 🚀 View run Sweep run at: https://wandb.ai/mcv-team-6/C3-Week3/runs/nanfc3p5
wandb: ⭐️ View project at: https://wandb.ai/mcv-team-6/C3-Week3
wandb: Synced 5 W&B file(s), 0 media file(s), 0 artifact file(s) and 0 other file(s)
wandb: Find logs at: ./wandb/run-20260110_195332-nanfc3p5/logs
2026-01-10 19:57:45,693 - wandb.wandb_agent - INFO - Cleaning up finished run: nanfc3p5
wandb: Terminating and syncing runs. Press ctrl-c to kill.
