wandb: Starting wandb agent 🕵️
2026-01-10 19:03:25,519 - wandb.wandb_agent - INFO - Running runs: []
2026-01-10 19:03:25,812 - wandb.wandb_agent - INFO - Agent received command: run
2026-01-10 19:03:25,812 - wandb.wandb_agent - INFO - Agent starting run with config:
	affine: 0.7471149353461123
	blur: 0.4432318177695861
	brightness: 1.0772322649453347
	contrast: 1.216911267464337
	crop: 0.29337306932067764
	crop_scale: 0.4933500833958374
	flip: 0.18794156891354508
	gaussian_blur_kernel: 7
	gaussian_noise_std: 0.09749671873930776
	grey: 0.5754091964826307
	hue: 0.07926296175446415
	jiggle: 0.939178297357896
	rotate: 0.1699441734872167
	rotation: 40
	saturation: 1.111715722845557
	scale: 1.0050784064054363
	shear: 8
	translate_x: 0.24666957690487112
	translate_y: 0.3915760222460364
2026-01-10 19:03:25,816 - wandb.wandb_agent - INFO - About to run command: /usr/bin/env python train_data.py --affine=0.7471149353461123 --blur=0.4432318177695861 --brightness=1.0772322649453347 --contrast=1.216911267464337 --crop=0.29337306932067764 --crop_scale=0.4933500833958374 --flip=0.18794156891354508 --gaussian_blur_kernel=7 --gaussian_noise_std=0.09749671873930776 --grey=0.5754091964826307 --hue=0.07926296175446415 --jiggle=0.939178297357896 --rotate=0.1699441734872167 --rotation=40 --saturation=1.111715722845557 --scale=1.0050784064054363 --shear=8 --translate_x=0.24666957690487112 --translate_y=0.3915760222460364
wandb: Currently logged in as: arnaumarcosalmansa (mcv-team-6) to https://api.wandb.ai. Use `wandb login --relogin` to force relogin
wandb: WARNING Ignoring project 'C3-Week3' when running a sweep.
wandb: WARNING Ignoring entity 'mcv-team-6' when running a sweep.
wandb: setting up run ot74h941
2026-01-10 19:03:30,823 - wandb.wandb_agent - INFO - Running runs: ['ot74h941']
wandb: Tracking run with wandb version 0.23.1
wandb: Run data is saved locally in /export/home/group06/workspace/project-team-6/Week3/wandb/run-20260110_190330-ot74h941
wandb: Run `wandb offline` to turn off syncing.
wandb: Syncing run Sweep run
wandb: ⭐️ View project at https://wandb.ai/mcv-team-6/C3-Week3
wandb: 🧹 View sweep at https://wandb.ai/mcv-team-6/C3-Week3/sweeps/g5vb4edr
wandb: 🚀 View run at https://wandb.ai/mcv-team-6/C3-Week3/runs/ot74h941
TRAINING THE MODEL:   0%|          | 0/500 [00:00<?, ?it/s]TRAINING THE MODEL:   0%|          | 1/500 [00:04<37:49,  4.55s/it]TRAINING THE MODEL:   0%|          | 2/500 [00:07<30:47,  3.71s/it]TRAINING THE MODEL:   1%|          | 3/500 [00:10<28:38,  3.46s/it]TRAINING THE MODEL:   1%|          | 4/500 [00:13<27:31,  3.33s/it]TRAINING THE MODEL:   1%|          | 5/500 [00:17<26:55,  3.26s/it]TRAINING THE MODEL:   1%|          | 6/500 [00:20<26:30,  3.22s/it]TRAINING THE MODEL:   1%|▏         | 7/500 [00:23<26:16,  3.20s/it]TRAINING THE MODEL:   2%|▏         | 8/500 [00:26<26:06,  3.18s/it]TRAINING THE MODEL:   2%|▏         | 9/500 [00:29<25:58,  3.17s/it]TRAINING THE MODEL:   2%|▏         | 10/500 [00:32<25:56,  3.18s/it]TRAINING THE MODEL:   2%|▏         | 11/500 [00:36<25:48,  3.17s/it]TRAINING THE MODEL:   2%|▏         | 12/500 [00:39<25:49,  3.18s/it]TRAINING THE MODEL:   3%|▎         | 13/500 [00:42<25:49,  3.18s/it]TRAINING THE MODEL:   3%|▎         | 14/500 [00:45<25:47,  3.18s/it]TRAINING THE MODEL:   3%|▎         | 15/500 [00:48<25:47,  3.19s/it]TRAINING THE MODEL:   3%|▎         | 16/500 [00:52<25:54,  3.21s/it]TRAINING THE MODEL:   3%|▎         | 17/500 [00:55<25:48,  3.21s/it]TRAINING THE MODEL:   4%|▎         | 18/500 [00:58<25:45,  3.21s/it]TRAINING THE MODEL:   4%|▍         | 19/500 [01:01<25:45,  3.21s/it]TRAINING THE MODEL:   4%|▍         | 20/500 [01:05<27:25,  3.43s/it]TRAINING THE MODEL:   4%|▍         | 21/500 [01:08<26:54,  3.37s/it]TRAINING THE MODEL:   4%|▍         | 22/500 [01:12<26:26,  3.32s/it]TRAINING THE MODEL:   5%|▍         | 23/500 [01:15<26:08,  3.29s/it]TRAINING THE MODEL:   5%|▍         | 24/500 [01:18<25:58,  3.27s/it]TRAINING THE MODEL:   5%|▌         | 25/500 [01:21<25:48,  3.26s/it]TRAINING THE MODEL:   5%|▌         | 26/500 [01:25<25:50,  3.27s/it]TRAINING THE MODEL:   5%|▌         | 27/500 [01:28<25:42,  3.26s/it]TRAINING THE MODEL:   6%|▌         | 28/500 [01:31<25:37,  3.26s/it]TRAINING THE MODEL:   6%|▌         | 29/500 [01:34<25:41,  3.27s/it]TRAINING THE MODEL:   6%|▌         | 30/500 [01:38<26:41,  3.41s/it]TRAINING THE MODEL:   6%|▌         | 31/500 [01:41<26:10,  3.35s/it]TRAINING THE MODEL:   6%|▋         | 32/500 [01:45<25:53,  3.32s/it]TRAINING THE MODEL:   7%|▋         | 33/500 [01:48<25:47,  3.31s/it]TRAINING THE MODEL:   7%|▋         | 34/500 [01:51<25:29,  3.28s/it]TRAINING THE MODEL:   7%|▋         | 35/500 [01:54<25:21,  3.27s/it]TRAINING THE MODEL:   7%|▋         | 36/500 [01:58<25:10,  3.26s/it]TRAINING THE MODEL:   7%|▋         | 37/500 [02:01<25:24,  3.29s/it]TRAINING THE MODEL:   8%|▊         | 38/500 [02:04<25:09,  3.27s/it]TRAINING THE MODEL:   8%|▊         | 39/500 [02:07<25:07,  3.27s/it]TRAINING THE MODEL:   8%|▊         | 40/500 [02:11<26:15,  3.42s/it]TRAINING THE MODEL:   8%|▊         | 41/500 [02:14<25:38,  3.35s/it]TRAINING THE MODEL:   8%|▊         | 42/500 [02:18<25:26,  3.33s/it]TRAINING THE MODEL:   9%|▊         | 43/500 [02:21<25:06,  3.30s/it]TRAINING THE MODEL:   9%|▉         | 44/500 [02:24<25:26,  3.35s/it]TRAINING THE MODEL:   9%|▉         | 45/500 [02:28<25:04,  3.31s/it]TRAINING THE MODEL:   9%|▉         | 46/500 [02:31<25:00,  3.31s/it]TRAINING THE MODEL:   9%|▉         | 47/500 [02:34<24:52,  3.30s/it]TRAINING THE MODEL:  10%|▉         | 48/500 [02:37<24:43,  3.28s/it]TRAINING THE MODEL:  10%|▉         | 49/500 [02:41<24:34,  3.27s/it]TRAINING THE MODEL:  10%|█         | 50/500 [02:44<25:41,  3.43s/it]TRAINING THE MODEL:  10%|█         | 51/500 [02:48<25:18,  3.38s/it]TRAINING THE MODEL:  10%|█         | 52/500 [02:51<25:02,  3.35s/it]TRAINING THE MODEL:  11%|█         | 53/500 [02:54<24:40,  3.31s/it]TRAINING THE MODEL:  11%|█         | 54/500 [02:57<24:31,  3.30s/it]TRAINING THE MODEL:  11%|█         | 55/500 [03:01<24:21,  3.28s/it]TRAINING THE MODEL:  11%|█         | 56/500 [03:04<24:11,  3.27s/it]TRAINING THE MODEL:  11%|█▏        | 57/500 [03:07<23:59,  3.25s/it]TRAINING THE MODEL:  12%|█▏        | 58/500 [03:10<23:52,  3.24s/it]TRAINING THE MODEL:  12%|█▏        | 59/500 [03:14<23:59,  3.26s/it]TRAINING THE MODEL:  12%|█▏        | 60/500 [03:17<25:08,  3.43s/it]TRAINING THE MODEL:  12%|█▏        | 61/500 [03:21<24:40,  3.37s/it]TRAINING THE MODEL:  12%|█▏        | 62/500 [03:24<24:22,  3.34s/it]TRAINING THE MODEL:  13%|█▎        | 63/500 [03:27<24:09,  3.32s/it]TRAINING THE MODEL:  13%|█▎        | 64/500 [03:31<24:04,  3.31s/it]TRAINING THE MODEL:  13%|█▎        | 65/500 [03:34<23:59,  3.31s/it]TRAINING THE MODEL:  13%|█▎        | 66/500 [03:37<23:52,  3.30s/it]TRAINING THE MODEL:  13%|█▎        | 67/500 [03:40<23:43,  3.29s/it]TRAINING THE MODEL:  14%|█▎        | 68/500 [03:44<23:30,  3.26s/it]TRAINING THE MODEL:  14%|█▍        | 69/500 [03:47<23:21,  3.25s/it]TRAINING THE MODEL:  14%|█▍        | 70/500 [03:51<24:32,  3.42s/it]TRAINING THE MODEL:  14%|█▍        | 71/500 [03:54<24:02,  3.36s/it]TRAINING THE MODEL:  14%|█▍        | 72/500 [03:57<23:51,  3.34s/it]TRAINING THE MODEL:  15%|█▍        | 73/500 [04:00<23:30,  3.30s/it]TRAINING THE MODEL:  15%|█▍        | 74/500 [04:04<23:17,  3.28s/it]TRAINING THE MODEL:  15%|█▌        | 75/500 [04:07<23:10,  3.27s/it]TRAINING THE MODEL:  15%|█▌        | 75/500 [04:10<23:39,  3.34s/it]
wandb: updating run metadata
wandb: uploading output.log; uploading config.yaml
wandb: uploading history steps 71-75, summary, console lines 72-82
wandb: 
wandb: Run history:
wandb:          epoch ▁▁▁▁▂▂▂▂▂▃▃▃▃▃▃▄▄▄▄▄▅▅▅▅▅▆▆▆▆▆▆▆▇▇▇▇▇███
wandb:  test_accuracy ▁▅▅▆▇███████████████████████████████████
wandb:      test_loss █▆▅▄▃▂▂▂▂▂▂▁▁▁▁▁▁▁▁▁▁▁▁▁▁▁▁▁▁▁▁▁▁▁▁▁▁▁▁▁
wandb: train_accuracy ▁▃▄▅▆▆▇▇▇▇▇▇▇▇▇▇█▇█▇▇███████████████████
wandb:     train_loss █▇▇▆▆▅▄▄▄▃▃▂▂▂▂▂▂▂▂▂▁▂▁▁▁▁▁▁▁▁▁▁▁▁▁▁▁▁▁▁
wandb: 
wandb: Run summary:
wandb:          epoch 75
wandb:  test_accuracy 0.93969
wandb:      test_loss 0.46395
wandb: train_accuracy 0.9675
wandb:     train_loss 0.4218
wandb: 
wandb: 🚀 View run Sweep run at: https://wandb.ai/mcv-team-6/C3-Week3/runs/ot74h941
wandb: ⭐️ View project at: https://wandb.ai/mcv-team-6/C3-Week3
wandb: Synced 5 W&B file(s), 0 media file(s), 0 artifact file(s) and 0 other file(s)
wandb: Find logs at: ./wandb/run-20260110_190330-ot74h941/logs
2026-01-10 19:07:48,271 - wandb.wandb_agent - INFO - Cleaning up finished run: ot74h941
wandb: Terminating and syncing runs. Press ctrl-c to kill.
