wandb: Starting wandb agent 🕵️
2026-01-10 21:54:07,458 - wandb.wandb_agent - INFO - Running runs: []
2026-01-10 21:54:07,745 - wandb.wandb_agent - INFO - Agent received command: run
2026-01-10 21:54:07,745 - wandb.wandb_agent - INFO - Agent starting run with config:
	affine: 0.2855225323559467
	blur: 0.653418210620697
	brightness: 0.6066957718660452
	contrast: 0.9489267391137371
	crop: 0.5038047427242099
	crop_scale: 0.23136425189241852
	flip: 0.5018192480617768
	gaussian_blur_kernel: 7
	gaussian_noise_std: 2.0336825917459587
	grey: 0.49071176325791355
	hue: 0.24148884230309267
	jiggle: 0.21676637113994857
	rotate: 0.6153453853319676
	rotation: 17
	saturation: 0.8248319917011113
	scale: 1.1490860775689216
	shear: 10
	translate_x: 0.2551619534051696
	translate_y: 0.10505626481233206
2026-01-10 21:54:07,749 - wandb.wandb_agent - INFO - About to run command: /usr/bin/env python train_data.py --affine=0.2855225323559467 --blur=0.653418210620697 --brightness=0.6066957718660452 --contrast=0.9489267391137371 --crop=0.5038047427242099 --crop_scale=0.23136425189241852 --flip=0.5018192480617768 --gaussian_blur_kernel=7 --gaussian_noise_std=2.0336825917459587 --grey=0.49071176325791355 --hue=0.24148884230309267 --jiggle=0.21676637113994857 --rotate=0.6153453853319676 --rotation=17 --saturation=0.8248319917011113 --scale=1.1490860775689216 --shear=10 --translate_x=0.2551619534051696 --translate_y=0.10505626481233206
wandb: Currently logged in as: arnaumarcosalmansa (mcv-team-6) to https://api.wandb.ai. Use `wandb login --relogin` to force relogin
wandb: WARNING Ignoring project 'C3-Week3' when running a sweep.
wandb: WARNING Ignoring entity 'mcv-team-6' when running a sweep.
2026-01-10 21:54:12,756 - wandb.wandb_agent - INFO - Running runs: ['ob9z8zr3']
wandb: Tracking run with wandb version 0.23.1
wandb: Run data is saved locally in /export/home/group06/workspace/project-team-6/Week3/wandb/run-20260110_215412-ob9z8zr3
wandb: Run `wandb offline` to turn off syncing.
wandb: Syncing run Sweep run
wandb: ⭐️ View project at https://wandb.ai/mcv-team-6/C3-Week3
wandb: 🧹 View sweep at https://wandb.ai/mcv-team-6/C3-Week3/sweeps/ig5z7cnx
wandb: 🚀 View run at https://wandb.ai/mcv-team-6/C3-Week3/runs/ob9z8zr3
TRAINING THE MODEL:   0%|          | 0/500 [00:00<?, ?it/s]TRAINING THE MODEL:   0%|          | 1/500 [00:04<38:26,  4.62s/it]TRAINING THE MODEL:   0%|          | 2/500 [00:07<31:28,  3.79s/it]TRAINING THE MODEL:   1%|          | 3/500 [00:11<29:13,  3.53s/it]TRAINING THE MODEL:   1%|          | 4/500 [00:14<28:07,  3.40s/it]TRAINING THE MODEL:   1%|          | 5/500 [00:17<27:29,  3.33s/it]TRAINING THE MODEL:   1%|          | 6/500 [00:20<27:04,  3.29s/it]TRAINING THE MODEL:   1%|▏         | 7/500 [00:24<27:14,  3.32s/it]TRAINING THE MODEL:   2%|▏         | 8/500 [00:27<27:06,  3.31s/it]TRAINING THE MODEL:   2%|▏         | 9/500 [00:30<27:05,  3.31s/it]TRAINING THE MODEL:   2%|▏         | 10/500 [00:33<26:58,  3.30s/it]TRAINING THE MODEL:   2%|▏         | 11/500 [00:37<26:57,  3.31s/it]TRAINING THE MODEL:   2%|▏         | 12/500 [00:40<27:00,  3.32s/it]TRAINING THE MODEL:   3%|▎         | 13/500 [00:44<27:18,  3.36s/it]TRAINING THE MODEL:   3%|▎         | 14/500 [00:47<27:17,  3.37s/it]TRAINING THE MODEL:   3%|▎         | 15/500 [00:50<27:26,  3.39s/it]TRAINING THE MODEL:   3%|▎         | 16/500 [00:54<27:16,  3.38s/it]TRAINING THE MODEL:   3%|▎         | 17/500 [00:57<27:12,  3.38s/it]TRAINING THE MODEL:   4%|▎         | 18/500 [01:01<27:08,  3.38s/it]TRAINING THE MODEL:   4%|▍         | 19/500 [01:04<27:16,  3.40s/it]TRAINING THE MODEL:   4%|▍         | 20/500 [01:08<28:44,  3.59s/it]TRAINING THE MODEL:   4%|▍         | 21/500 [01:11<28:11,  3.53s/it]TRAINING THE MODEL:   4%|▍         | 22/500 [01:15<27:58,  3.51s/it]TRAINING THE MODEL:   5%|▍         | 23/500 [01:18<27:32,  3.46s/it]TRAINING THE MODEL:   5%|▍         | 24/500 [01:22<27:15,  3.44s/it]TRAINING THE MODEL:   5%|▌         | 25/500 [01:25<27:02,  3.42s/it]TRAINING THE MODEL:   5%|▌         | 26/500 [01:28<26:50,  3.40s/it]TRAINING THE MODEL:   5%|▌         | 27/500 [01:32<26:35,  3.37s/it]TRAINING THE MODEL:   6%|▌         | 28/500 [01:35<26:41,  3.39s/it]TRAINING THE MODEL:   6%|▌         | 29/500 [01:38<26:41,  3.40s/it]TRAINING THE MODEL:   6%|▌         | 30/500 [01:42<27:37,  3.53s/it]TRAINING THE MODEL:   6%|▌         | 31/500 [01:46<27:22,  3.50s/it]TRAINING THE MODEL:   6%|▋         | 32/500 [01:49<27:07,  3.48s/it]TRAINING THE MODEL:   7%|▋         | 33/500 [01:53<27:02,  3.47s/it]TRAINING THE MODEL:   7%|▋         | 34/500 [01:56<27:07,  3.49s/it]TRAINING THE MODEL:   7%|▋         | 35/500 [02:01<31:06,  4.01s/it]TRAINING THE MODEL:   7%|▋         | 36/500 [02:05<29:56,  3.87s/it]TRAINING THE MODEL:   7%|▋         | 37/500 [02:08<28:50,  3.74s/it]TRAINING THE MODEL:   8%|▊         | 38/500 [02:13<30:05,  3.91s/it]TRAINING THE MODEL:   8%|▊         | 39/500 [02:16<29:18,  3.81s/it]TRAINING THE MODEL:   8%|▊         | 40/500 [02:20<29:51,  3.89s/it]TRAINING THE MODEL:   8%|▊         | 41/500 [02:24<29:11,  3.82s/it]TRAINING THE MODEL:   8%|▊         | 42/500 [02:27<28:24,  3.72s/it]TRAINING THE MODEL:   9%|▊         | 43/500 [02:31<28:02,  3.68s/it]TRAINING THE MODEL:   9%|▉         | 44/500 [02:35<27:34,  3.63s/it]TRAINING THE MODEL:   9%|▉         | 45/500 [02:38<27:07,  3.58s/it]TRAINING THE MODEL:   9%|▉         | 46/500 [02:42<27:22,  3.62s/it]TRAINING THE MODEL:   9%|▉         | 47/500 [02:45<27:17,  3.62s/it]TRAINING THE MODEL:  10%|▉         | 48/500 [02:49<26:52,  3.57s/it]TRAINING THE MODEL:  10%|▉         | 49/500 [02:52<26:15,  3.49s/it]TRAINING THE MODEL:  10%|█         | 50/500 [02:56<27:00,  3.60s/it]TRAINING THE MODEL:  10%|█         | 51/500 [02:59<26:20,  3.52s/it]TRAINING THE MODEL:  10%|█         | 52/500 [03:03<26:11,  3.51s/it]TRAINING THE MODEL:  11%|█         | 53/500 [03:06<25:53,  3.48s/it]TRAINING THE MODEL:  11%|█         | 53/500 [03:10<26:42,  3.59s/it]
wandb: updating run metadata
wandb: uploading config.yaml
wandb: uploading history steps 50-53, summary, console lines 51-60
wandb: 
wandb: Run history:
wandb:          epoch ▁▁▁▁▂▂▂▂▂▂▃▃▃▃▃▄▄▄▄▄▅▅▅▅▅▅▅▆▆▆▆▇▇▇▇▇▇███
wandb:  test_accuracy ▁▂▄▅▆▇▇▇▇▇██████████████████████████████
wandb:      test_loss █▇▆▅▅▄▃▃▂▂▂▂▂▂▁▁▁▁▁▁▁▁▁▁▁▁▁▁▁▁▁▁▁▁▁▁▁▁▁▁
wandb: train_accuracy ▁▂▃▅▆▆▇▇▇▇▇▇▇█▇▇▇███████████████████████
wandb:     train_loss █▇▆▅▅▄▄▃▃▃▃▂▂▂▂▂▂▂▂▁▁▁▂▁▁▁▁▁▁▁▁▁▁▁▁▁▁▁▁▁
wandb: 
wandb: Run summary:
wandb:          epoch 53
wandb:  test_accuracy 0.94318
wandb:      test_loss 0.30684
wandb: train_accuracy 0.97
wandb:     train_loss 0.25256
wandb: 
wandb: 🚀 View run Sweep run at: https://wandb.ai/mcv-team-6/C3-Week3/runs/ob9z8zr3
wandb: ⭐️ View project at: https://wandb.ai/mcv-team-6/C3-Week3
wandb: Synced 5 W&B file(s), 0 media file(s), 0 artifact file(s) and 0 other file(s)
wandb: Find logs at: ./wandb/run-20260110_215412-ob9z8zr3/logs
2026-01-10 21:57:33,548 - wandb.wandb_agent - INFO - Cleaning up finished run: ob9z8zr3
wandb: Terminating and syncing runs. Press ctrl-c to kill.
