wandb: Starting wandb agent 🕵️
2026-01-10 23:02:00,597 - wandb.wandb_agent - INFO - Running runs: []
2026-01-10 23:02:00,938 - wandb.wandb_agent - INFO - Agent received command: run
2026-01-10 23:02:00,938 - wandb.wandb_agent - INFO - Agent starting run with config:
	affine: 0.06486551008397001
	blur: 0.9240822939584185
	brightness: 0.9179364285043534
	contrast: 1.0138863207136428
	crop: 0.31948133539843804
	crop_scale: 0.7347965630810491
	flip: 0.612773794999494
	gaussian_blur_kernel: 7
	gaussian_noise_std: 1.2567183053000015
	grey: 0.38769376914230314
	hue: 0.22470090666045384
	jiggle: 0.218023909478828
	rotate: 0.5478516903269086
	rotation: 40
	saturation: 1.182465896210681
	scale: 0.9224312120460618
	shear: 23
	translate_x: 0.19055392396560225
	translate_y: 0.12543464867669876
2026-01-10 23:02:00,942 - wandb.wandb_agent - INFO - About to run command: /usr/bin/env python train_data.py --affine=0.06486551008397001 --blur=0.9240822939584185 --brightness=0.9179364285043534 --contrast=1.0138863207136428 --crop=0.31948133539843804 --crop_scale=0.7347965630810491 --flip=0.612773794999494 --gaussian_blur_kernel=7 --gaussian_noise_std=1.2567183053000015 --grey=0.38769376914230314 --hue=0.22470090666045384 --jiggle=0.218023909478828 --rotate=0.5478516903269086 --rotation=40 --saturation=1.182465896210681 --scale=0.9224312120460618 --shear=23 --translate_x=0.19055392396560225 --translate_y=0.12543464867669876
wandb: Currently logged in as: arnaumarcosalmansa (mcv-team-6) to https://api.wandb.ai. Use `wandb login --relogin` to force relogin
wandb: WARNING Ignoring project 'C3-Week3' when running a sweep.
wandb: WARNING Ignoring entity 'mcv-team-6' when running a sweep.
wandb: setting up run 9jws1kb4
wandb: Tracking run with wandb version 0.23.1
wandb: Run data is saved locally in /export/home/group06/workspace/project-team-6/Week3/wandb/run-20260110_230205-9jws1kb4
wandb: Run `wandb offline` to turn off syncing.
wandb: Syncing run Sweep run
wandb: ⭐️ View project at https://wandb.ai/mcv-team-6/C3-Week3
wandb: 🧹 View sweep at https://wandb.ai/mcv-team-6/C3-Week3/sweeps/ig5z7cnx
wandb: 🚀 View run at https://wandb.ai/mcv-team-6/C3-Week3/runs/9jws1kb4
2026-01-10 23:02:05,948 - wandb.wandb_agent - INFO - Running runs: ['9jws1kb4']
TRAINING THE MODEL:   0%|          | 0/500 [00:00<?, ?it/s]TRAINING THE MODEL:   0%|          | 1/500 [00:04<37:49,  4.55s/it]TRAINING THE MODEL:   0%|          | 2/500 [00:07<30:56,  3.73s/it]TRAINING THE MODEL:   1%|          | 3/500 [00:10<28:47,  3.48s/it]TRAINING THE MODEL:   1%|          | 4/500 [00:14<27:44,  3.36s/it]TRAINING THE MODEL:   1%|          | 5/500 [00:17<27:11,  3.30s/it]TRAINING THE MODEL:   1%|          | 6/500 [00:20<26:47,  3.25s/it]TRAINING THE MODEL:   1%|▏         | 7/500 [00:23<26:32,  3.23s/it]TRAINING THE MODEL:   2%|▏         | 8/500 [00:26<26:18,  3.21s/it]TRAINING THE MODEL:   2%|▏         | 9/500 [00:29<26:11,  3.20s/it]TRAINING THE MODEL:   2%|▏         | 10/500 [00:33<26:06,  3.20s/it]TRAINING THE MODEL:   2%|▏         | 11/500 [00:36<26:00,  3.19s/it]TRAINING THE MODEL:   2%|▏         | 12/500 [00:39<26:03,  3.20s/it]TRAINING THE MODEL:   3%|▎         | 13/500 [00:42<26:05,  3.21s/it]TRAINING THE MODEL:   3%|▎         | 14/500 [00:46<26:06,  3.22s/it]TRAINING THE MODEL:   3%|▎         | 15/500 [00:49<26:06,  3.23s/it]TRAINING THE MODEL:   3%|▎         | 16/500 [00:52<26:05,  3.23s/it]TRAINING THE MODEL:   3%|▎         | 17/500 [00:55<26:04,  3.24s/it]TRAINING THE MODEL:   4%|▎         | 18/500 [00:59<26:08,  3.25s/it]TRAINING THE MODEL:   4%|▍         | 19/500 [01:02<26:47,  3.34s/it]TRAINING THE MODEL:   4%|▍         | 20/500 [01:06<27:28,  3.43s/it]TRAINING THE MODEL:   4%|▍         | 21/500 [01:09<27:00,  3.38s/it]TRAINING THE MODEL:   4%|▍         | 22/500 [01:12<26:41,  3.35s/it]TRAINING THE MODEL:   5%|▍         | 23/500 [01:16<26:23,  3.32s/it]TRAINING THE MODEL:   5%|▍         | 24/500 [01:19<26:07,  3.29s/it]TRAINING THE MODEL:   5%|▌         | 25/500 [01:22<25:52,  3.27s/it]TRAINING THE MODEL:   5%|▌         | 26/500 [01:25<25:50,  3.27s/it]TRAINING THE MODEL:   5%|▌         | 27/500 [01:29<25:49,  3.28s/it]TRAINING THE MODEL:   6%|▌         | 28/500 [01:32<25:49,  3.28s/it]TRAINING THE MODEL:   6%|▌         | 29/500 [01:35<25:48,  3.29s/it]TRAINING THE MODEL:   6%|▌         | 30/500 [01:39<27:05,  3.46s/it]TRAINING THE MODEL:   6%|▌         | 31/500 [01:42<26:25,  3.38s/it]TRAINING THE MODEL:   6%|▋         | 32/500 [01:45<26:00,  3.33s/it]TRAINING THE MODEL:   7%|▋         | 33/500 [01:49<25:48,  3.32s/it]TRAINING THE MODEL:   7%|▋         | 34/500 [01:52<25:35,  3.30s/it]TRAINING THE MODEL:   7%|▋         | 35/500 [01:55<25:41,  3.32s/it]TRAINING THE MODEL:   7%|▋         | 36/500 [01:59<25:36,  3.31s/it]TRAINING THE MODEL:   7%|▋         | 37/500 [02:02<25:33,  3.31s/it]TRAINING THE MODEL:   8%|▊         | 38/500 [02:05<25:20,  3.29s/it]TRAINING THE MODEL:   8%|▊         | 39/500 [02:08<25:18,  3.29s/it]TRAINING THE MODEL:   8%|▊         | 40/500 [02:13<27:07,  3.54s/it]TRAINING THE MODEL:   8%|▊         | 41/500 [02:16<26:19,  3.44s/it]TRAINING THE MODEL:   8%|▊         | 42/500 [02:19<25:49,  3.38s/it]TRAINING THE MODEL:   9%|▊         | 43/500 [02:22<25:32,  3.35s/it]TRAINING THE MODEL:   9%|▉         | 44/500 [02:26<25:11,  3.31s/it]TRAINING THE MODEL:   9%|▉         | 45/500 [02:29<24:56,  3.29s/it]TRAINING THE MODEL:   9%|▉         | 46/500 [02:32<24:48,  3.28s/it]TRAINING THE MODEL:   9%|▉         | 47/500 [02:35<24:51,  3.29s/it]TRAINING THE MODEL:  10%|▉         | 48/500 [02:39<24:43,  3.28s/it]TRAINING THE MODEL:  10%|▉         | 49/500 [02:42<24:35,  3.27s/it]TRAINING THE MODEL:  10%|█         | 50/500 [02:46<25:37,  3.42s/it]TRAINING THE MODEL:  10%|█         | 51/500 [02:49<25:05,  3.35s/it]TRAINING THE MODEL:  10%|█         | 52/500 [02:52<24:50,  3.33s/it]TRAINING THE MODEL:  11%|█         | 53/500 [02:55<24:36,  3.30s/it]TRAINING THE MODEL:  11%|█         | 54/500 [02:59<24:26,  3.29s/it]TRAINING THE MODEL:  11%|█         | 55/500 [03:02<24:17,  3.28s/it]TRAINING THE MODEL:  11%|█         | 56/500 [03:05<24:08,  3.26s/it]TRAINING THE MODEL:  11%|█▏        | 57/500 [03:08<24:04,  3.26s/it]TRAINING THE MODEL:  12%|█▏        | 58/500 [03:12<23:59,  3.26s/it]TRAINING THE MODEL:  12%|█▏        | 59/500 [03:15<23:55,  3.25s/it]TRAINING THE MODEL:  12%|█▏        | 60/500 [03:19<25:02,  3.42s/it]TRAINING THE MODEL:  12%|█▏        | 61/500 [03:22<24:32,  3.35s/it]TRAINING THE MODEL:  12%|█▏        | 62/500 [03:25<24:29,  3.36s/it]TRAINING THE MODEL:  12%|█▏        | 62/500 [03:29<24:36,  3.37s/it]
wandb: uploading history steps 58-61, summary, console lines 59-62; updating run metadata
wandb: uploading output.log; uploading config.yaml
wandb: uploading history steps 62-62, summary, console lines 63-69
wandb: 
wandb: Run history:
wandb:          epoch ▁▁▁▁▂▂▂▂▂▃▃▃▃▃▃▄▄▄▄▄▅▅▅▅▅▅▆▆▆▆▆▇▇▇▇▇▇▇██
wandb:  test_accuracy ▁▃▄▅▇███████████████████████████████████
wandb:      test_loss █▇▆▆▄▃▃▃▂▂▂▂▁▁▁▁▁▁▁▁▁▁▁▁▁▁▁▁▁▁▁▁▁▁▁▁▁▁▁▁
wandb: train_accuracy ▁▂▄▅▆▇▇▇▇▇▇▇▇███████████████████████████
wandb:     train_loss █▇▆▅▅▄▃▃▃▃▂▂▂▂▂▂▂▂▂▂▁▁▁▁▁▁▁▁▁▁▁▁▁▁▁▁▁▁▁▁
wandb: 
wandb: Run summary:
wandb:          epoch 62
wandb:  test_accuracy 0.93444
wandb:      test_loss 0.32382
wandb: train_accuracy 0.99
wandb:     train_loss 0.1912
wandb: 
wandb: 🚀 View run Sweep run at: https://wandb.ai/mcv-team-6/C3-Week3/runs/9jws1kb4
wandb: ⭐️ View project at: https://wandb.ai/mcv-team-6/C3-Week3
wandb: Synced 5 W&B file(s), 0 media file(s), 0 artifact file(s) and 0 other file(s)
wandb: Find logs at: ./wandb/run-20260110_230205-9jws1kb4/logs
2026-01-10 23:05:42,107 - wandb.wandb_agent - INFO - Cleaning up finished run: 9jws1kb4
wandb: Terminating and syncing runs. Press ctrl-c to kill.
