wandb: Starting wandb agent 🕵️
2026-01-10 19:51:51,499 - wandb.wandb_agent - INFO - Running runs: []
2026-01-10 19:51:51,808 - wandb.wandb_agent - INFO - Agent received command: run
2026-01-10 19:51:51,808 - wandb.wandb_agent - INFO - Agent starting run with config:
	affine: 0.9516607899574516
	blur: 0.3803240575615181
	brightness: 1.2650817941121506
	contrast: 1.3874110228337353
	crop: 0.8324854713563148
	crop_scale: 0.5637597977794854
	flip: 0.20860656764940788
	gaussian_blur_kernel: 7
	gaussian_noise_std: 2.1725686081634152
	grey: 0.09115537481999304
	hue: 0.073953383448213
	jiggle: 0.5244820931808634
	rotate: 0.1014437354580654
	rotation: 49
	saturation: 0.6006810458317514
	scale: 1.1596131259425086
	shear: 16
	translate_x: 0.35978733445245875
	translate_y: 0.3376649641763596
2026-01-10 19:51:51,812 - wandb.wandb_agent - INFO - About to run command: /usr/bin/env python train_data.py --affine=0.9516607899574516 --blur=0.3803240575615181 --brightness=1.2650817941121506 --contrast=1.3874110228337353 --crop=0.8324854713563148 --crop_scale=0.5637597977794854 --flip=0.20860656764940788 --gaussian_blur_kernel=7 --gaussian_noise_std=2.1725686081634152 --grey=0.09115537481999304 --hue=0.073953383448213 --jiggle=0.5244820931808634 --rotate=0.1014437354580654 --rotation=49 --saturation=0.6006810458317514 --scale=1.1596131259425086 --shear=16 --translate_x=0.35978733445245875 --translate_y=0.3376649641763596
wandb: Currently logged in as: arnaumarcosalmansa (mcv-team-6) to https://api.wandb.ai. Use `wandb login --relogin` to force relogin
wandb: WARNING Ignoring project 'C3-Week3' when running a sweep.
wandb: WARNING Ignoring entity 'mcv-team-6' when running a sweep.
2026-01-10 19:51:56,819 - wandb.wandb_agent - INFO - Running runs: ['lfuj91c0']
wandb: Tracking run with wandb version 0.23.1
wandb: Run data is saved locally in /export/home/group06/workspace/project-team-6/Week3/wandb/run-20260110_195156-lfuj91c0
wandb: Run `wandb offline` to turn off syncing.
wandb: Syncing run Sweep run
wandb: ⭐️ View project at https://wandb.ai/mcv-team-6/C3-Week3
wandb: 🧹 View sweep at https://wandb.ai/mcv-team-6/C3-Week3/sweeps/g5vb4edr
wandb: 🚀 View run at https://wandb.ai/mcv-team-6/C3-Week3/runs/lfuj91c0
TRAINING THE MODEL:   0%|          | 0/500 [00:00<?, ?it/s]TRAINING THE MODEL:   0%|          | 1/500 [00:04<37:36,  4.52s/it]TRAINING THE MODEL:   0%|          | 2/500 [00:07<31:05,  3.75s/it]TRAINING THE MODEL:   1%|          | 3/500 [00:10<28:57,  3.50s/it]TRAINING THE MODEL:   1%|          | 4/500 [00:14<27:56,  3.38s/it]TRAINING THE MODEL:   1%|          | 5/500 [00:17<27:20,  3.31s/it]TRAINING THE MODEL:   1%|          | 6/500 [00:20<27:03,  3.29s/it]TRAINING THE MODEL:   1%|▏         | 7/500 [00:23<26:45,  3.26s/it]TRAINING THE MODEL:   2%|▏         | 8/500 [00:27<26:43,  3.26s/it]TRAINING THE MODEL:   2%|▏         | 9/500 [00:30<26:38,  3.26s/it]TRAINING THE MODEL:   2%|▏         | 10/500 [00:33<26:35,  3.26s/it]TRAINING THE MODEL:   2%|▏         | 11/500 [00:36<26:35,  3.26s/it]TRAINING THE MODEL:   2%|▏         | 12/500 [00:40<26:48,  3.30s/it]TRAINING THE MODEL:   3%|▎         | 13/500 [00:43<27:18,  3.36s/it]TRAINING THE MODEL:   3%|▎         | 14/500 [00:46<27:04,  3.34s/it]TRAINING THE MODEL:   3%|▎         | 15/500 [00:50<26:52,  3.32s/it]TRAINING THE MODEL:   3%|▎         | 16/500 [00:53<26:51,  3.33s/it]TRAINING THE MODEL:   3%|▎         | 17/500 [00:57<26:59,  3.35s/it]TRAINING THE MODEL:   4%|▎         | 18/500 [01:00<26:49,  3.34s/it]TRAINING THE MODEL:   4%|▍         | 19/500 [01:03<26:32,  3.31s/it]TRAINING THE MODEL:   4%|▍         | 20/500 [01:07<27:34,  3.45s/it]TRAINING THE MODEL:   4%|▍         | 21/500 [01:10<27:16,  3.42s/it]TRAINING THE MODEL:   4%|▍         | 22/500 [01:13<26:54,  3.38s/it]TRAINING THE MODEL:   5%|▍         | 23/500 [01:17<27:18,  3.44s/it]TRAINING THE MODEL:   5%|▍         | 24/500 [01:20<27:00,  3.40s/it]TRAINING THE MODEL:   5%|▌         | 25/500 [01:24<26:41,  3.37s/it]TRAINING THE MODEL:   5%|▌         | 26/500 [01:27<26:41,  3.38s/it]TRAINING THE MODEL:   5%|▌         | 27/500 [01:30<26:24,  3.35s/it]TRAINING THE MODEL:   6%|▌         | 28/500 [01:34<27:04,  3.44s/it]TRAINING THE MODEL:   6%|▌         | 29/500 [01:37<26:34,  3.38s/it]TRAINING THE MODEL:   6%|▌         | 30/500 [01:41<27:47,  3.55s/it]TRAINING THE MODEL:   6%|▌         | 31/500 [01:44<27:07,  3.47s/it]TRAINING THE MODEL:   6%|▋         | 32/500 [01:48<26:32,  3.40s/it]TRAINING THE MODEL:   7%|▋         | 33/500 [01:51<26:22,  3.39s/it]TRAINING THE MODEL:   7%|▋         | 34/500 [01:54<26:10,  3.37s/it]TRAINING THE MODEL:   7%|▋         | 35/500 [01:58<26:03,  3.36s/it]TRAINING THE MODEL:   7%|▋         | 36/500 [02:01<26:10,  3.38s/it]TRAINING THE MODEL:   7%|▋         | 37/500 [02:05<26:15,  3.40s/it]TRAINING THE MODEL:   8%|▊         | 38/500 [02:08<26:42,  3.47s/it]TRAINING THE MODEL:   8%|▊         | 39/500 [02:12<26:53,  3.50s/it]TRAINING THE MODEL:   8%|▊         | 40/500 [02:16<27:36,  3.60s/it]TRAINING THE MODEL:   8%|▊         | 41/500 [02:19<27:10,  3.55s/it]TRAINING THE MODEL:   8%|▊         | 42/500 [02:22<26:43,  3.50s/it]TRAINING THE MODEL:   9%|▊         | 43/500 [02:26<26:35,  3.49s/it]TRAINING THE MODEL:   9%|▉         | 44/500 [02:29<26:15,  3.45s/it]TRAINING THE MODEL:   9%|▉         | 45/500 [02:33<25:43,  3.39s/it]TRAINING THE MODEL:   9%|▉         | 46/500 [02:36<25:44,  3.40s/it]TRAINING THE MODEL:   9%|▉         | 47/500 [02:39<25:21,  3.36s/it]TRAINING THE MODEL:  10%|▉         | 48/500 [02:43<25:07,  3.33s/it]TRAINING THE MODEL:  10%|▉         | 49/500 [02:46<25:03,  3.33s/it]TRAINING THE MODEL:  10%|█         | 50/500 [02:50<26:10,  3.49s/it]TRAINING THE MODEL:  10%|█         | 51/500 [02:53<25:36,  3.42s/it]TRAINING THE MODEL:  10%|█         | 52/500 [02:56<25:09,  3.37s/it]TRAINING THE MODEL:  11%|█         | 53/500 [03:00<24:57,  3.35s/it]TRAINING THE MODEL:  11%|█         | 54/500 [03:03<24:45,  3.33s/it]TRAINING THE MODEL:  11%|█         | 55/500 [03:06<24:29,  3.30s/it]TRAINING THE MODEL:  11%|█         | 56/500 [03:09<24:32,  3.32s/it]TRAINING THE MODEL:  11%|█▏        | 57/500 [03:13<24:42,  3.35s/it]TRAINING THE MODEL:  12%|█▏        | 58/500 [03:16<24:39,  3.35s/it]TRAINING THE MODEL:  12%|█▏        | 59/500 [03:20<24:39,  3.35s/it]TRAINING THE MODEL:  12%|█▏        | 60/500 [03:23<25:46,  3.51s/it]TRAINING THE MODEL:  12%|█▏        | 61/500 [03:27<25:39,  3.51s/it]TRAINING THE MODEL:  12%|█▏        | 62/500 [03:30<25:12,  3.45s/it]TRAINING THE MODEL:  13%|█▎        | 63/500 [03:33<24:44,  3.40s/it]TRAINING THE MODEL:  13%|█▎        | 64/500 [03:37<24:20,  3.35s/it]TRAINING THE MODEL:  13%|█▎        | 65/500 [03:40<24:25,  3.37s/it]TRAINING THE MODEL:  13%|█▎        | 66/500 [03:43<24:08,  3.34s/it]TRAINING THE MODEL:  13%|█▎        | 67/500 [03:47<24:16,  3.36s/it]TRAINING THE MODEL:  14%|█▎        | 68/500 [03:50<24:08,  3.35s/it]TRAINING THE MODEL:  14%|█▍        | 69/500 [03:54<24:11,  3.37s/it]TRAINING THE MODEL:  14%|█▍        | 70/500 [03:57<25:08,  3.51s/it]TRAINING THE MODEL:  14%|█▍        | 71/500 [04:01<24:42,  3.45s/it]TRAINING THE MODEL:  14%|█▍        | 72/500 [04:04<24:15,  3.40s/it]TRAINING THE MODEL:  15%|█▍        | 73/500 [04:07<24:15,  3.41s/it]TRAINING THE MODEL:  15%|█▍        | 74/500 [04:11<23:49,  3.35s/it]TRAINING THE MODEL:  15%|█▌        | 75/500 [04:14<23:28,  3.31s/it]TRAINING THE MODEL:  15%|█▌        | 76/500 [04:17<23:13,  3.29s/it]TRAINING THE MODEL:  15%|█▌        | 77/500 [04:20<23:01,  3.27s/it]TRAINING THE MODEL:  16%|█▌        | 78/500 [04:24<22:54,  3.26s/it]TRAINING THE MODEL:  16%|█▌        | 79/500 [04:27<22:55,  3.27s/it]TRAINING THE MODEL:  16%|█▌        | 80/500 [04:31<23:47,  3.40s/it]TRAINING THE MODEL:  16%|█▌        | 81/500 [04:34<23:40,  3.39s/it]TRAINING THE MODEL:  16%|█▌        | 81/500 [04:37<23:56,  3.43s/it]
wandb: updating run metadata
wandb: uploading output.log; uploading config.yaml
wandb: uploading history steps 79-81, summary, console lines 80-88
wandb: 
wandb: Run history:
wandb:          epoch ▁▁▁▂▂▂▂▂▃▃▃▃▃▃▃▄▄▄▄▄▅▅▅▅▅▆▆▆▆▆▇▇▇▇▇▇████
wandb:  test_accuracy ▁▆▇▇▇███████████████████████████████████
wandb:      test_loss █▆▅▄▄▃▃▂▂▂▁▁▁▁▁▁▁▁▁▁▁▁▁▁▁▁▁▁▁▁▁▁▁▁▁▁▁▁▁▁
wandb: train_accuracy ▁▃▃▆▆▇▇▇▇▇▇▇▇▇▇▇▇▇████████▇█████████████
wandb:     train_loss █▇▇▆▅▄▃▃▃▃▂▂▂▂▂▂▂▂▂▂▁▁▂▂▁▂▁▁▁▁▁▁▁▁▁▁▁▁▁▁
wandb: 
wandb: Run summary:
wandb:          epoch 81
wandb:  test_accuracy 0.93531
wandb:      test_loss 0.47901
wandb: train_accuracy 0.9675
wandb:     train_loss 0.41889
wandb: 
wandb: 🚀 View run Sweep run at: https://wandb.ai/mcv-team-6/C3-Week3/runs/lfuj91c0
wandb: ⭐️ View project at: https://wandb.ai/mcv-team-6/C3-Week3
wandb: Synced 5 W&B file(s), 0 media file(s), 0 artifact file(s) and 0 other file(s)
wandb: Find logs at: ./wandb/run-20260110_195156-lfuj91c0/logs
2026-01-10 19:56:45,189 - wandb.wandb_agent - INFO - Cleaning up finished run: lfuj91c0
wandb: Terminating and syncing runs. Press ctrl-c to kill.
