wandb: Starting wandb agent 🕵️
2026-01-10 20:45:57,994 - wandb.wandb_agent - INFO - Running runs: []
2026-01-10 20:45:58,331 - wandb.wandb_agent - INFO - Agent received command: run
2026-01-10 20:45:58,331 - wandb.wandb_agent - INFO - Agent starting run with config:
	affine: 0.8236907909195954
	blur: 0.07612646756832875
	brightness: 0.6071826467162178
	contrast: 0.6396840334568857
	crop: 0.8593499844851582
	crop_scale: 0.20596734205420963
	flip: 0.1300712818098975
	gaussian_blur_kernel: 7
	gaussian_noise_std: 2.2261456502672026
	grey: 0.09619313069505298
	hue: 0.06897812691225666
	jiggle: 0.14714716649244974
	rotate: 0.13258022077497222
	rotation: 40
	saturation: 1.1305702679750935
	scale: 1.019688563581234
	shear: 34
	translate_x: 0.0812282960030692
	translate_y: 0.2222570953588094
2026-01-10 20:45:58,335 - wandb.wandb_agent - INFO - About to run command: /usr/bin/env python train_data.py --affine=0.8236907909195954 --blur=0.07612646756832875 --brightness=0.6071826467162178 --contrast=0.6396840334568857 --crop=0.8593499844851582 --crop_scale=0.20596734205420963 --flip=0.1300712818098975 --gaussian_blur_kernel=7 --gaussian_noise_std=2.2261456502672026 --grey=0.09619313069505298 --hue=0.06897812691225666 --jiggle=0.14714716649244974 --rotate=0.13258022077497222 --rotation=40 --saturation=1.1305702679750935 --scale=1.019688563581234 --shear=34 --translate_x=0.0812282960030692 --translate_y=0.2222570953588094
wandb: Currently logged in as: arnaumarcosalmansa (mcv-team-6) to https://api.wandb.ai. Use `wandb login --relogin` to force relogin
wandb: WARNING Ignoring project 'C3-Week3' when running a sweep.
wandb: WARNING Ignoring entity 'mcv-team-6' when running a sweep.
2026-01-10 20:46:03,340 - wandb.wandb_agent - INFO - Running runs: ['eqelrfou']
wandb: setting up run eqelrfou
wandb: Tracking run with wandb version 0.23.1
wandb: Run data is saved locally in /export/home/group06/workspace/project-team-6/Week3/wandb/run-20260110_204602-eqelrfou
wandb: Run `wandb offline` to turn off syncing.
wandb: Syncing run Sweep run
wandb: ⭐️ View project at https://wandb.ai/mcv-team-6/C3-Week3
wandb: 🧹 View sweep at https://wandb.ai/mcv-team-6/C3-Week3/sweeps/8yeenlu8
wandb: 🚀 View run at https://wandb.ai/mcv-team-6/C3-Week3/runs/eqelrfou
TRAINING THE MODEL:   0%|          | 0/500 [00:00<?, ?it/s]TRAINING THE MODEL:   0%|          | 1/500 [00:04<38:54,  4.68s/it]TRAINING THE MODEL:   0%|          | 2/500 [00:07<32:08,  3.87s/it]TRAINING THE MODEL:   1%|          | 3/500 [00:11<29:42,  3.59s/it]TRAINING THE MODEL:   1%|          | 4/500 [00:14<28:31,  3.45s/it]TRAINING THE MODEL:   1%|          | 5/500 [00:17<28:02,  3.40s/it]TRAINING THE MODEL:   1%|          | 6/500 [00:21<27:57,  3.40s/it]TRAINING THE MODEL:   1%|▏         | 7/500 [00:24<27:35,  3.36s/it]TRAINING THE MODEL:   2%|▏         | 8/500 [00:27<27:14,  3.32s/it]TRAINING THE MODEL:   2%|▏         | 9/500 [00:31<27:13,  3.33s/it]TRAINING THE MODEL:   2%|▏         | 10/500 [00:34<27:09,  3.32s/it]TRAINING THE MODEL:   2%|▏         | 11/500 [00:37<27:06,  3.33s/it]TRAINING THE MODEL:   2%|▏         | 12/500 [00:41<27:07,  3.33s/it]TRAINING THE MODEL:   3%|▎         | 13/500 [00:44<27:01,  3.33s/it]TRAINING THE MODEL:   3%|▎         | 14/500 [00:47<26:53,  3.32s/it]TRAINING THE MODEL:   3%|▎         | 15/500 [00:50<26:47,  3.31s/it]TRAINING THE MODEL:   3%|▎         | 16/500 [00:54<26:43,  3.31s/it]TRAINING THE MODEL:   3%|▎         | 17/500 [00:57<26:48,  3.33s/it]TRAINING THE MODEL:   4%|▎         | 18/500 [01:01<27:22,  3.41s/it]TRAINING THE MODEL:   4%|▍         | 19/500 [01:04<27:08,  3.39s/it]TRAINING THE MODEL:   4%|▍         | 20/500 [01:08<28:34,  3.57s/it]TRAINING THE MODEL:   4%|▍         | 21/500 [01:11<27:52,  3.49s/it]TRAINING THE MODEL:   4%|▍         | 22/500 [01:15<27:21,  3.43s/it]TRAINING THE MODEL:   5%|▍         | 23/500 [01:18<27:13,  3.43s/it]TRAINING THE MODEL:   5%|▍         | 24/500 [01:21<26:50,  3.38s/it]TRAINING THE MODEL:   5%|▌         | 25/500 [01:25<26:53,  3.40s/it]TRAINING THE MODEL:   5%|▌         | 26/500 [01:28<26:47,  3.39s/it]TRAINING THE MODEL:   5%|▌         | 27/500 [01:32<26:39,  3.38s/it]TRAINING THE MODEL:   6%|▌         | 28/500 [01:35<26:39,  3.39s/it]TRAINING THE MODEL:   6%|▌         | 29/500 [01:38<26:24,  3.36s/it]TRAINING THE MODEL:   6%|▌         | 30/500 [01:42<27:33,  3.52s/it]TRAINING THE MODEL:   6%|▌         | 31/500 [01:46<27:16,  3.49s/it]TRAINING THE MODEL:   6%|▋         | 32/500 [01:49<26:43,  3.43s/it]TRAINING THE MODEL:   7%|▋         | 33/500 [01:52<26:33,  3.41s/it]TRAINING THE MODEL:   7%|▋         | 34/500 [01:56<26:29,  3.41s/it]TRAINING THE MODEL:   7%|▋         | 35/500 [01:59<26:31,  3.42s/it]TRAINING THE MODEL:   7%|▋         | 36/500 [02:02<26:06,  3.38s/it]TRAINING THE MODEL:   7%|▋         | 37/500 [02:06<25:52,  3.35s/it]TRAINING THE MODEL:   8%|▊         | 38/500 [02:09<25:56,  3.37s/it]TRAINING THE MODEL:   8%|▊         | 39/500 [02:12<25:52,  3.37s/it]TRAINING THE MODEL:   8%|▊         | 40/500 [02:17<27:46,  3.62s/it]TRAINING THE MODEL:   8%|▊         | 41/500 [02:20<27:00,  3.53s/it]TRAINING THE MODEL:   8%|▊         | 42/500 [02:23<26:20,  3.45s/it]TRAINING THE MODEL:   9%|▊         | 43/500 [02:27<26:04,  3.42s/it]TRAINING THE MODEL:   9%|▉         | 44/500 [02:30<25:50,  3.40s/it]TRAINING THE MODEL:   9%|▉         | 45/500 [02:33<25:30,  3.36s/it]TRAINING THE MODEL:   9%|▉         | 46/500 [02:37<25:34,  3.38s/it]TRAINING THE MODEL:   9%|▉         | 47/500 [02:40<25:18,  3.35s/it]TRAINING THE MODEL:  10%|▉         | 48/500 [02:43<25:12,  3.35s/it]TRAINING THE MODEL:  10%|▉         | 49/500 [02:47<25:12,  3.35s/it]TRAINING THE MODEL:  10%|▉         | 49/500 [02:51<26:15,  3.49s/it]
wandb: updating run metadata
wandb: uploading history steps 47-49, summary, console lines 48-56
wandb: 
wandb: Run history:
wandb:          epoch ▁▁▁▁▂▂▂▂▂▂▃▃▃▃▃▄▄▄▄▄▄▅▅▅▅▆▆▆▆▆▆▇▇▇▇▇▇███
wandb:  test_accuracy ▁▃▅▆▇███████████████████████████████████
wandb:      test_loss █▇▆▅▄▃▂▂▂▂▁▁▁▁▁▁▁▁▁▁▁▁▁▁▁▁▁▁▁▁▁▁▁▁▁▁▁▁▁▁
wandb: train_accuracy ▁▃▅▆▆▇▇▇▇▇▇▇▇█▇█▇▇██████████████████████
wandb:     train_loss █▇▆▅▅▄▃▃▃▂▂▂▂▂▂▁▂▂▂▁▁▁▁▁▁▁▁▁▁▁▁▁▁▁▁▁▁▁▁▁
wandb: 
wandb: Run summary:
wandb:          epoch 49
wandb:  test_accuracy 0.9292
wandb:      test_loss 0.34178
wandb: train_accuracy 0.9725
wandb:     train_loss 0.23754
wandb: 
wandb: 🚀 View run Sweep run at: https://wandb.ai/mcv-team-6/C3-Week3/runs/eqelrfou
wandb: ⭐️ View project at: https://wandb.ai/mcv-team-6/C3-Week3
wandb: Synced 5 W&B file(s), 0 media file(s), 0 artifact file(s) and 0 other file(s)
wandb: Find logs at: ./wandb/run-20260110_204602-eqelrfou/logs
2026-01-10 20:49:03,686 - wandb.wandb_agent - INFO - Cleaning up finished run: eqelrfou
wandb: Terminating and syncing runs. Press ctrl-c to kill.
