wandb: Starting wandb agent 🕵️
2026-01-10 22:48:10,395 - wandb.wandb_agent - INFO - Running runs: []
2026-01-10 22:48:10,800 - wandb.wandb_agent - INFO - Agent received command: run
2026-01-10 22:48:10,800 - wandb.wandb_agent - INFO - Agent starting run with config:
	affine: 0.06795502871047443
	blur: 0.7714586110082975
	brightness: 1.1556084707206864
	contrast: 1.255653845644345
	crop: 0.9245029764185452
	crop_scale: 0.48598293266420456
	flip: 0.5223194221283669
	gaussian_blur_kernel: 9
	gaussian_noise_std: 0.6985763120336046
	grey: 0.645492239416544
	hue: 0.013816903964912575
	jiggle: 0.3356806344373674
	rotate: 0.15396411920541353
	rotation: 19
	saturation: 1.1993290773863718
	scale: 0.9712601928991652
	shear: 14
	translate_x: 0.3821260514764996
	translate_y: 0.3802536968861633
2026-01-10 22:48:10,804 - wandb.wandb_agent - INFO - About to run command: /usr/bin/env python train_data.py --affine=0.06795502871047443 --blur=0.7714586110082975 --brightness=1.1556084707206864 --contrast=1.255653845644345 --crop=0.9245029764185452 --crop_scale=0.48598293266420456 --flip=0.5223194221283669 --gaussian_blur_kernel=9 --gaussian_noise_std=0.6985763120336046 --grey=0.645492239416544 --hue=0.013816903964912575 --jiggle=0.3356806344373674 --rotate=0.15396411920541353 --rotation=19 --saturation=1.1993290773863718 --scale=0.9712601928991652 --shear=14 --translate_x=0.3821260514764996 --translate_y=0.3802536968861633
wandb: Currently logged in as: arnaumarcosalmansa (mcv-team-6) to https://api.wandb.ai. Use `wandb login --relogin` to force relogin
wandb: WARNING Ignoring project 'C3-Week3' when running a sweep.
wandb: WARNING Ignoring entity 'mcv-team-6' when running a sweep.
2026-01-10 22:48:15,811 - wandb.wandb_agent - INFO - Running runs: ['wk9rnqr0']
wandb: setting up run wk9rnqr0
wandb: Tracking run with wandb version 0.23.1
wandb: Run data is saved locally in /export/home/group06/workspace/project-team-6/Week3/wandb/run-20260110_224815-wk9rnqr0
wandb: Run `wandb offline` to turn off syncing.
wandb: Syncing run Sweep run
wandb: ⭐️ View project at https://wandb.ai/mcv-team-6/C3-Week3
wandb: 🧹 View sweep at https://wandb.ai/mcv-team-6/C3-Week3/sweeps/ig5z7cnx
wandb: 🚀 View run at https://wandb.ai/mcv-team-6/C3-Week3/runs/wk9rnqr0
TRAINING THE MODEL:   0%|          | 0/500 [00:00<?, ?it/s]TRAINING THE MODEL:   0%|          | 1/500 [00:04<39:37,  4.77s/it]TRAINING THE MODEL:   0%|          | 2/500 [00:08<32:18,  3.89s/it]TRAINING THE MODEL:   1%|          | 3/500 [00:11<29:50,  3.60s/it]TRAINING THE MODEL:   1%|          | 4/500 [00:14<28:48,  3.49s/it]TRAINING THE MODEL:   1%|          | 5/500 [00:17<28:08,  3.41s/it]TRAINING THE MODEL:   1%|          | 6/500 [00:21<28:03,  3.41s/it]TRAINING THE MODEL:   1%|▏         | 7/500 [00:24<27:46,  3.38s/it]TRAINING THE MODEL:   2%|▏         | 8/500 [00:27<27:36,  3.37s/it]TRAINING THE MODEL:   2%|▏         | 9/500 [00:31<27:31,  3.36s/it]TRAINING THE MODEL:   2%|▏         | 10/500 [00:34<27:28,  3.36s/it]TRAINING THE MODEL:   2%|▏         | 11/500 [00:38<27:24,  3.36s/it]TRAINING THE MODEL:   2%|▏         | 12/500 [00:41<27:28,  3.38s/it]TRAINING THE MODEL:   3%|▎         | 13/500 [00:44<27:27,  3.38s/it]TRAINING THE MODEL:   3%|▎         | 14/500 [00:48<27:30,  3.40s/it]TRAINING THE MODEL:   3%|▎         | 15/500 [00:51<27:37,  3.42s/it]TRAINING THE MODEL:   3%|▎         | 16/500 [00:55<27:48,  3.45s/it]TRAINING THE MODEL:   3%|▎         | 17/500 [00:58<27:47,  3.45s/it]TRAINING THE MODEL:   4%|▎         | 18/500 [01:02<27:49,  3.46s/it]TRAINING THE MODEL:   4%|▍         | 19/500 [01:05<28:01,  3.50s/it]TRAINING THE MODEL:   4%|▍         | 20/500 [01:09<29:22,  3.67s/it]TRAINING THE MODEL:   4%|▍         | 21/500 [01:13<28:46,  3.60s/it]TRAINING THE MODEL:   4%|▍         | 22/500 [01:16<28:25,  3.57s/it]TRAINING THE MODEL:   5%|▍         | 23/500 [01:20<28:09,  3.54s/it]TRAINING THE MODEL:   5%|▍         | 24/500 [01:23<28:00,  3.53s/it]TRAINING THE MODEL:   5%|▌         | 25/500 [01:27<27:42,  3.50s/it]TRAINING THE MODEL:   5%|▌         | 26/500 [01:30<27:42,  3.51s/it]TRAINING THE MODEL:   5%|▌         | 27/500 [01:34<27:20,  3.47s/it]TRAINING THE MODEL:   6%|▌         | 28/500 [01:37<27:39,  3.52s/it]TRAINING THE MODEL:   6%|▌         | 29/500 [01:41<27:50,  3.55s/it]TRAINING THE MODEL:   6%|▌         | 30/500 [01:45<29:11,  3.73s/it]TRAINING THE MODEL:   6%|▌         | 31/500 [01:48<28:35,  3.66s/it]TRAINING THE MODEL:   6%|▋         | 32/500 [01:52<28:15,  3.62s/it]TRAINING THE MODEL:   7%|▋         | 33/500 [01:56<28:00,  3.60s/it]TRAINING THE MODEL:   7%|▋         | 34/500 [01:59<28:38,  3.69s/it]TRAINING THE MODEL:   7%|▋         | 35/500 [02:04<29:43,  3.84s/it]TRAINING THE MODEL:   7%|▋         | 36/500 [02:07<29:03,  3.76s/it]TRAINING THE MODEL:   7%|▋         | 37/500 [02:11<28:39,  3.71s/it]TRAINING THE MODEL:   8%|▊         | 38/500 [02:14<28:27,  3.70s/it]TRAINING THE MODEL:   8%|▊         | 39/500 [02:18<27:48,  3.62s/it]TRAINING THE MODEL:   8%|▊         | 40/500 [02:22<29:23,  3.83s/it]TRAINING THE MODEL:   8%|▊         | 41/500 [02:26<28:48,  3.77s/it]TRAINING THE MODEL:   8%|▊         | 42/500 [02:29<27:59,  3.67s/it]TRAINING THE MODEL:   9%|▊         | 43/500 [02:33<27:18,  3.58s/it]TRAINING THE MODEL:   9%|▉         | 44/500 [02:37<28:15,  3.72s/it]TRAINING THE MODEL:   9%|▉         | 45/500 [02:40<28:16,  3.73s/it]TRAINING THE MODEL:   9%|▉         | 46/500 [02:44<27:34,  3.64s/it]TRAINING THE MODEL:   9%|▉         | 47/500 [02:48<27:42,  3.67s/it]TRAINING THE MODEL:  10%|▉         | 48/500 [02:51<27:13,  3.61s/it]TRAINING THE MODEL:  10%|▉         | 49/500 [02:55<26:52,  3.58s/it]TRAINING THE MODEL:  10%|█         | 50/500 [02:59<27:55,  3.72s/it]TRAINING THE MODEL:  10%|█         | 51/500 [03:03<28:28,  3.81s/it]TRAINING THE MODEL:  10%|█         | 52/500 [03:06<28:10,  3.77s/it]TRAINING THE MODEL:  11%|█         | 53/500 [03:10<27:40,  3.72s/it]TRAINING THE MODEL:  11%|█         | 54/500 [03:14<27:34,  3.71s/it]TRAINING THE MODEL:  11%|█         | 55/500 [03:17<27:19,  3.68s/it]TRAINING THE MODEL:  11%|█         | 56/500 [03:21<27:08,  3.67s/it]TRAINING THE MODEL:  11%|█▏        | 57/500 [03:25<27:19,  3.70s/it]TRAINING THE MODEL:  12%|█▏        | 58/500 [03:28<27:21,  3.71s/it]TRAINING THE MODEL:  12%|█▏        | 59/500 [03:32<27:20,  3.72s/it]TRAINING THE MODEL:  12%|█▏        | 60/500 [03:36<27:57,  3.81s/it]TRAINING THE MODEL:  12%|█▏        | 61/500 [03:40<27:35,  3.77s/it]TRAINING THE MODEL:  12%|█▏        | 62/500 [03:44<28:47,  3.94s/it]TRAINING THE MODEL:  13%|█▎        | 63/500 [03:48<27:36,  3.79s/it]TRAINING THE MODEL:  13%|█▎        | 64/500 [03:51<27:05,  3.73s/it]TRAINING THE MODEL:  13%|█▎        | 65/500 [03:55<26:45,  3.69s/it]TRAINING THE MODEL:  13%|█▎        | 66/500 [03:58<26:13,  3.62s/it]TRAINING THE MODEL:  13%|█▎        | 67/500 [04:02<26:12,  3.63s/it]TRAINING THE MODEL:  14%|█▎        | 68/500 [04:05<25:38,  3.56s/it]TRAINING THE MODEL:  14%|█▍        | 69/500 [04:09<25:42,  3.58s/it]TRAINING THE MODEL:  14%|█▍        | 70/500 [04:13<26:32,  3.70s/it]TRAINING THE MODEL:  14%|█▍        | 71/500 [04:16<25:50,  3.61s/it]TRAINING THE MODEL:  14%|█▍        | 72/500 [04:20<25:25,  3.56s/it]TRAINING THE MODEL:  15%|█▍        | 73/500 [04:24<25:44,  3.62s/it]TRAINING THE MODEL:  15%|█▍        | 74/500 [04:27<25:35,  3.61s/it]TRAINING THE MODEL:  15%|█▌        | 75/500 [04:31<25:33,  3.61s/it]TRAINING THE MODEL:  15%|█▌        | 76/500 [04:34<25:28,  3.60s/it]TRAINING THE MODEL:  15%|█▌        | 76/500 [04:38<25:52,  3.66s/it]
wandb: updating run metadata
wandb: uploading output.log; uploading config.yaml
wandb: uploading history steps 73-76, summary, console lines 74-83
wandb: 
wandb: Run history:
wandb:          epoch ▁▁▁▁▁▂▂▂▂▂▃▃▃▃▃▃▄▄▄▄▅▅▅▅▅▅▆▆▆▆▆▆▇▇▇▇▇▇██
wandb:  test_accuracy ▁▃▄▅▆▇▇█████████████████████████████████
wandb:      test_loss █▇▆▅▃▂▂▁▁▁▁▁▁▁▁▁▁▁▁▁▁▁▁▁▁▁▁▁▁▁▁▁▁▁▁▁▁▁▁▁
wandb: train_accuracy ▁▃▅▆▆▇▇▇▇▇▇█▇▇███▇██████████████████████
wandb:     train_loss █▆▆▄▄▃▃▃▃▃▂▂▂▂▂▂▁▁▁▁▁▁▁▁▁▁▁▁▁▁▁▁▁▁▁▁▁▁▁▁
wandb: 
wandb: Run summary:
wandb:          epoch 76
wandb:  test_accuracy 0.94274
wandb:      test_loss 0.30797
wandb: train_accuracy 0.9675
wandb:     train_loss 0.23468
wandb: 
wandb: 🚀 View run Sweep run at: https://wandb.ai/mcv-team-6/C3-Week3/runs/wk9rnqr0
wandb: ⭐️ View project at: https://wandb.ai/mcv-team-6/C3-Week3
wandb: Synced 5 W&B file(s), 0 media file(s), 0 artifact file(s) and 0 other file(s)
wandb: Find logs at: ./wandb/run-20260110_224815-wk9rnqr0/logs
2026-01-10 22:53:04,237 - wandb.wandb_agent - INFO - Cleaning up finished run: wk9rnqr0
wandb: Terminating and syncing runs. Press ctrl-c to kill.
