Using GPU 0: NVIDIA GeForce RTX 3090
Epoch 1/500 - Train Loss: 1.0724, Train Accuracy: 0.6325, Test Loss: 3.1297, Test Accuracy: 0.4515
Epoch 2/500 - Train Loss: 0.7403, Train Accuracy: 0.8000, Test Loss: 2.1143, Test Accuracy: 0.6202
Epoch 3/500 - Train Loss: 0.5483, Train Accuracy: 0.8400, Test Loss: 0.6417, Test Accuracy: 0.8073
Epoch 4/500 - Train Loss: 0.4091, Train Accuracy: 0.8725, Test Loss: 0.6137, Test Accuracy: 0.8112
Epoch 5/500 - Train Loss: 0.3968, Train Accuracy: 0.8950, Test Loss: 0.4133, Test Accuracy: 0.8899
Epoch 6/500 - Train Loss: 0.3083, Train Accuracy: 0.9275, Test Loss: 0.4208, Test Accuracy: 0.8737
Epoch 7/500 - Train Loss: 0.2473, Train Accuracy: 0.9500, Test Loss: 0.3402, Test Accuracy: 0.9104
Epoch 8/500 - Train Loss: 0.2578, Train Accuracy: 0.9400, Test Loss: 0.4079, Test Accuracy: 0.8907
Epoch 9/500 - Train Loss: 0.2557, Train Accuracy: 0.9325, Test Loss: 0.3562, Test Accuracy: 0.9095
Epoch 10/500 - Train Loss: 0.1885, Train Accuracy: 0.9675, Test Loss: 0.3370, Test Accuracy: 0.9113
Epoch 11/500 - Train Loss: 0.1805, Train Accuracy: 0.9600, Test Loss: 0.3270, Test Accuracy: 0.9108
Epoch 12/500 - Train Loss: 0.1795, Train Accuracy: 0.9725, Test Loss: 0.3572, Test Accuracy: 0.9047
Epoch 13/500 - Train Loss: 0.2236, Train Accuracy: 0.9500, Test Loss: 0.4010, Test Accuracy: 0.8925
Epoch 14/500 - Train Loss: 0.2393, Train Accuracy: 0.9475, Test Loss: 0.5660, Test Accuracy: 0.8317
Epoch 15/500 - Train Loss: 0.1626, Train Accuracy: 0.9750, Test Loss: 0.3842, Test Accuracy: 0.8929
Epoch 16/500 - Train Loss: 0.1550, Train Accuracy: 0.9825, Test Loss: 0.4188, Test Accuracy: 0.8868
Epoch 17/500 - Train Loss: 0.1418, Train Accuracy: 0.9825, Test Loss: 0.3591, Test Accuracy: 0.9104
Epoch 18/500 - Train Loss: 0.1573, Train Accuracy: 0.9800, Test Loss: 0.3719, Test Accuracy: 0.9047
Epoch 19/500 - Train Loss: 0.1622, Train Accuracy: 0.9725, Test Loss: 0.3836, Test Accuracy: 0.8990
Epoch 20/500 - Train Loss: 0.1410, Train Accuracy: 0.9775, Test Loss: 0.4024, Test Accuracy: 0.9043
Epoch 21/500 - Train Loss: 0.1231, Train Accuracy: 0.9925, Test Loss: 0.3301, Test Accuracy: 0.9218
Epoch 22/500 - Train Loss: 0.1784, Train Accuracy: 0.9600, Test Loss: 0.6933, Test Accuracy: 0.8309
Epoch 23/500 - Train Loss: 0.1720, Train Accuracy: 0.9650, Test Loss: 0.5825, Test Accuracy: 0.8610
Epoch 24/500 - Train Loss: 0.1918, Train Accuracy: 0.9700, Test Loss: 0.3867, Test Accuracy: 0.8982
Epoch 25/500 - Train Loss: 0.1514, Train Accuracy: 0.9775, Test Loss: 0.4584, Test Accuracy: 0.8746
Epoch 26/500 - Train Loss: 0.1390, Train Accuracy: 0.9825, Test Loss: 0.4212, Test Accuracy: 0.8746

Early stopping triggered at epoch 26
Best test loss: 0.3301
Best test accuracy: 0.9218
Plot saved as trained_models/Sweep run/metrics/loss.png
Plot saved as trained_models/Sweep run/metrics/metrics.png
Using GPU 0: NVIDIA GeForce RTX 3090
Using GPU 0: NVIDIA GeForce RTX 3090
Epoch 1/500 - Train Loss: 2.2387, Train Accuracy: 0.2750, Test Loss: 531091.3802, Test Accuracy: 0.1058
Epoch 2/500 - Train Loss: 1.8340, Train Accuracy: 0.3825, Test Loss: 238.4359, Test Accuracy: 0.1783
Epoch 3/500 - Train Loss: 1.6482, Train Accuracy: 0.4750, Test Loss: 4.0424, Test Accuracy: 0.3396
Epoch 4/500 - Train Loss: 1.5402, Train Accuracy: 0.5400, Test Loss: 3.0208, Test Accuracy: 0.3081
Epoch 5/500 - Train Loss: 1.5858, Train Accuracy: 0.5500, Test Loss: 2.0188, Test Accuracy: 0.5214
Epoch 6/500 - Train Loss: 1.4701, Train Accuracy: 0.6300, Test Loss: 1.5176, Test Accuracy: 0.5865
Epoch 7/500 - Train Loss: 1.3561, Train Accuracy: 0.6725, Test Loss: 1.6725, Test Accuracy: 0.5896
Epoch 8/500 - Train Loss: 1.3782, Train Accuracy: 0.6850, Test Loss: 2.0561, Test Accuracy: 0.5511
Epoch 9/500 - Train Loss: 1.3694, Train Accuracy: 0.6400, Test Loss: 1.3933, Test Accuracy: 0.6503
Epoch 10/500 - Train Loss: 1.2902, Train Accuracy: 0.7100, Test Loss: 9.5598, Test Accuracy: 0.5433
Epoch 11/500 - Train Loss: 1.2493, Train Accuracy: 0.7325, Test Loss: 1.8152, Test Accuracy: 0.5669
Epoch 12/500 - Train Loss: 1.3012, Train Accuracy: 0.7150, Test Loss: 1.3530, Test Accuracy: 0.6927
Epoch 13/500 - Train Loss: 1.2545, Train Accuracy: 0.7150, Test Loss: 160.7277, Test Accuracy: 0.2247
Epoch 14/500 - Train Loss: 1.1762, Train Accuracy: 0.7500, Test Loss: 2.8168, Test Accuracy: 0.6429
Epoch 15/500 - Train Loss: 1.2027, Train Accuracy: 0.7475, Test Loss: 1.4926, Test Accuracy: 0.5935
Epoch 16/500 - Train Loss: 1.1928, Train Accuracy: 0.7525, Test Loss: 1.4789, Test Accuracy: 0.7032
Epoch 17/500 - Train Loss: 1.1770, Train Accuracy: 0.7675, Test Loss: 1.2837, Test Accuracy: 0.7889
Epoch 18/500 - Train Loss: 1.1449, Train Accuracy: 0.7725, Test Loss: 18.7744, Test Accuracy: 0.7028
Epoch 19/500 - Train Loss: 1.1386, Train Accuracy: 0.7725, Test Loss: 3.6289, Test Accuracy: 0.7395
Epoch 20/500 - Train Loss: 1.1599, Train Accuracy: 0.7750, Test Loss: 1.3491, Test Accuracy: 0.7351
Epoch 21/500 - Train Loss: 1.0865, Train Accuracy: 0.8325, Test Loss: 1.4036, Test Accuracy: 0.6941
Epoch 22/500 - Train Loss: 1.1798, Train Accuracy: 0.7875, Test Loss: 3.2795, Test Accuracy: 0.7330
Epoch 23/500 - Train Loss: 1.1325, Train Accuracy: 0.7825, Test Loss: 1.3275, Test Accuracy: 0.7753
Epoch 24/500 - Train Loss: 1.1096, Train Accuracy: 0.7975, Test Loss: 1.2150, Test Accuracy: 0.7469
Epoch 25/500 - Train Loss: 1.1334, Train Accuracy: 0.7700, Test Loss: 1.4154, Test Accuracy: 0.7037
Epoch 26/500 - Train Loss: 1.1546, Train Accuracy: 0.7600, Test Loss: 1.5013, Test Accuracy: 0.6639
Epoch 27/500 - Train Loss: 1.0934, Train Accuracy: 0.7950, Test Loss: 1.3473, Test Accuracy: 0.6862
Epoch 28/500 - Train Loss: 1.0546, Train Accuracy: 0.8200, Test Loss: 1.0862, Test Accuracy: 0.8151
Epoch 29/500 - Train Loss: 1.0074, Train Accuracy: 0.8700, Test Loss: 1.3160, Test Accuracy: 0.7094
Epoch 30/500 - Train Loss: 1.0519, Train Accuracy: 0.8325, Test Loss: 1.3412, Test Accuracy: 0.7076
Epoch 31/500 - Train Loss: 1.0717, Train Accuracy: 0.8250, Test Loss: 1.3051, Test Accuracy: 0.7408
Epoch 32/500 - Train Loss: 1.1315, Train Accuracy: 0.8000, Test Loss: 1.4068, Test Accuracy: 0.7098
Epoch 33/500 - Train Loss: 1.0637, Train Accuracy: 0.8275, Test Loss: 4.3442, Test Accuracy: 0.4585
Epoch 34/500 - Train Loss: 1.1051, Train Accuracy: 0.8200, Test Loss: 4.1595, Test Accuracy: 0.6189
Epoch 35/500 - Train Loss: 1.1112, Train Accuracy: 0.7850, Test Loss: 1.2266, Test Accuracy: 0.7452
Epoch 36/500 - Train Loss: 1.0365, Train Accuracy: 0.8325, Test Loss: 1.1602, Test Accuracy: 0.7823
Epoch 37/500 - Train Loss: 1.0036, Train Accuracy: 0.8625, Test Loss: 1.2729, Test Accuracy: 0.7928
Epoch 38/500 - Train Loss: 1.0522, Train Accuracy: 0.8425, Test Loss: 1.2394, Test Accuracy: 0.7622
Epoch 39/500 - Train Loss: 1.0299, Train Accuracy: 0.8375, Test Loss: 1.2129, Test Accuracy: 0.7653
Epoch 40/500 - Train Loss: 0.9963, Train Accuracy: 0.8575, Test Loss: 1.2182, Test Accuracy: 0.7684
Epoch 41/500 - Train Loss: 0.9654, Train Accuracy: 0.8775, Test Loss: 1.2798, Test Accuracy: 0.7373
Epoch 42/500 - Train Loss: 0.9536, Train Accuracy: 0.8825, Test Loss: 1.1857, Test Accuracy: 0.7483
Epoch 43/500 - Train Loss: 0.9723, Train Accuracy: 0.8875, Test Loss: 1.3062, Test Accuracy: 0.7395

Early stopping triggered at epoch 43
Best test loss: 1.0862
Best test accuracy: 0.8151
Plot saved as trained_models/Sweep run/metrics/loss.png
Plot saved as trained_models/Sweep run/metrics/metrics.png
Using GPU 0: NVIDIA GeForce RTX 3090
Epoch 1/500 - Train Loss: 1.2009, Train Accuracy: 0.6525, Test Loss: 1.6832, Test Accuracy: 0.4078
Epoch 2/500 - Train Loss: 0.4378, Train Accuracy: 0.9200, Test Loss: 0.7904, Test Accuracy: 0.8077
Epoch 3/500 - Train Loss: 0.3313, Train Accuracy: 0.9500, Test Loss: 0.5528, Test Accuracy: 0.8706
Epoch 4/500 - Train Loss: 0.2993, Train Accuracy: 0.9525, Test Loss: 0.4157, Test Accuracy: 0.9122
Epoch 5/500 - Train Loss: 0.2795, Train Accuracy: 0.9800, Test Loss: 0.3686, Test Accuracy: 0.9257
Epoch 6/500 - Train Loss: 0.2821, Train Accuracy: 0.9650, Test Loss: 0.3685, Test Accuracy: 0.9305
Epoch 7/500 - Train Loss: 0.2436, Train Accuracy: 0.9825, Test Loss: 0.3642, Test Accuracy: 0.9362
Epoch 8/500 - Train Loss: 0.2367, Train Accuracy: 0.9900, Test Loss: 0.3732, Test Accuracy: 0.9344
Epoch 9/500 - Train Loss: 0.2396, Train Accuracy: 0.9900, Test Loss: 0.3663, Test Accuracy: 0.9314
Epoch 10/500 - Train Loss: 0.2320, Train Accuracy: 0.9900, Test Loss: 0.3862, Test Accuracy: 0.9257
Epoch 11/500 - Train Loss: 0.2110, Train Accuracy: 0.9925, Test Loss: 0.4095, Test Accuracy: 0.9191
Epoch 12/500 - Train Loss: 0.2289, Train Accuracy: 0.9875, Test Loss: 0.3657, Test Accuracy: 0.9301
Epoch 13/500 - Train Loss: 0.2114, Train Accuracy: 0.9950, Test Loss: 0.3679, Test Accuracy: 0.9358
Epoch 14/500 - Train Loss: 0.2041, Train Accuracy: 0.9950, Test Loss: 0.3748, Test Accuracy: 0.9314
Epoch 15/500 - Train Loss: 0.2213, Train Accuracy: 0.9900, Test Loss: 0.3660, Test Accuracy: 0.9323
Epoch 16/500 - Train Loss: 0.2178, Train Accuracy: 0.9900, Test Loss: 0.3683, Test Accuracy: 0.9283
Epoch 17/500 - Train Loss: 0.2080, Train Accuracy: 0.9950, Test Loss: 0.3737, Test Accuracy: 0.9323
Epoch 18/500 - Train Loss: 0.2154, Train Accuracy: 0.9900, Test Loss: 0.3593, Test Accuracy: 0.9362
Epoch 19/500 - Train Loss: 0.2038, Train Accuracy: 0.9950, Test Loss: 0.3567, Test Accuracy: 0.9401
Epoch 20/500 - Train Loss: 0.1992, Train Accuracy: 0.9975, Test Loss: 0.3660, Test Accuracy: 0.9336
Epoch 21/500 - Train Loss: 0.1972, Train Accuracy: 1.0000, Test Loss: 0.3754, Test Accuracy: 0.9283
Epoch 22/500 - Train Loss: 0.2068, Train Accuracy: 0.9925, Test Loss: 0.3696, Test Accuracy: 0.9340
Epoch 23/500 - Train Loss: 0.2028, Train Accuracy: 0.9950, Test Loss: 0.3616, Test Accuracy: 0.9362
Epoch 24/500 - Train Loss: 0.2013, Train Accuracy: 0.9950, Test Loss: 0.3523, Test Accuracy: 0.9366
Epoch 25/500 - Train Loss: 0.2027, Train Accuracy: 0.9950, Test Loss: 0.3533, Test Accuracy: 0.9340
Epoch 26/500 - Train Loss: 0.1934, Train Accuracy: 0.9975, Test Loss: 0.3563, Test Accuracy: 0.9327
Epoch 27/500 - Train Loss: 0.2015, Train Accuracy: 0.9950, Test Loss: 0.3514, Test Accuracy: 0.9340
Epoch 28/500 - Train Loss: 0.1925, Train Accuracy: 1.0000, Test Loss: 0.3614, Test Accuracy: 0.9331
Epoch 29/500 - Train Loss: 0.1967, Train Accuracy: 0.9975, Test Loss: 0.3684, Test Accuracy: 0.9248
Epoch 30/500 - Train Loss: 0.1954, Train Accuracy: 0.9975, Test Loss: 0.3638, Test Accuracy: 0.9305
Epoch 31/500 - Train Loss: 0.1914, Train Accuracy: 0.9975, Test Loss: 0.3609, Test Accuracy: 0.9340
Epoch 32/500 - Train Loss: 0.1944, Train Accuracy: 0.9950, Test Loss: 0.3597, Test Accuracy: 0.9327
Epoch 33/500 - Train Loss: 0.1906, Train Accuracy: 1.0000, Test Loss: 0.3485, Test Accuracy: 0.9397
Epoch 34/500 - Train Loss: 0.2034, Train Accuracy: 0.9925, Test Loss: 0.3570, Test Accuracy: 0.9366
Epoch 35/500 - Train Loss: 0.1931, Train Accuracy: 0.9975, Test Loss: 0.3620, Test Accuracy: 0.9327
Epoch 36/500 - Train Loss: 0.1889, Train Accuracy: 1.0000, Test Loss: 0.3594, Test Accuracy: 0.9292
Epoch 37/500 - Train Loss: 0.1954, Train Accuracy: 0.9975, Test Loss: 0.3587, Test Accuracy: 0.9274
Epoch 38/500 - Train Loss: 0.1892, Train Accuracy: 1.0000, Test Loss: 0.3627, Test Accuracy: 0.9301
Epoch 39/500 - Train Loss: 0.1894, Train Accuracy: 1.0000, Test Loss: 0.3626, Test Accuracy: 0.9327
Epoch 40/500 - Train Loss: 0.1933, Train Accuracy: 0.9975, Test Loss: 0.3542, Test Accuracy: 0.9344
Epoch 41/500 - Train Loss: 0.1982, Train Accuracy: 0.9925, Test Loss: 0.3599, Test Accuracy: 0.9353
Epoch 42/500 - Train Loss: 0.1989, Train Accuracy: 1.0000, Test Loss: 0.3578, Test Accuracy: 0.9379
Epoch 43/500 - Train Loss: 0.1911, Train Accuracy: 1.0000, Test Loss: 0.3638, Test Accuracy: 0.9283
Epoch 44/500 - Train Loss: 0.1909, Train Accuracy: 1.0000, Test Loss: 0.3735, Test Accuracy: 0.9266
Epoch 45/500 - Train Loss: 0.1862, Train Accuracy: 1.0000, Test Loss: 0.3825, Test Accuracy: 0.9244
Epoch 46/500 - Train Loss: 0.1863, Train Accuracy: 1.0000, Test Loss: 0.3790, Test Accuracy: 0.9257
Epoch 47/500 - Train Loss: 0.1911, Train Accuracy: 0.9975, Test Loss: 0.3785, Test Accuracy: 0.9266
Epoch 48/500 - Train Loss: 0.1901, Train Accuracy: 0.9975, Test Loss: 0.3605, Test Accuracy: 0.9344

Early stopping triggered at epoch 48
Best test loss: 0.3485
Best test accuracy: 0.9401
Plot saved as trained_models/Sweep run/metrics/loss.png
Plot saved as trained_models/Sweep run/metrics/metrics.png
Using GPU 0: NVIDIA GeForce RTX 3090
Epoch 1/500 - Train Loss: 1.1797, Train Accuracy: 0.6500, Test Loss: 1.7178, Test Accuracy: 0.4410
Epoch 2/500 - Train Loss: 0.4396, Train Accuracy: 0.9200, Test Loss: 0.7927, Test Accuracy: 0.8007
Epoch 3/500 - Train Loss: 0.3392, Train Accuracy: 0.9525, Test Loss: 0.5510, Test Accuracy: 0.8798
Epoch 4/500 - Train Loss: 0.3161, Train Accuracy: 0.9525, Test Loss: 0.4328, Test Accuracy: 0.9178
Epoch 5/500 - Train Loss: 0.2845, Train Accuracy: 0.9700, Test Loss: 0.3914, Test Accuracy: 0.9222
Epoch 6/500 - Train Loss: 0.2832, Train Accuracy: 0.9700, Test Loss: 0.3957, Test Accuracy: 0.9253
Epoch 7/500 - Train Loss: 0.2594, Train Accuracy: 0.9800, Test Loss: 0.3917, Test Accuracy: 0.9283
Epoch 8/500 - Train Loss: 0.2480, Train Accuracy: 0.9875, Test Loss: 0.3816, Test Accuracy: 0.9353
Epoch 9/500 - Train Loss: 0.2478, Train Accuracy: 0.9850, Test Loss: 0.3980, Test Accuracy: 0.9244
Epoch 10/500 - Train Loss: 0.2497, Train Accuracy: 0.9875, Test Loss: 0.3864, Test Accuracy: 0.9323
Epoch 11/500 - Train Loss: 0.2247, Train Accuracy: 0.9925, Test Loss: 0.4074, Test Accuracy: 0.9226
Epoch 12/500 - Train Loss: 0.2282, Train Accuracy: 0.9975, Test Loss: 0.4009, Test Accuracy: 0.9270
Epoch 13/500 - Train Loss: 0.2175, Train Accuracy: 0.9950, Test Loss: 0.3872, Test Accuracy: 0.9288
Epoch 14/500 - Train Loss: 0.2108, Train Accuracy: 0.9975, Test Loss: 0.3881, Test Accuracy: 0.9248
Epoch 15/500 - Train Loss: 0.2299, Train Accuracy: 0.9950, Test Loss: 0.3888, Test Accuracy: 0.9240
Epoch 16/500 - Train Loss: 0.2270, Train Accuracy: 0.9950, Test Loss: 0.3776, Test Accuracy: 0.9323
Epoch 17/500 - Train Loss: 0.2163, Train Accuracy: 0.9975, Test Loss: 0.3645, Test Accuracy: 0.9353
Epoch 18/500 - Train Loss: 0.2240, Train Accuracy: 0.9950, Test Loss: 0.3678, Test Accuracy: 0.9327
Epoch 19/500 - Train Loss: 0.2134, Train Accuracy: 0.9950, Test Loss: 0.3697, Test Accuracy: 0.9331
Epoch 20/500 - Train Loss: 0.2101, Train Accuracy: 0.9975, Test Loss: 0.3805, Test Accuracy: 0.9248
Epoch 21/500 - Train Loss: 0.2083, Train Accuracy: 1.0000, Test Loss: 0.3825, Test Accuracy: 0.9266
Epoch 22/500 - Train Loss: 0.2159, Train Accuracy: 0.9975, Test Loss: 0.3790, Test Accuracy: 0.9314
Epoch 23/500 - Train Loss: 0.2135, Train Accuracy: 0.9950, Test Loss: 0.3686, Test Accuracy: 0.9340
Epoch 24/500 - Train Loss: 0.2061, Train Accuracy: 1.0000, Test Loss: 0.3693, Test Accuracy: 0.9327
Epoch 25/500 - Train Loss: 0.2185, Train Accuracy: 0.9950, Test Loss: 0.3811, Test Accuracy: 0.9283
Epoch 26/500 - Train Loss: 0.2044, Train Accuracy: 0.9975, Test Loss: 0.3963, Test Accuracy: 0.9226
Epoch 27/500 - Train Loss: 0.2168, Train Accuracy: 0.9950, Test Loss: 0.3783, Test Accuracy: 0.9292
Epoch 28/500 - Train Loss: 0.2048, Train Accuracy: 1.0000, Test Loss: 0.3803, Test Accuracy: 0.9327
Epoch 29/500 - Train Loss: 0.2090, Train Accuracy: 0.9975, Test Loss: 0.3874, Test Accuracy: 0.9257
Epoch 30/500 - Train Loss: 0.2108, Train Accuracy: 0.9950, Test Loss: 0.3860, Test Accuracy: 0.9261
Epoch 31/500 - Train Loss: 0.2037, Train Accuracy: 1.0000, Test Loss: 0.3739, Test Accuracy: 0.9296
Epoch 32/500 - Train Loss: 0.2099, Train Accuracy: 0.9975, Test Loss: 0.3723, Test Accuracy: 0.9305

Early stopping triggered at epoch 32
Best test loss: 0.3645
Best test accuracy: 0.9353
Plot saved as trained_models/Sweep run/metrics/loss.png
Plot saved as trained_models/Sweep run/metrics/metrics.png
Using GPU 0: NVIDIA GeForce RTX 3090
Epoch 1/500 - Train Loss: 1.4363, Train Accuracy: 0.5975, Test Loss: 1.8456, Test Accuracy: 0.4856
Epoch 2/500 - Train Loss: 0.5148, Train Accuracy: 0.9000, Test Loss: 0.8537, Test Accuracy: 0.8304
Epoch 3/500 - Train Loss: 0.2841, Train Accuracy: 0.9600, Test Loss: 0.4978, Test Accuracy: 0.8623
Epoch 4/500 - Train Loss: 0.2492, Train Accuracy: 0.9525, Test Loss: 0.3319, Test Accuracy: 0.9257
Epoch 5/500 - Train Loss: 0.2376, Train Accuracy: 0.9575, Test Loss: 0.3353, Test Accuracy: 0.9213
Epoch 6/500 - Train Loss: 0.2116, Train Accuracy: 0.9750, Test Loss: 0.2938, Test Accuracy: 0.9419
Epoch 7/500 - Train Loss: 0.1854, Train Accuracy: 0.9800, Test Loss: 0.2859, Test Accuracy: 0.9419
Epoch 8/500 - Train Loss: 0.1792, Train Accuracy: 0.9800, Test Loss: 0.3303, Test Accuracy: 0.9218
Epoch 9/500 - Train Loss: 0.1867, Train Accuracy: 0.9825, Test Loss: 0.3041, Test Accuracy: 0.9336
Epoch 10/500 - Train Loss: 0.1684, Train Accuracy: 0.9875, Test Loss: 0.3242, Test Accuracy: 0.9270
Epoch 11/500 - Train Loss: 0.1502, Train Accuracy: 0.9950, Test Loss: 0.3470, Test Accuracy: 0.9231
Epoch 12/500 - Train Loss: 0.1723, Train Accuracy: 0.9875, Test Loss: 0.3264, Test Accuracy: 0.9261
Epoch 13/500 - Train Loss: 0.1445, Train Accuracy: 0.9950, Test Loss: 0.3074, Test Accuracy: 0.9353
Epoch 14/500 - Train Loss: 0.1541, Train Accuracy: 0.9950, Test Loss: 0.3106, Test Accuracy: 0.9371
Epoch 15/500 - Train Loss: 0.1556, Train Accuracy: 0.9925, Test Loss: 0.3199, Test Accuracy: 0.9296
Epoch 16/500 - Train Loss: 0.1790, Train Accuracy: 0.9800, Test Loss: 0.3647, Test Accuracy: 0.9073
Epoch 17/500 - Train Loss: 0.1722, Train Accuracy: 0.9850, Test Loss: 0.3501, Test Accuracy: 0.9187
Epoch 18/500 - Train Loss: 0.1924, Train Accuracy: 0.9800, Test Loss: 0.3248, Test Accuracy: 0.9274
Epoch 19/500 - Train Loss: 0.1560, Train Accuracy: 0.9875, Test Loss: 0.3850, Test Accuracy: 0.9047
Epoch 20/500 - Train Loss: 0.1561, Train Accuracy: 0.9875, Test Loss: 0.3741, Test Accuracy: 0.9056
Epoch 21/500 - Train Loss: 0.1437, Train Accuracy: 1.0000, Test Loss: 0.4027, Test Accuracy: 0.8916
Epoch 22/500 - Train Loss: 0.1477, Train Accuracy: 0.9950, Test Loss: 0.3505, Test Accuracy: 0.9161

Early stopping triggered at epoch 22
Best test loss: 0.3074
Best test accuracy: 0.9371
Plot saved as trained_models/Sweep run/metrics/loss.png
Plot saved as trained_models/Sweep run/metrics/metrics.png
Using GPU 0: NVIDIA GeForce RTX 3090
Epoch 1/500 - Train Loss: 1.4865, Train Accuracy: 0.5800, Test Loss: 1.8931, Test Accuracy: 0.4073
Epoch 2/500 - Train Loss: 0.5680, Train Accuracy: 0.9150, Test Loss: 1.0434, Test Accuracy: 0.8422
Epoch 3/500 - Train Loss: 0.2992, Train Accuracy: 0.9600, Test Loss: 0.5379, Test Accuracy: 0.8872
Epoch 4/500 - Train Loss: 0.2695, Train Accuracy: 0.9600, Test Loss: 0.3680, Test Accuracy: 0.9222
Epoch 5/500 - Train Loss: 0.2028, Train Accuracy: 0.9775, Test Loss: 0.3188, Test Accuracy: 0.9305
Epoch 6/500 - Train Loss: 0.1748, Train Accuracy: 0.9900, Test Loss: 0.2715, Test Accuracy: 0.9476
Epoch 7/500 - Train Loss: 0.1533, Train Accuracy: 0.9900, Test Loss: 0.4006, Test Accuracy: 0.9025
Epoch 8/500 - Train Loss: 0.2294, Train Accuracy: 0.9575, Test Loss: 0.7797, Test Accuracy: 0.7950
Epoch 9/500 - Train Loss: 0.2032, Train Accuracy: 0.9750, Test Loss: 0.4949, Test Accuracy: 0.8728
Epoch 10/500 - Train Loss: 0.1628, Train Accuracy: 0.9875, Test Loss: 0.3033, Test Accuracy: 0.9353
Epoch 11/500 - Train Loss: 0.1489, Train Accuracy: 0.9950, Test Loss: 0.3690, Test Accuracy: 0.9170
Epoch 12/500 - Train Loss: 0.1822, Train Accuracy: 0.9775, Test Loss: 0.3438, Test Accuracy: 0.9200
Epoch 13/500 - Train Loss: 0.1319, Train Accuracy: 0.9950, Test Loss: 0.2915, Test Accuracy: 0.9340
Epoch 14/500 - Train Loss: 0.1329, Train Accuracy: 0.9975, Test Loss: 0.2885, Test Accuracy: 0.9362
Epoch 15/500 - Train Loss: 0.1434, Train Accuracy: 0.9925, Test Loss: 0.3356, Test Accuracy: 0.9174
Epoch 16/500 - Train Loss: 0.2008, Train Accuracy: 0.9725, Test Loss: 0.3575, Test Accuracy: 0.9126
Epoch 17/500 - Train Loss: 0.1417, Train Accuracy: 0.9925, Test Loss: 0.3382, Test Accuracy: 0.9244
Epoch 18/500 - Train Loss: 0.1385, Train Accuracy: 0.9975, Test Loss: 0.3403, Test Accuracy: 0.9170
Epoch 19/500 - Train Loss: 0.1454, Train Accuracy: 0.9950, Test Loss: 0.3508, Test Accuracy: 0.9183
Epoch 20/500 - Train Loss: 0.1292, Train Accuracy: 0.9975, Test Loss: 0.3144, Test Accuracy: 0.9266
Epoch 21/500 - Train Loss: 0.1328, Train Accuracy: 0.9950, Test Loss: 0.7137, Test Accuracy: 0.7876

Early stopping triggered at epoch 21
Best test loss: 0.2885
Best test accuracy: 0.9362
Plot saved as trained_models/Sweep run/metrics/loss.png
Plot saved as trained_models/Sweep run/metrics/metrics.png
Using GPU 0: NVIDIA GeForce RTX 3090
Epoch 1/500 - Train Loss: 1.6758, Train Accuracy: 0.5000, Test Loss: 1.9643, Test Accuracy: 0.2963
Epoch 2/500 - Train Loss: 0.8745, Train Accuracy: 0.8675, Test Loss: 1.2956, Test Accuracy: 0.8077
Epoch 3/500 - Train Loss: 0.5292, Train Accuracy: 0.9500, Test Loss: 0.7720, Test Accuracy: 0.8977
Epoch 4/500 - Train Loss: 0.4505, Train Accuracy: 0.9550, Test Loss: 0.5512, Test Accuracy: 0.9270
Epoch 5/500 - Train Loss: 0.3854, Train Accuracy: 0.9825, Test Loss: 0.4856, Test Accuracy: 0.9305
Epoch 6/500 - Train Loss: 0.3454, Train Accuracy: 0.9875, Test Loss: 0.4516, Test Accuracy: 0.9392
Epoch 7/500 - Train Loss: 0.3364, Train Accuracy: 0.9875, Test Loss: 0.4863, Test Accuracy: 0.9279
Epoch 8/500 - Train Loss: 0.3467, Train Accuracy: 0.9850, Test Loss: 0.5090, Test Accuracy: 0.9148
Epoch 9/500 - Train Loss: 0.3245, Train Accuracy: 0.9950, Test Loss: 0.4511, Test Accuracy: 0.9419
Epoch 10/500 - Train Loss: 0.3185, Train Accuracy: 0.9950, Test Loss: 0.4516, Test Accuracy: 0.9401
Epoch 11/500 - Train Loss: 0.3106, Train Accuracy: 0.9975, Test Loss: 0.4595, Test Accuracy: 0.9336
Epoch 12/500 - Train Loss: 0.3309, Train Accuracy: 0.9825, Test Loss: 0.4673, Test Accuracy: 0.9301
Epoch 13/500 - Train Loss: 0.3031, Train Accuracy: 0.9975, Test Loss: 0.4549, Test Accuracy: 0.9358
Epoch 14/500 - Train Loss: 0.3118, Train Accuracy: 0.9950, Test Loss: 0.4669, Test Accuracy: 0.9283
Epoch 15/500 - Train Loss: 0.3248, Train Accuracy: 0.9950, Test Loss: 0.5248, Test Accuracy: 0.9069
Epoch 16/500 - Train Loss: 0.3521, Train Accuracy: 0.9825, Test Loss: 0.4896, Test Accuracy: 0.9148
Epoch 17/500 - Train Loss: 0.3124, Train Accuracy: 0.9975, Test Loss: 0.4871, Test Accuracy: 0.9152
Epoch 18/500 - Train Loss: 0.3145, Train Accuracy: 0.9950, Test Loss: 0.4843, Test Accuracy: 0.9209
Epoch 19/500 - Train Loss: 0.3097, Train Accuracy: 0.9925, Test Loss: 0.4881, Test Accuracy: 0.9226
Epoch 20/500 - Train Loss: 0.3282, Train Accuracy: 0.9875, Test Loss: 0.4549, Test Accuracy: 0.9336
Epoch 21/500 - Train Loss: 0.3188, Train Accuracy: 0.9900, Test Loss: 0.5233, Test Accuracy: 0.9117

Early stopping triggered at epoch 21
Best test loss: 0.4549
Best test accuracy: 0.9358
Plot saved as trained_models/Sweep run/metrics/loss.png
Plot saved as trained_models/Sweep run/metrics/metrics.png
Using GPU 0: NVIDIA GeForce RTX 3090
Epoch 1/500 - Train Loss: 1.7998, Train Accuracy: 0.4075, Test Loss: 1.9950, Test Accuracy: 0.2264
Epoch 2/500 - Train Loss: 1.0440, Train Accuracy: 0.8275, Test Loss: 1.4408, Test Accuracy: 0.7308
Epoch 3/500 - Train Loss: 0.6379, Train Accuracy: 0.9275, Test Loss: 0.8804, Test Accuracy: 0.8855
Epoch 4/500 - Train Loss: 0.4841, Train Accuracy: 0.9525, Test Loss: 0.5912, Test Accuracy: 0.9196
Epoch 5/500 - Train Loss: 0.3910, Train Accuracy: 0.9575, Test Loss: 0.4643, Test Accuracy: 0.9323
Epoch 6/500 - Train Loss: 0.3229, Train Accuracy: 0.9775, Test Loss: 0.4108, Test Accuracy: 0.9388
Epoch 7/500 - Train Loss: 0.3044, Train Accuracy: 0.9750, Test Loss: 0.3828, Test Accuracy: 0.9441
Epoch 8/500 - Train Loss: 0.2864, Train Accuracy: 0.9875, Test Loss: 0.3641, Test Accuracy: 0.9506
Epoch 9/500 - Train Loss: 0.2567, Train Accuracy: 0.9950, Test Loss: 0.3654, Test Accuracy: 0.9471
Epoch 10/500 - Train Loss: 0.2613, Train Accuracy: 0.9925, Test Loss: 0.3748, Test Accuracy: 0.9436
Epoch 11/500 - Train Loss: 0.2388, Train Accuracy: 0.9950, Test Loss: 0.3629, Test Accuracy: 0.9489
Epoch 12/500 - Train Loss: 0.2517, Train Accuracy: 0.9875, Test Loss: 0.3552, Test Accuracy: 0.9480
Epoch 13/500 - Train Loss: 0.2298, Train Accuracy: 0.9950, Test Loss: 0.3573, Test Accuracy: 0.9493
Epoch 14/500 - Train Loss: 0.2291, Train Accuracy: 1.0000, Test Loss: 0.3536, Test Accuracy: 0.9510
Epoch 15/500 - Train Loss: 0.2461, Train Accuracy: 0.9925, Test Loss: 0.3676, Test Accuracy: 0.9441
Epoch 16/500 - Train Loss: 0.2394, Train Accuracy: 0.9950, Test Loss: 0.3622, Test Accuracy: 0.9476
Epoch 17/500 - Train Loss: 0.2439, Train Accuracy: 0.9875, Test Loss: 0.3574, Test Accuracy: 0.9458
Epoch 18/500 - Train Loss: 0.2473, Train Accuracy: 0.9925, Test Loss: 0.3820, Test Accuracy: 0.9362
Epoch 19/500 - Train Loss: 0.2307, Train Accuracy: 0.9975, Test Loss: 0.3621, Test Accuracy: 0.9427
Epoch 20/500 - Train Loss: 0.2315, Train Accuracy: 0.9925, Test Loss: 0.3664, Test Accuracy: 0.9414
Epoch 21/500 - Train Loss: 0.2300, Train Accuracy: 0.9950, Test Loss: 0.3719, Test Accuracy: 0.9414
Epoch 22/500 - Train Loss: 0.2277, Train Accuracy: 1.0000, Test Loss: 0.3718, Test Accuracy: 0.9414
Epoch 23/500 - Train Loss: 0.2415, Train Accuracy: 0.9850, Test Loss: 0.3637, Test Accuracy: 0.9484
Epoch 24/500 - Train Loss: 0.2253, Train Accuracy: 0.9975, Test Loss: 0.3697, Test Accuracy: 0.9353
Epoch 25/500 - Train Loss: 0.2343, Train Accuracy: 0.9950, Test Loss: 0.3802, Test Accuracy: 0.9309
Epoch 26/500 - Train Loss: 0.2266, Train Accuracy: 0.9950, Test Loss: 0.3916, Test Accuracy: 0.9261
Epoch 27/500 - Train Loss: 0.2273, Train Accuracy: 0.9925, Test Loss: 0.3829, Test Accuracy: 0.9314
Epoch 28/500 - Train Loss: 0.2258, Train Accuracy: 0.9975, Test Loss: 0.4084, Test Accuracy: 0.9226
Epoch 29/500 - Train Loss: 0.2287, Train Accuracy: 0.9975, Test Loss: 0.4035, Test Accuracy: 0.9279

Early stopping triggered at epoch 29
Best test loss: 0.3536
Best test accuracy: 0.9510
Plot saved as trained_models/Sweep run/metrics/loss.png
Plot saved as trained_models/Sweep run/metrics/metrics.png
Using GPU 0: NVIDIA GeForce RTX 3090
Epoch 1/500 - Train Loss: 1.8764, Train Accuracy: 0.3125, Test Loss: 2.0143, Test Accuracy: 0.2028
Epoch 2/500 - Train Loss: 1.2277, Train Accuracy: 0.7675, Test Loss: 1.5778, Test Accuracy: 0.6892
Epoch 3/500 - Train Loss: 0.8018, Train Accuracy: 0.9125, Test Loss: 1.0609, Test Accuracy: 0.8462
Epoch 4/500 - Train Loss: 0.6077, Train Accuracy: 0.9250, Test Loss: 0.7303, Test Accuracy: 0.9065
Epoch 5/500 - Train Loss: 0.4771, Train Accuracy: 0.9500, Test Loss: 0.5478, Test Accuracy: 0.9257
Epoch 6/500 - Train Loss: 0.3812, Train Accuracy: 0.9600, Test Loss: 0.4587, Test Accuracy: 0.9314
Epoch 7/500 - Train Loss: 0.3453, Train Accuracy: 0.9650, Test Loss: 0.4106, Test Accuracy: 0.9379
Epoch 8/500 - Train Loss: 0.3147, Train Accuracy: 0.9850, Test Loss: 0.3720, Test Accuracy: 0.9462
Epoch 9/500 - Train Loss: 0.2751, Train Accuracy: 0.9925, Test Loss: 0.3591, Test Accuracy: 0.9497
Epoch 10/500 - Train Loss: 0.2711, Train Accuracy: 0.9925, Test Loss: 0.3619, Test Accuracy: 0.9445
Epoch 11/500 - Train Loss: 0.2450, Train Accuracy: 0.9950, Test Loss: 0.3570, Test Accuracy: 0.9458
Epoch 12/500 - Train Loss: 0.2574, Train Accuracy: 0.9850, Test Loss: 0.3538, Test Accuracy: 0.9454
Epoch 13/500 - Train Loss: 0.2318, Train Accuracy: 0.9925, Test Loss: 0.3523, Test Accuracy: 0.9484
Epoch 14/500 - Train Loss: 0.2340, Train Accuracy: 0.9950, Test Loss: 0.3484, Test Accuracy: 0.9502
Epoch 15/500 - Train Loss: 0.2429, Train Accuracy: 0.9900, Test Loss: 0.3554, Test Accuracy: 0.9445
Epoch 16/500 - Train Loss: 0.2380, Train Accuracy: 0.9875, Test Loss: 0.3481, Test Accuracy: 0.9476
Epoch 17/500 - Train Loss: 0.2268, Train Accuracy: 0.9975, Test Loss: 0.3409, Test Accuracy: 0.9493
Epoch 18/500 - Train Loss: 0.2422, Train Accuracy: 0.9900, Test Loss: 0.3613, Test Accuracy: 0.9423
Epoch 19/500 - Train Loss: 0.2262, Train Accuracy: 0.9950, Test Loss: 0.3508, Test Accuracy: 0.9414
Epoch 20/500 - Train Loss: 0.2214, Train Accuracy: 0.9925, Test Loss: 0.3464, Test Accuracy: 0.9458
Epoch 21/500 - Train Loss: 0.2168, Train Accuracy: 0.9950, Test Loss: 0.3557, Test Accuracy: 0.9419
Epoch 22/500 - Train Loss: 0.2214, Train Accuracy: 0.9950, Test Loss: 0.3567, Test Accuracy: 0.9423
Epoch 23/500 - Train Loss: 0.2251, Train Accuracy: 0.9925, Test Loss: 0.3489, Test Accuracy: 0.9480
Epoch 24/500 - Train Loss: 0.2134, Train Accuracy: 0.9975, Test Loss: 0.3527, Test Accuracy: 0.9436
Epoch 25/500 - Train Loss: 0.2230, Train Accuracy: 0.9950, Test Loss: 0.3527, Test Accuracy: 0.9392
Epoch 26/500 - Train Loss: 0.2119, Train Accuracy: 0.9975, Test Loss: 0.3559, Test Accuracy: 0.9423
Epoch 27/500 - Train Loss: 0.2157, Train Accuracy: 0.9950, Test Loss: 0.3515, Test Accuracy: 0.9445
Epoch 28/500 - Train Loss: 0.2142, Train Accuracy: 0.9975, Test Loss: 0.3676, Test Accuracy: 0.9375
Epoch 29/500 - Train Loss: 0.2208, Train Accuracy: 0.9950, Test Loss: 0.3913, Test Accuracy: 0.9292
Epoch 30/500 - Train Loss: 0.2272, Train Accuracy: 0.9875, Test Loss: 0.3807, Test Accuracy: 0.9309
Epoch 31/500 - Train Loss: 0.2158, Train Accuracy: 0.9975, Test Loss: 0.3745, Test Accuracy: 0.9340
Epoch 32/500 - Train Loss: 0.2264, Train Accuracy: 0.9950, Test Loss: 0.3587, Test Accuracy: 0.9406

Early stopping triggered at epoch 32
Best test loss: 0.3409
Best test accuracy: 0.9502
Plot saved as trained_models/Sweep run/metrics/loss.png
Plot saved as trained_models/Sweep run/metrics/metrics.png
Using GPU 0: NVIDIA GeForce RTX 3090
Epoch 1/500 - Train Loss: 1.9846, Train Accuracy: 0.2425, Test Loss: 2.0467, Test Accuracy: 0.1801
Epoch 2/500 - Train Loss: 1.5297, Train Accuracy: 0.6200, Test Loss: 1.7667, Test Accuracy: 0.4969
Epoch 3/500 - Train Loss: 1.1435, Train Accuracy: 0.8175, Test Loss: 1.3661, Test Accuracy: 0.7268
Epoch 4/500 - Train Loss: 0.9093, Train Accuracy: 0.8650, Test Loss: 1.0388, Test Accuracy: 0.8269
Epoch 5/500 - Train Loss: 0.7299, Train Accuracy: 0.9075, Test Loss: 0.8060, Test Accuracy: 0.8824
Epoch 6/500 - Train Loss: 0.5655, Train Accuracy: 0.9325, Test Loss: 0.6463, Test Accuracy: 0.9104
Epoch 7/500 - Train Loss: 0.4657, Train Accuracy: 0.9375, Test Loss: 0.5222, Test Accuracy: 0.9200
Epoch 8/500 - Train Loss: 0.3992, Train Accuracy: 0.9575, Test Loss: 0.4294, Test Accuracy: 0.9340
Epoch 9/500 - Train Loss: 0.3253, Train Accuracy: 0.9700, Test Loss: 0.3657, Test Accuracy: 0.9397
Epoch 10/500 - Train Loss: 0.2981, Train Accuracy: 0.9675, Test Loss: 0.3321, Test Accuracy: 0.9406
Epoch 11/500 - Train Loss: 0.2411, Train Accuracy: 0.9825, Test Loss: 0.3051, Test Accuracy: 0.9436
Epoch 12/500 - Train Loss: 0.2363, Train Accuracy: 0.9700, Test Loss: 0.2888, Test Accuracy: 0.9458
Epoch 13/500 - Train Loss: 0.1981, Train Accuracy: 0.9875, Test Loss: 0.2778, Test Accuracy: 0.9497
Epoch 14/500 - Train Loss: 0.1968, Train Accuracy: 0.9825, Test Loss: 0.2706, Test Accuracy: 0.9489
Epoch 15/500 - Train Loss: 0.1911, Train Accuracy: 0.9825, Test Loss: 0.2669, Test Accuracy: 0.9458
Epoch 16/500 - Train Loss: 0.1807, Train Accuracy: 0.9850, Test Loss: 0.2589, Test Accuracy: 0.9476
Epoch 17/500 - Train Loss: 0.1565, Train Accuracy: 0.9875, Test Loss: 0.2464, Test Accuracy: 0.9515
Epoch 18/500 - Train Loss: 0.1709, Train Accuracy: 0.9800, Test Loss: 0.2549, Test Accuracy: 0.9471
Epoch 19/500 - Train Loss: 0.1502, Train Accuracy: 0.9900, Test Loss: 0.2466, Test Accuracy: 0.9493
Epoch 20/500 - Train Loss: 0.1339, Train Accuracy: 0.9900, Test Loss: 0.2366, Test Accuracy: 0.9510
Epoch 21/500 - Train Loss: 0.1257, Train Accuracy: 0.9925, Test Loss: 0.2405, Test Accuracy: 0.9467
Epoch 22/500 - Train Loss: 0.1285, Train Accuracy: 0.9925, Test Loss: 0.2383, Test Accuracy: 0.9480
Epoch 23/500 - Train Loss: 0.1208, Train Accuracy: 0.9925, Test Loss: 0.2352, Test Accuracy: 0.9454
Epoch 24/500 - Train Loss: 0.1113, Train Accuracy: 0.9975, Test Loss: 0.2395, Test Accuracy: 0.9454
Epoch 25/500 - Train Loss: 0.1292, Train Accuracy: 0.9875, Test Loss: 0.2359, Test Accuracy: 0.9467
Epoch 26/500 - Train Loss: 0.1038, Train Accuracy: 0.9975, Test Loss: 0.2345, Test Accuracy: 0.9462
Epoch 27/500 - Train Loss: 0.1051, Train Accuracy: 0.9925, Test Loss: 0.2337, Test Accuracy: 0.9462
Epoch 28/500 - Train Loss: 0.1107, Train Accuracy: 0.9925, Test Loss: 0.2555, Test Accuracy: 0.9401
Epoch 29/500 - Train Loss: 0.1174, Train Accuracy: 0.9850, Test Loss: 0.2821, Test Accuracy: 0.9318
Epoch 30/500 - Train Loss: 0.1185, Train Accuracy: 0.9875, Test Loss: 0.2714, Test Accuracy: 0.9379
Epoch 31/500 - Train Loss: 0.1013, Train Accuracy: 1.0000, Test Loss: 0.2443, Test Accuracy: 0.9449
Epoch 32/500 - Train Loss: 0.1031, Train Accuracy: 0.9950, Test Loss: 0.2341, Test Accuracy: 0.9484
Epoch 33/500 - Train Loss: 0.0980, Train Accuracy: 0.9975, Test Loss: 0.2305, Test Accuracy: 0.9493
Epoch 34/500 - Train Loss: 0.1059, Train Accuracy: 0.9925, Test Loss: 0.2362, Test Accuracy: 0.9476
Epoch 35/500 - Train Loss: 0.0962, Train Accuracy: 0.9925, Test Loss: 0.2412, Test Accuracy: 0.9436
Epoch 36/500 - Train Loss: 0.0913, Train Accuracy: 0.9975, Test Loss: 0.2382, Test Accuracy: 0.9445
Epoch 37/500 - Train Loss: 0.0932, Train Accuracy: 0.9975, Test Loss: 0.2370, Test Accuracy: 0.9454
Epoch 38/500 - Train Loss: 0.0843, Train Accuracy: 1.0000, Test Loss: 0.2437, Test Accuracy: 0.9410
Epoch 39/500 - Train Loss: 0.0936, Train Accuracy: 0.9925, Test Loss: 0.2472, Test Accuracy: 0.9401
Epoch 40/500 - Train Loss: 0.0987, Train Accuracy: 0.9950, Test Loss: 0.2488, Test Accuracy: 0.9423
Epoch 41/500 - Train Loss: 0.0978, Train Accuracy: 0.9950, Test Loss: 0.2556, Test Accuracy: 0.9397
Epoch 42/500 - Train Loss: 0.0967, Train Accuracy: 0.9950, Test Loss: 0.2584, Test Accuracy: 0.9384
Epoch 43/500 - Train Loss: 0.0943, Train Accuracy: 0.9975, Test Loss: 0.2555, Test Accuracy: 0.9392
Epoch 44/500 - Train Loss: 0.0886, Train Accuracy: 1.0000, Test Loss: 0.2512, Test Accuracy: 0.9410
Epoch 45/500 - Train Loss: 0.0803, Train Accuracy: 1.0000, Test Loss: 0.2467, Test Accuracy: 0.9454
Epoch 46/500 - Train Loss: 0.0875, Train Accuracy: 1.0000, Test Loss: 0.2423, Test Accuracy: 0.9454
Epoch 47/500 - Train Loss: 0.0860, Train Accuracy: 0.9975, Test Loss: 0.2333, Test Accuracy: 0.9476
Epoch 48/500 - Train Loss: 0.0827, Train Accuracy: 0.9975, Test Loss: 0.2559, Test Accuracy: 0.9362

Early stopping triggered at epoch 48
Best test loss: 0.2305
Best test accuracy: 0.9515
Plot saved as trained_models/Sweep run/metrics/loss.png
Plot saved as trained_models/Sweep run/metrics/metrics.png
Using GPU 0: NVIDIA GeForce RTX 3090
Epoch 1/500 - Train Loss: 1.4373, Train Accuracy: 0.5900, Test Loss: 1.8627, Test Accuracy: 0.3864
Epoch 2/500 - Train Loss: 0.5735, Train Accuracy: 0.8850, Test Loss: 1.0252, Test Accuracy: 0.8016
Epoch 3/500 - Train Loss: 0.2953, Train Accuracy: 0.9600, Test Loss: 0.4822, Test Accuracy: 0.8995
Epoch 4/500 - Train Loss: 0.2293, Train Accuracy: 0.9550, Test Loss: 0.3291, Test Accuracy: 0.9156
Epoch 5/500 - Train Loss: 0.1757, Train Accuracy: 0.9700, Test Loss: 0.2568, Test Accuracy: 0.9340
Epoch 6/500 - Train Loss: 0.1281, Train Accuracy: 0.9875, Test Loss: 0.2250, Test Accuracy: 0.9423
Epoch 7/500 - Train Loss: 0.1251, Train Accuracy: 0.9750, Test Loss: 0.2025, Test Accuracy: 0.9510
Epoch 8/500 - Train Loss: 0.1183, Train Accuracy: 0.9850, Test Loss: 0.2009, Test Accuracy: 0.9489
Epoch 9/500 - Train Loss: 0.0890, Train Accuracy: 0.9925, Test Loss: 0.2040, Test Accuracy: 0.9480
Epoch 10/500 - Train Loss: 0.0889, Train Accuracy: 0.9950, Test Loss: 0.2138, Test Accuracy: 0.9462
Epoch 11/500 - Train Loss: 0.0674, Train Accuracy: 0.9950, Test Loss: 0.2092, Test Accuracy: 0.9467
Epoch 12/500 - Train Loss: 0.0790, Train Accuracy: 0.9900, Test Loss: 0.2024, Test Accuracy: 0.9480
Epoch 13/500 - Train Loss: 0.0583, Train Accuracy: 0.9950, Test Loss: 0.2003, Test Accuracy: 0.9484
Epoch 14/500 - Train Loss: 0.0591, Train Accuracy: 1.0000, Test Loss: 0.1910, Test Accuracy: 0.9519
Epoch 15/500 - Train Loss: 0.0762, Train Accuracy: 0.9925, Test Loss: 0.1993, Test Accuracy: 0.9510
Epoch 16/500 - Train Loss: 0.0673, Train Accuracy: 0.9975, Test Loss: 0.1914, Test Accuracy: 0.9541
Epoch 17/500 - Train Loss: 0.0601, Train Accuracy: 0.9975, Test Loss: 0.1840, Test Accuracy: 0.9528
Epoch 18/500 - Train Loss: 0.0720, Train Accuracy: 0.9900, Test Loss: 0.1887, Test Accuracy: 0.9524
Epoch 19/500 - Train Loss: 0.0591, Train Accuracy: 0.9925, Test Loss: 0.1868, Test Accuracy: 0.9519
Epoch 20/500 - Train Loss: 0.0522, Train Accuracy: 0.9975, Test Loss: 0.1854, Test Accuracy: 0.9537
Epoch 21/500 - Train Loss: 0.0520, Train Accuracy: 0.9950, Test Loss: 0.1919, Test Accuracy: 0.9506
Epoch 22/500 - Train Loss: 0.0547, Train Accuracy: 0.9975, Test Loss: 0.1925, Test Accuracy: 0.9480
Epoch 23/500 - Train Loss: 0.0594, Train Accuracy: 0.9925, Test Loss: 0.1808, Test Accuracy: 0.9524
Epoch 24/500 - Train Loss: 0.0461, Train Accuracy: 1.0000, Test Loss: 0.1851, Test Accuracy: 0.9524
Epoch 25/500 - Train Loss: 0.0620, Train Accuracy: 0.9950, Test Loss: 0.1863, Test Accuracy: 0.9502
Epoch 26/500 - Train Loss: 0.0425, Train Accuracy: 1.0000, Test Loss: 0.1914, Test Accuracy: 0.9497
Epoch 27/500 - Train Loss: 0.0494, Train Accuracy: 0.9925, Test Loss: 0.1903, Test Accuracy: 0.9502
Epoch 28/500 - Train Loss: 0.0489, Train Accuracy: 0.9975, Test Loss: 0.2112, Test Accuracy: 0.9432
Epoch 29/500 - Train Loss: 0.0570, Train Accuracy: 0.9900, Test Loss: 0.2382, Test Accuracy: 0.9362
Epoch 30/500 - Train Loss: 0.0556, Train Accuracy: 0.9925, Test Loss: 0.2493, Test Accuracy: 0.9296
Epoch 31/500 - Train Loss: 0.0436, Train Accuracy: 1.0000, Test Loss: 0.2252, Test Accuracy: 0.9375
Epoch 32/500 - Train Loss: 0.0519, Train Accuracy: 0.9950, Test Loss: 0.1995, Test Accuracy: 0.9462
Epoch 33/500 - Train Loss: 0.0417, Train Accuracy: 1.0000, Test Loss: 0.1923, Test Accuracy: 0.9519
Epoch 34/500 - Train Loss: 0.0535, Train Accuracy: 0.9950, Test Loss: 0.1969, Test Accuracy: 0.9489
Epoch 35/500 - Train Loss: 0.0465, Train Accuracy: 0.9950, Test Loss: 0.1975, Test Accuracy: 0.9515
Epoch 36/500 - Train Loss: 0.0423, Train Accuracy: 0.9975, Test Loss: 0.1980, Test Accuracy: 0.9502
Epoch 37/500 - Train Loss: 0.0472, Train Accuracy: 0.9975, Test Loss: 0.1983, Test Accuracy: 0.9476
Epoch 38/500 - Train Loss: 0.0386, Train Accuracy: 1.0000, Test Loss: 0.2121, Test Accuracy: 0.9419

Early stopping triggered at epoch 38
Best test loss: 0.1808
Best test accuracy: 0.9541
Plot saved as trained_models/Sweep run/metrics/loss.png
Plot saved as trained_models/Sweep run/metrics/metrics.png
Using GPU 0: NVIDIA GeForce RTX 3090
Epoch 1/500 - Train Loss: 1.9417, Train Accuracy: 0.2675, Test Loss: 2.0416, Test Accuracy: 0.1993
Epoch 2/500 - Train Loss: 1.4421, Train Accuracy: 0.6875, Test Loss: 1.7154, Test Accuracy: 0.5428
Epoch 3/500 - Train Loss: 1.0143, Train Accuracy: 0.8900, Test Loss: 1.2418, Test Accuracy: 0.7876
Epoch 4/500 - Train Loss: 0.7901, Train Accuracy: 0.9025, Test Loss: 0.9196, Test Accuracy: 0.8885
Epoch 5/500 - Train Loss: 0.6242, Train Accuracy: 0.9450, Test Loss: 0.7074, Test Accuracy: 0.9226
Epoch 6/500 - Train Loss: 0.5115, Train Accuracy: 0.9600, Test Loss: 0.5876, Test Accuracy: 0.9261
Epoch 7/500 - Train Loss: 0.4556, Train Accuracy: 0.9650, Test Loss: 0.5016, Test Accuracy: 0.9454
Epoch 8/500 - Train Loss: 0.4197, Train Accuracy: 0.9800, Test Loss: 0.4619, Test Accuracy: 0.9458
Epoch 9/500 - Train Loss: 0.3717, Train Accuracy: 0.9900, Test Loss: 0.4442, Test Accuracy: 0.9489
Epoch 10/500 - Train Loss: 0.3648, Train Accuracy: 0.9900, Test Loss: 0.4349, Test Accuracy: 0.9497
Epoch 11/500 - Train Loss: 0.3348, Train Accuracy: 0.9875, Test Loss: 0.4365, Test Accuracy: 0.9480
Epoch 12/500 - Train Loss: 0.3467, Train Accuracy: 0.9900, Test Loss: 0.4297, Test Accuracy: 0.9480
Epoch 13/500 - Train Loss: 0.3160, Train Accuracy: 0.9925, Test Loss: 0.4334, Test Accuracy: 0.9449
Epoch 14/500 - Train Loss: 0.3227, Train Accuracy: 0.9875, Test Loss: 0.4304, Test Accuracy: 0.9462
Epoch 15/500 - Train Loss: 0.3263, Train Accuracy: 0.9850, Test Loss: 0.4313, Test Accuracy: 0.9489
Epoch 16/500 - Train Loss: 0.3204, Train Accuracy: 0.9875, Test Loss: 0.4221, Test Accuracy: 0.9519
Epoch 17/500 - Train Loss: 0.3074, Train Accuracy: 0.9975, Test Loss: 0.4270, Test Accuracy: 0.9467
Epoch 18/500 - Train Loss: 0.3246, Train Accuracy: 0.9875, Test Loss: 0.4279, Test Accuracy: 0.9484
Epoch 19/500 - Train Loss: 0.3047, Train Accuracy: 0.9950, Test Loss: 0.4212, Test Accuracy: 0.9484
Epoch 20/500 - Train Loss: 0.2991, Train Accuracy: 0.9925, Test Loss: 0.4205, Test Accuracy: 0.9445
Epoch 21/500 - Train Loss: 0.2971, Train Accuracy: 0.9950, Test Loss: 0.4266, Test Accuracy: 0.9449
Epoch 22/500 - Train Loss: 0.3008, Train Accuracy: 0.9950, Test Loss: 0.4307, Test Accuracy: 0.9432
Epoch 23/500 - Train Loss: 0.3008, Train Accuracy: 0.9925, Test Loss: 0.4158, Test Accuracy: 0.9480
Epoch 24/500 - Train Loss: 0.2901, Train Accuracy: 1.0000, Test Loss: 0.4219, Test Accuracy: 0.9401
Epoch 25/500 - Train Loss: 0.3026, Train Accuracy: 0.9925, Test Loss: 0.4194, Test Accuracy: 0.9445
Epoch 26/500 - Train Loss: 0.2882, Train Accuracy: 0.9975, Test Loss: 0.4217, Test Accuracy: 0.9427
Epoch 27/500 - Train Loss: 0.2939, Train Accuracy: 0.9950, Test Loss: 0.4413, Test Accuracy: 0.9353
Epoch 28/500 - Train Loss: 0.2902, Train Accuracy: 1.0000, Test Loss: 0.4424, Test Accuracy: 0.9366
Epoch 29/500 - Train Loss: 0.2954, Train Accuracy: 0.9950, Test Loss: 0.4488, Test Accuracy: 0.9371
Epoch 30/500 - Train Loss: 0.3035, Train Accuracy: 0.9950, Test Loss: 0.4298, Test Accuracy: 0.9392
Epoch 31/500 - Train Loss: 0.2837, Train Accuracy: 1.0000, Test Loss: 0.4268, Test Accuracy: 0.9462
Epoch 32/500 - Train Loss: 0.2908, Train Accuracy: 0.9975, Test Loss: 0.4180, Test Accuracy: 0.9462
Epoch 33/500 - Train Loss: 0.2835, Train Accuracy: 1.0000, Test Loss: 0.4274, Test Accuracy: 0.9419
Epoch 34/500 - Train Loss: 0.2967, Train Accuracy: 0.9950, Test Loss: 0.4355, Test Accuracy: 0.9388
Epoch 35/500 - Train Loss: 0.2894, Train Accuracy: 0.9950, Test Loss: 0.4326, Test Accuracy: 0.9388
Epoch 36/500 - Train Loss: 0.2837, Train Accuracy: 1.0000, Test Loss: 0.4283, Test Accuracy: 0.9410
Epoch 37/500 - Train Loss: 0.2875, Train Accuracy: 0.9975, Test Loss: 0.4397, Test Accuracy: 0.9362
Epoch 38/500 - Train Loss: 0.2809, Train Accuracy: 1.0000, Test Loss: 0.4357, Test Accuracy: 0.9371

Early stopping triggered at epoch 38
Best test loss: 0.4158
Best test accuracy: 0.9519
Plot saved as trained_models/Sweep run/metrics/loss.png
Plot saved as trained_models/Sweep run/metrics/metrics.png
Using GPU 0: NVIDIA GeForce RTX 3090
Epoch 1/500 - Train Loss: 1.7882, Train Accuracy: 0.4100, Test Loss: 1.9927, Test Accuracy: 0.2277
Epoch 2/500 - Train Loss: 1.0030, Train Accuracy: 0.8250, Test Loss: 1.4216, Test Accuracy: 0.7351
Epoch 3/500 - Train Loss: 0.5736, Train Accuracy: 0.9225, Test Loss: 0.8306, Test Accuracy: 0.8859
Epoch 4/500 - Train Loss: 0.4054, Train Accuracy: 0.9525, Test Loss: 0.5142, Test Accuracy: 0.9200
Epoch 5/500 - Train Loss: 0.3004, Train Accuracy: 0.9600, Test Loss: 0.3714, Test Accuracy: 0.9318
Epoch 6/500 - Train Loss: 0.2230, Train Accuracy: 0.9725, Test Loss: 0.3101, Test Accuracy: 0.9379
Epoch 7/500 - Train Loss: 0.1983, Train Accuracy: 0.9750, Test Loss: 0.2787, Test Accuracy: 0.9445
Epoch 8/500 - Train Loss: 0.1794, Train Accuracy: 0.9875, Test Loss: 0.2565, Test Accuracy: 0.9510
Epoch 9/500 - Train Loss: 0.1460, Train Accuracy: 0.9950, Test Loss: 0.2561, Test Accuracy: 0.9502
Epoch 10/500 - Train Loss: 0.1491, Train Accuracy: 0.9900, Test Loss: 0.2645, Test Accuracy: 0.9458
Epoch 11/500 - Train Loss: 0.1211, Train Accuracy: 0.9950, Test Loss: 0.2510, Test Accuracy: 0.9519
Epoch 12/500 - Train Loss: 0.1353, Train Accuracy: 0.9875, Test Loss: 0.2405, Test Accuracy: 0.9502
Epoch 13/500 - Train Loss: 0.1155, Train Accuracy: 0.9950, Test Loss: 0.2408, Test Accuracy: 0.9510
Epoch 14/500 - Train Loss: 0.1108, Train Accuracy: 1.0000, Test Loss: 0.2396, Test Accuracy: 0.9515
Epoch 15/500 - Train Loss: 0.1296, Train Accuracy: 0.9900, Test Loss: 0.2479, Test Accuracy: 0.9432
Epoch 16/500 - Train Loss: 0.1222, Train Accuracy: 0.9950, Test Loss: 0.2470, Test Accuracy: 0.9458
Epoch 17/500 - Train Loss: 0.1293, Train Accuracy: 0.9875, Test Loss: 0.2574, Test Accuracy: 0.9441
Epoch 18/500 - Train Loss: 0.1357, Train Accuracy: 0.9900, Test Loss: 0.3026, Test Accuracy: 0.9218
Epoch 19/500 - Train Loss: 0.1207, Train Accuracy: 0.9875, Test Loss: 0.2566, Test Accuracy: 0.9441
Epoch 20/500 - Train Loss: 0.1111, Train Accuracy: 0.9950, Test Loss: 0.2558, Test Accuracy: 0.9445
Epoch 21/500 - Train Loss: 0.1139, Train Accuracy: 0.9925, Test Loss: 0.2561, Test Accuracy: 0.9419
Epoch 22/500 - Train Loss: 0.1089, Train Accuracy: 0.9975, Test Loss: 0.2517, Test Accuracy: 0.9427
Epoch 23/500 - Train Loss: 0.1185, Train Accuracy: 0.9875, Test Loss: 0.2522, Test Accuracy: 0.9445
Epoch 24/500 - Train Loss: 0.1089, Train Accuracy: 0.9975, Test Loss: 0.2491, Test Accuracy: 0.9441
Epoch 25/500 - Train Loss: 0.1114, Train Accuracy: 0.9975, Test Loss: 0.2574, Test Accuracy: 0.9449
Epoch 26/500 - Train Loss: 0.0995, Train Accuracy: 0.9975, Test Loss: 0.2652, Test Accuracy: 0.9432
Epoch 27/500 - Train Loss: 0.1114, Train Accuracy: 0.9925, Test Loss: 0.2765, Test Accuracy: 0.9366

Early stopping triggered at epoch 27
Best test loss: 0.2396
Best test accuracy: 0.9515
Plot saved as trained_models/Sweep run/metrics/loss.png
Plot saved as trained_models/Sweep run/metrics/metrics.png
Using GPU 0: NVIDIA GeForce RTX 3090
Epoch 1/500 - Train Loss: 1.7302, Train Accuracy: 0.4400, Test Loss: 1.9872, Test Accuracy: 0.2872
Epoch 2/500 - Train Loss: 0.9136, Train Accuracy: 0.8550, Test Loss: 1.3488, Test Accuracy: 0.7649
Epoch 3/500 - Train Loss: 0.4677, Train Accuracy: 0.9425, Test Loss: 0.7411, Test Accuracy: 0.8929
Epoch 4/500 - Train Loss: 0.3205, Train Accuracy: 0.9475, Test Loss: 0.4266, Test Accuracy: 0.9296
Epoch 5/500 - Train Loss: 0.2190, Train Accuracy: 0.9725, Test Loss: 0.3084, Test Accuracy: 0.9323
Epoch 6/500 - Train Loss: 0.1493, Train Accuracy: 0.9825, Test Loss: 0.2544, Test Accuracy: 0.9441
Epoch 7/500 - Train Loss: 0.1234, Train Accuracy: 0.9825, Test Loss: 0.2425, Test Accuracy: 0.9432
Epoch 8/500 - Train Loss: 0.1271, Train Accuracy: 0.9825, Test Loss: 0.2384, Test Accuracy: 0.9406
Epoch 9/500 - Train Loss: 0.0817, Train Accuracy: 0.9925, Test Loss: 0.2300, Test Accuracy: 0.9406
Epoch 10/500 - Train Loss: 0.0823, Train Accuracy: 0.9925, Test Loss: 0.2124, Test Accuracy: 0.9436
Epoch 11/500 - Train Loss: 0.0592, Train Accuracy: 1.0000, Test Loss: 0.2194, Test Accuracy: 0.9401
Epoch 12/500 - Train Loss: 0.0868, Train Accuracy: 0.9875, Test Loss: 0.2470, Test Accuracy: 0.9288
Epoch 13/500 - Train Loss: 0.0561, Train Accuracy: 1.0000, Test Loss: 0.2204, Test Accuracy: 0.9427
Epoch 14/500 - Train Loss: 0.0649, Train Accuracy: 0.9925, Test Loss: 0.2248, Test Accuracy: 0.9309
Epoch 15/500 - Train Loss: 0.0923, Train Accuracy: 0.9825, Test Loss: 0.2940, Test Accuracy: 0.9073
Epoch 16/500 - Train Loss: 0.1309, Train Accuracy: 0.9725, Test Loss: 0.2392, Test Accuracy: 0.9292
Epoch 17/500 - Train Loss: 0.0695, Train Accuracy: 0.9925, Test Loss: 0.3910, Test Accuracy: 0.8868
Epoch 18/500 - Train Loss: 0.0933, Train Accuracy: 0.9800, Test Loss: 0.2371, Test Accuracy: 0.9344
Epoch 19/500 - Train Loss: 0.0647, Train Accuracy: 0.9900, Test Loss: 0.2912, Test Accuracy: 0.9178
Epoch 20/500 - Train Loss: 0.0918, Train Accuracy: 0.9800, Test Loss: 0.2464, Test Accuracy: 0.9288
Epoch 21/500 - Train Loss: 0.0675, Train Accuracy: 0.9925, Test Loss: 0.2925, Test Accuracy: 0.9143
Epoch 22/500 - Train Loss: 0.0720, Train Accuracy: 0.9900, Test Loss: 0.2474, Test Accuracy: 0.9331
Epoch 23/500 - Train Loss: 0.0667, Train Accuracy: 0.9875, Test Loss: 0.2267, Test Accuracy: 0.9392
Epoch 24/500 - Train Loss: 0.0558, Train Accuracy: 0.9925, Test Loss: 0.2655, Test Accuracy: 0.9240
Epoch 25/500 - Train Loss: 0.0731, Train Accuracy: 0.9900, Test Loss: 0.2684, Test Accuracy: 0.9244

Early stopping triggered at epoch 25
Best test loss: 0.2204
Best test accuracy: 0.9427
Plot saved as trained_models/Sweep run/metrics/loss.png
Plot saved as trained_models/Sweep run/metrics/metrics.png
Using GPU 0: NVIDIA GeForce RTX 3090
Epoch 1/500 - Train Loss: 1.5465, Train Accuracy: 0.5600, Test Loss: 1.9215, Test Accuracy: 0.4034
Epoch 2/500 - Train Loss: 0.6950, Train Accuracy: 0.9125, Test Loss: 1.1391, Test Accuracy: 0.8291
Epoch 3/500 - Train Loss: 0.4322, Train Accuracy: 0.9600, Test Loss: 0.6799, Test Accuracy: 0.8934
Epoch 4/500 - Train Loss: 0.3986, Train Accuracy: 0.9600, Test Loss: 0.5053, Test Accuracy: 0.9218
Epoch 5/500 - Train Loss: 0.3486, Train Accuracy: 0.9750, Test Loss: 0.4545, Test Accuracy: 0.9279
Epoch 6/500 - Train Loss: 0.3103, Train Accuracy: 0.9925, Test Loss: 0.4174, Test Accuracy: 0.9462
Epoch 7/500 - Train Loss: 0.3048, Train Accuracy: 0.9875, Test Loss: 0.5930, Test Accuracy: 0.8763
Epoch 8/500 - Train Loss: 0.3517, Train Accuracy: 0.9625, Test Loss: 0.6086, Test Accuracy: 0.8728
Epoch 9/500 - Train Loss: 0.3352, Train Accuracy: 0.9750, Test Loss: 0.4750, Test Accuracy: 0.9213
Epoch 10/500 - Train Loss: 0.3054, Train Accuracy: 0.9900, Test Loss: 0.4370, Test Accuracy: 0.9366
Epoch 11/500 - Train Loss: 0.2988, Train Accuracy: 0.9900, Test Loss: 0.4827, Test Accuracy: 0.9191
Epoch 12/500 - Train Loss: 0.3623, Train Accuracy: 0.9700, Test Loss: 0.4320, Test Accuracy: 0.9358
Epoch 13/500 - Train Loss: 0.2892, Train Accuracy: 0.9950, Test Loss: 0.4275, Test Accuracy: 0.9366
Epoch 14/500 - Train Loss: 0.2845, Train Accuracy: 0.9950, Test Loss: 0.4418, Test Accuracy: 0.9314
Epoch 15/500 - Train Loss: 0.3005, Train Accuracy: 0.9900, Test Loss: 0.5101, Test Accuracy: 0.9060
Epoch 16/500 - Train Loss: 0.3059, Train Accuracy: 0.9875, Test Loss: 0.5307, Test Accuracy: 0.8903
Epoch 17/500 - Train Loss: 0.3131, Train Accuracy: 0.9825, Test Loss: 0.6587, Test Accuracy: 0.8431
Epoch 18/500 - Train Loss: 0.3198, Train Accuracy: 0.9850, Test Loss: 0.6350, Test Accuracy: 0.8671
Epoch 19/500 - Train Loss: 0.3279, Train Accuracy: 0.9825, Test Loss: 0.5945, Test Accuracy: 0.8706
Epoch 20/500 - Train Loss: 0.3057, Train Accuracy: 0.9875, Test Loss: 0.4531, Test Accuracy: 0.9240
Epoch 21/500 - Train Loss: 0.2986, Train Accuracy: 0.9925, Test Loss: 0.5037, Test Accuracy: 0.9073

Early stopping triggered at epoch 21
Best test loss: 0.4275
Best test accuracy: 0.9366
Plot saved as trained_models/Sweep run/metrics/loss.png
Plot saved as trained_models/Sweep run/metrics/metrics.png
Using GPU 0: NVIDIA GeForce RTX 3090
Epoch 1/500 - Train Loss: 2.0795, Train Accuracy: 0.1875, Test Loss: 2.0746, Test Accuracy: 0.1740
Epoch 2/500 - Train Loss: 1.8644, Train Accuracy: 0.3500, Test Loss: 1.9621, Test Accuracy: 0.2854
Epoch 3/500 - Train Loss: 1.6347, Train Accuracy: 0.5500, Test Loss: 1.7554, Test Accuracy: 0.4803
Epoch 4/500 - Train Loss: 1.4793, Train Accuracy: 0.6550, Test Loss: 1.5488, Test Accuracy: 0.6324
Epoch 5/500 - Train Loss: 1.3371, Train Accuracy: 0.7400, Test Loss: 1.3641, Test Accuracy: 0.7190
Epoch 6/500 - Train Loss: 1.1723, Train Accuracy: 0.8150, Test Loss: 1.2038, Test Accuracy: 0.7701
Epoch 7/500 - Train Loss: 1.0499, Train Accuracy: 0.8425, Test Loss: 1.0730, Test Accuracy: 0.8116
Epoch 8/500 - Train Loss: 0.9472, Train Accuracy: 0.8975, Test Loss: 0.9580, Test Accuracy: 0.8287
Epoch 9/500 - Train Loss: 0.8462, Train Accuracy: 0.8825, Test Loss: 0.8564, Test Accuracy: 0.8580
Epoch 10/500 - Train Loss: 0.7753, Train Accuracy: 0.9125, Test Loss: 0.7763, Test Accuracy: 0.8772
Epoch 11/500 - Train Loss: 0.6715, Train Accuracy: 0.9325, Test Loss: 0.7057, Test Accuracy: 0.8885
Epoch 12/500 - Train Loss: 0.6261, Train Accuracy: 0.9225, Test Loss: 0.6504, Test Accuracy: 0.8999
Epoch 13/500 - Train Loss: 0.5666, Train Accuracy: 0.9300, Test Loss: 0.5972, Test Accuracy: 0.9087
Epoch 14/500 - Train Loss: 0.5253, Train Accuracy: 0.9500, Test Loss: 0.5486, Test Accuracy: 0.9165
Epoch 15/500 - Train Loss: 0.4988, Train Accuracy: 0.9475, Test Loss: 0.5115, Test Accuracy: 0.9226
Epoch 16/500 - Train Loss: 0.4738, Train Accuracy: 0.9400, Test Loss: 0.4790, Test Accuracy: 0.9283
Epoch 17/500 - Train Loss: 0.4076, Train Accuracy: 0.9700, Test Loss: 0.4513, Test Accuracy: 0.9274
Epoch 18/500 - Train Loss: 0.4074, Train Accuracy: 0.9375, Test Loss: 0.4304, Test Accuracy: 0.9288
Epoch 19/500 - Train Loss: 0.3729, Train Accuracy: 0.9625, Test Loss: 0.4043, Test Accuracy: 0.9314
Epoch 20/500 - Train Loss: 0.3300, Train Accuracy: 0.9750, Test Loss: 0.3855, Test Accuracy: 0.9323
Epoch 21/500 - Train Loss: 0.3173, Train Accuracy: 0.9800, Test Loss: 0.3715, Test Accuracy: 0.9349
Epoch 22/500 - Train Loss: 0.3110, Train Accuracy: 0.9725, Test Loss: 0.3537, Test Accuracy: 0.9371
Epoch 23/500 - Train Loss: 0.2828, Train Accuracy: 0.9750, Test Loss: 0.3399, Test Accuracy: 0.9397
Epoch 24/500 - Train Loss: 0.2710, Train Accuracy: 0.9675, Test Loss: 0.3313, Test Accuracy: 0.9423
Epoch 25/500 - Train Loss: 0.2801, Train Accuracy: 0.9725, Test Loss: 0.3237, Test Accuracy: 0.9449
Epoch 26/500 - Train Loss: 0.2400, Train Accuracy: 0.9775, Test Loss: 0.3154, Test Accuracy: 0.9432
Epoch 27/500 - Train Loss: 0.2292, Train Accuracy: 0.9825, Test Loss: 0.3031, Test Accuracy: 0.9471
Epoch 28/500 - Train Loss: 0.2395, Train Accuracy: 0.9775, Test Loss: 0.3023, Test Accuracy: 0.9462
Epoch 29/500 - Train Loss: 0.2306, Train Accuracy: 0.9800, Test Loss: 0.3023, Test Accuracy: 0.9423
Epoch 30/500 - Train Loss: 0.2303, Train Accuracy: 0.9700, Test Loss: 0.3025, Test Accuracy: 0.9454
Epoch 31/500 - Train Loss: 0.1966, Train Accuracy: 0.9925, Test Loss: 0.2923, Test Accuracy: 0.9510
Epoch 32/500 - Train Loss: 0.2025, Train Accuracy: 0.9850, Test Loss: 0.2827, Test Accuracy: 0.9519
Epoch 33/500 - Train Loss: 0.1876, Train Accuracy: 0.9875, Test Loss: 0.2774, Test Accuracy: 0.9519
Epoch 34/500 - Train Loss: 0.1942, Train Accuracy: 0.9925, Test Loss: 0.2781, Test Accuracy: 0.9506
Epoch 35/500 - Train Loss: 0.1759, Train Accuracy: 0.9900, Test Loss: 0.2782, Test Accuracy: 0.9497
Epoch 36/500 - Train Loss: 0.1742, Train Accuracy: 0.9825, Test Loss: 0.2750, Test Accuracy: 0.9493
Epoch 37/500 - Train Loss: 0.1755, Train Accuracy: 0.9975, Test Loss: 0.2702, Test Accuracy: 0.9489
Epoch 38/500 - Train Loss: 0.1616, Train Accuracy: 0.9900, Test Loss: 0.2721, Test Accuracy: 0.9445
Epoch 39/500 - Train Loss: 0.1641, Train Accuracy: 0.9900, Test Loss: 0.2772, Test Accuracy: 0.9414
Epoch 40/500 - Train Loss: 0.1746, Train Accuracy: 0.9850, Test Loss: 0.2716, Test Accuracy: 0.9454
Epoch 41/500 - Train Loss: 0.1650, Train Accuracy: 0.9900, Test Loss: 0.2683, Test Accuracy: 0.9432
Epoch 42/500 - Train Loss: 0.1674, Train Accuracy: 0.9850, Test Loss: 0.2695, Test Accuracy: 0.9427
Epoch 43/500 - Train Loss: 0.1438, Train Accuracy: 0.9925, Test Loss: 0.2711, Test Accuracy: 0.9423
Epoch 44/500 - Train Loss: 0.1494, Train Accuracy: 0.9900, Test Loss: 0.2720, Test Accuracy: 0.9414
Epoch 45/500 - Train Loss: 0.1322, Train Accuracy: 0.9975, Test Loss: 0.2697, Test Accuracy: 0.9414
Epoch 46/500 - Train Loss: 0.1478, Train Accuracy: 0.9925, Test Loss: 0.2664, Test Accuracy: 0.9427
Epoch 47/500 - Train Loss: 0.1401, Train Accuracy: 0.9875, Test Loss: 0.2559, Test Accuracy: 0.9467
Epoch 48/500 - Train Loss: 0.1321, Train Accuracy: 0.9925, Test Loss: 0.2611, Test Accuracy: 0.9449
Epoch 49/500 - Train Loss: 0.1235, Train Accuracy: 0.9975, Test Loss: 0.2569, Test Accuracy: 0.9476
Epoch 50/500 - Train Loss: 0.1360, Train Accuracy: 0.9925, Test Loss: 0.2565, Test Accuracy: 0.9476
Epoch 51/500 - Train Loss: 0.1276, Train Accuracy: 0.9950, Test Loss: 0.2532, Test Accuracy: 0.9449
Epoch 52/500 - Train Loss: 0.1289, Train Accuracy: 0.9950, Test Loss: 0.2559, Test Accuracy: 0.9462
Epoch 53/500 - Train Loss: 0.1229, Train Accuracy: 0.9950, Test Loss: 0.2596, Test Accuracy: 0.9454
Epoch 54/500 - Train Loss: 0.1148, Train Accuracy: 0.9975, Test Loss: 0.2623, Test Accuracy: 0.9423
Epoch 55/500 - Train Loss: 0.1262, Train Accuracy: 0.9950, Test Loss: 0.2594, Test Accuracy: 0.9449
Epoch 56/500 - Train Loss: 0.1185, Train Accuracy: 0.9975, Test Loss: 0.2557, Test Accuracy: 0.9476
Epoch 57/500 - Train Loss: 0.1336, Train Accuracy: 0.9925, Test Loss: 0.2551, Test Accuracy: 0.9489
Epoch 58/500 - Train Loss: 0.1246, Train Accuracy: 0.9950, Test Loss: 0.2565, Test Accuracy: 0.9462
Epoch 59/500 - Train Loss: 0.1144, Train Accuracy: 1.0000, Test Loss: 0.2547, Test Accuracy: 0.9449
Epoch 60/500 - Train Loss: 0.1116, Train Accuracy: 0.9975, Test Loss: 0.2553, Test Accuracy: 0.9462
Epoch 61/500 - Train Loss: 0.1146, Train Accuracy: 0.9975, Test Loss: 0.2559, Test Accuracy: 0.9471
Epoch 62/500 - Train Loss: 0.1141, Train Accuracy: 0.9975, Test Loss: 0.2527, Test Accuracy: 0.9480
Epoch 63/500 - Train Loss: 0.1114, Train Accuracy: 0.9975, Test Loss: 0.2557, Test Accuracy: 0.9471
Epoch 64/500 - Train Loss: 0.1078, Train Accuracy: 1.0000, Test Loss: 0.2544, Test Accuracy: 0.9476
Epoch 65/500 - Train Loss: 0.1130, Train Accuracy: 1.0000, Test Loss: 0.2485, Test Accuracy: 0.9497
Epoch 66/500 - Train Loss: 0.1219, Train Accuracy: 0.9900, Test Loss: 0.2568, Test Accuracy: 0.9467
Epoch 67/500 - Train Loss: 0.1170, Train Accuracy: 0.9925, Test Loss: 0.2574, Test Accuracy: 0.9467
Epoch 68/500 - Train Loss: 0.1112, Train Accuracy: 0.9950, Test Loss: 0.2543, Test Accuracy: 0.9471
Epoch 69/500 - Train Loss: 0.1085, Train Accuracy: 0.9975, Test Loss: 0.2495, Test Accuracy: 0.9493
Epoch 70/500 - Train Loss: 0.1064, Train Accuracy: 0.9975, Test Loss: 0.2541, Test Accuracy: 0.9480
Epoch 71/500 - Train Loss: 0.1109, Train Accuracy: 1.0000, Test Loss: 0.2523, Test Accuracy: 0.9497
Epoch 72/500 - Train Loss: 0.1020, Train Accuracy: 1.0000, Test Loss: 0.2512, Test Accuracy: 0.9493
Epoch 73/500 - Train Loss: 0.1052, Train Accuracy: 0.9975, Test Loss: 0.2520, Test Accuracy: 0.9493
Epoch 74/500 - Train Loss: 0.1111, Train Accuracy: 0.9975, Test Loss: 0.2562, Test Accuracy: 0.9467
Epoch 75/500 - Train Loss: 0.1108, Train Accuracy: 0.9975, Test Loss: 0.2547, Test Accuracy: 0.9436
Epoch 76/500 - Train Loss: 0.1072, Train Accuracy: 0.9950, Test Loss: 0.2566, Test Accuracy: 0.9458
Epoch 77/500 - Train Loss: 0.1038, Train Accuracy: 0.9975, Test Loss: 0.2497, Test Accuracy: 0.9489
Epoch 78/500 - Train Loss: 0.1037, Train Accuracy: 1.0000, Test Loss: 0.2553, Test Accuracy: 0.9462
Epoch 79/500 - Train Loss: 0.0986, Train Accuracy: 1.0000, Test Loss: 0.2507, Test Accuracy: 0.9467
Epoch 80/500 - Train Loss: 0.1001, Train Accuracy: 0.9950, Test Loss: 0.2512, Test Accuracy: 0.9510

Early stopping triggered at epoch 80
Best test loss: 0.2485
Best test accuracy: 0.9519
Plot saved as trained_models/Sweep run/metrics/loss.png
Plot saved as trained_models/Sweep run/metrics/metrics.png
Using GPU 0: NVIDIA GeForce RTX 3090
Epoch 1/500 - Train Loss: 1.6559, Train Accuracy: 0.5125, Test Loss: 1.9626, Test Accuracy: 0.2762
Epoch 2/500 - Train Loss: 0.7953, Train Accuracy: 0.8725, Test Loss: 1.2375, Test Accuracy: 0.8103
Epoch 3/500 - Train Loss: 0.4044, Train Accuracy: 0.9500, Test Loss: 0.6762, Test Accuracy: 0.9017
Epoch 4/500 - Train Loss: 0.3034, Train Accuracy: 0.9525, Test Loss: 0.4179, Test Accuracy: 0.9253
Epoch 5/500 - Train Loss: 0.2241, Train Accuracy: 0.9750, Test Loss: 0.3174, Test Accuracy: 0.9331
Epoch 6/500 - Train Loss: 0.1730, Train Accuracy: 0.9875, Test Loss: 0.2890, Test Accuracy: 0.9436
Epoch 7/500 - Train Loss: 0.1577, Train Accuracy: 0.9875, Test Loss: 0.4006, Test Accuracy: 0.8816
Epoch 8/500 - Train Loss: 0.1757, Train Accuracy: 0.9750, Test Loss: 0.3863, Test Accuracy: 0.9052
Epoch 9/500 - Train Loss: 0.1640, Train Accuracy: 0.9825, Test Loss: 0.3319, Test Accuracy: 0.9196
Epoch 10/500 - Train Loss: 0.1407, Train Accuracy: 0.9900, Test Loss: 0.2734, Test Accuracy: 0.9362
Epoch 11/500 - Train Loss: 0.1210, Train Accuracy: 0.9975, Test Loss: 0.2783, Test Accuracy: 0.9397
Epoch 12/500 - Train Loss: 0.1340, Train Accuracy: 0.9900, Test Loss: 0.2770, Test Accuracy: 0.9318
Epoch 13/500 - Train Loss: 0.1108, Train Accuracy: 1.0000, Test Loss: 0.2726, Test Accuracy: 0.9410
Epoch 14/500 - Train Loss: 0.1220, Train Accuracy: 0.9900, Test Loss: 0.2894, Test Accuracy: 0.9323
Epoch 15/500 - Train Loss: 0.1459, Train Accuracy: 0.9875, Test Loss: 0.4034, Test Accuracy: 0.8899
Epoch 16/500 - Train Loss: 0.1773, Train Accuracy: 0.9750, Test Loss: 0.2798, Test Accuracy: 0.9314
Epoch 17/500 - Train Loss: 0.1251, Train Accuracy: 0.9975, Test Loss: 0.3331, Test Accuracy: 0.9174
Epoch 18/500 - Train Loss: 0.1400, Train Accuracy: 0.9875, Test Loss: 0.2993, Test Accuracy: 0.9279
Epoch 19/500 - Train Loss: 0.1285, Train Accuracy: 0.9900, Test Loss: 0.2684, Test Accuracy: 0.9366
Epoch 20/500 - Train Loss: 0.1195, Train Accuracy: 0.9950, Test Loss: 0.2741, Test Accuracy: 0.9353
Epoch 21/500 - Train Loss: 0.1296, Train Accuracy: 0.9925, Test Loss: 0.3463, Test Accuracy: 0.9135
Epoch 22/500 - Train Loss: 0.1277, Train Accuracy: 0.9925, Test Loss: 0.3474, Test Accuracy: 0.9117
Epoch 23/500 - Train Loss: 0.1213, Train Accuracy: 0.9950, Test Loss: 0.2894, Test Accuracy: 0.9292
Epoch 24/500 - Train Loss: 0.1128, Train Accuracy: 1.0000, Test Loss: 0.3043, Test Accuracy: 0.9240
Epoch 25/500 - Train Loss: 0.1219, Train Accuracy: 0.9925, Test Loss: 0.3055, Test Accuracy: 0.9279
Epoch 26/500 - Train Loss: 0.1069, Train Accuracy: 0.9975, Test Loss: 0.3445, Test Accuracy: 0.9178
Epoch 27/500 - Train Loss: 0.1225, Train Accuracy: 0.9900, Test Loss: 0.3342, Test Accuracy: 0.9178
Epoch 28/500 - Train Loss: 0.1098, Train Accuracy: 1.0000, Test Loss: 0.3790, Test Accuracy: 0.9012
Epoch 29/500 - Train Loss: 0.1323, Train Accuracy: 0.9850, Test Loss: 0.3114, Test Accuracy: 0.9235
Epoch 30/500 - Train Loss: 0.1310, Train Accuracy: 0.9850, Test Loss: 0.3010, Test Accuracy: 0.9309
Epoch 31/500 - Train Loss: 0.1064, Train Accuracy: 1.0000, Test Loss: 0.2858, Test Accuracy: 0.9379
Epoch 32/500 - Train Loss: 0.1105, Train Accuracy: 1.0000, Test Loss: 0.2648, Test Accuracy: 0.9441
Epoch 33/500 - Train Loss: 0.1019, Train Accuracy: 1.0000, Test Loss: 0.2720, Test Accuracy: 0.9397
Epoch 34/500 - Train Loss: 0.1180, Train Accuracy: 0.9950, Test Loss: 0.2852, Test Accuracy: 0.9375
Epoch 35/500 - Train Loss: 0.1099, Train Accuracy: 1.0000, Test Loss: 0.2772, Test Accuracy: 0.9375
Epoch 36/500 - Train Loss: 0.1044, Train Accuracy: 1.0000, Test Loss: 0.2732, Test Accuracy: 0.9379
Epoch 37/500 - Train Loss: 0.1050, Train Accuracy: 1.0000, Test Loss: 0.2728, Test Accuracy: 0.9388
Epoch 38/500 - Train Loss: 0.1014, Train Accuracy: 1.0000, Test Loss: 0.3203, Test Accuracy: 0.9231
Epoch 39/500 - Train Loss: 0.1083, Train Accuracy: 0.9975, Test Loss: 0.3604, Test Accuracy: 0.9108
Epoch 40/500 - Train Loss: 0.1137, Train Accuracy: 0.9925, Test Loss: 0.3873, Test Accuracy: 0.9034
Epoch 41/500 - Train Loss: 0.1363, Train Accuracy: 0.9900, Test Loss: 0.3615, Test Accuracy: 0.9218
Epoch 42/500 - Train Loss: 0.1453, Train Accuracy: 0.9775, Test Loss: 0.3187, Test Accuracy: 0.9261
Epoch 43/500 - Train Loss: 0.1060, Train Accuracy: 1.0000, Test Loss: 0.3145, Test Accuracy: 0.9253
Epoch 44/500 - Train Loss: 0.1036, Train Accuracy: 1.0000, Test Loss: 0.2977, Test Accuracy: 0.9305
Epoch 45/500 - Train Loss: 0.1039, Train Accuracy: 0.9975, Test Loss: 0.2953, Test Accuracy: 0.9340
Epoch 46/500 - Train Loss: 0.1009, Train Accuracy: 1.0000, Test Loss: 0.2862, Test Accuracy: 0.9375
Epoch 47/500 - Train Loss: 0.1024, Train Accuracy: 1.0000, Test Loss: 0.3052, Test Accuracy: 0.9301

Early stopping triggered at epoch 47
Best test loss: 0.2648
Best test accuracy: 0.9441
Plot saved as trained_models/Sweep run/metrics/loss.png
Plot saved as trained_models/Sweep run/metrics/metrics.png
Using GPU 0: NVIDIA GeForce RTX 3090
Using GPU 0: NVIDIA GeForce RTX 3090
Epoch 1/500 - Train Loss: 2.0487, Train Accuracy: 0.2075, Test Loss: 2.0680, Test Accuracy: 0.1779
Epoch 2/500 - Train Loss: 1.7777, Train Accuracy: 0.4450, Test Loss: 1.9116, Test Accuracy: 0.3518
Epoch 3/500 - Train Loss: 1.4756, Train Accuracy: 0.6800, Test Loss: 1.6208, Test Accuracy: 0.6215
Epoch 4/500 - Train Loss: 1.2567, Train Accuracy: 0.7925, Test Loss: 1.3477, Test Accuracy: 0.7535
Epoch 5/500 - Train Loss: 1.0818, Train Accuracy: 0.8575, Test Loss: 1.1304, Test Accuracy: 0.8287
Epoch 6/500 - Train Loss: 0.9059, Train Accuracy: 0.9125, Test Loss: 0.9760, Test Accuracy: 0.8649
Epoch 7/500 - Train Loss: 0.7927, Train Accuracy: 0.9175, Test Loss: 0.8437, Test Accuracy: 0.8907
Epoch 8/500 - Train Loss: 0.7132, Train Accuracy: 0.9275, Test Loss: 0.7437, Test Accuracy: 0.9161
Epoch 9/500 - Train Loss: 0.6336, Train Accuracy: 0.9375, Test Loss: 0.6673, Test Accuracy: 0.9279
Epoch 10/500 - Train Loss: 0.5971, Train Accuracy: 0.9575, Test Loss: 0.6174, Test Accuracy: 0.9331
Epoch 11/500 - Train Loss: 0.5295, Train Accuracy: 0.9625, Test Loss: 0.5806, Test Accuracy: 0.9392
Epoch 12/500 - Train Loss: 0.5206, Train Accuracy: 0.9575, Test Loss: 0.5568, Test Accuracy: 0.9414
Epoch 13/500 - Train Loss: 0.4789, Train Accuracy: 0.9750, Test Loss: 0.5402, Test Accuracy: 0.9414
Epoch 14/500 - Train Loss: 0.4692, Train Accuracy: 0.9750, Test Loss: 0.5236, Test Accuracy: 0.9454
Epoch 15/500 - Train Loss: 0.4637, Train Accuracy: 0.9750, Test Loss: 0.5156, Test Accuracy: 0.9484
Epoch 16/500 - Train Loss: 0.4528, Train Accuracy: 0.9750, Test Loss: 0.5086, Test Accuracy: 0.9441
Epoch 17/500 - Train Loss: 0.4229, Train Accuracy: 0.9850, Test Loss: 0.5063, Test Accuracy: 0.9432
Epoch 18/500 - Train Loss: 0.4364, Train Accuracy: 0.9750, Test Loss: 0.4996, Test Accuracy: 0.9423
Epoch 19/500 - Train Loss: 0.4138, Train Accuracy: 0.9875, Test Loss: 0.4874, Test Accuracy: 0.9493
Epoch 20/500 - Train Loss: 0.3936, Train Accuracy: 0.9900, Test Loss: 0.4843, Test Accuracy: 0.9493
Epoch 21/500 - Train Loss: 0.3893, Train Accuracy: 0.9975, Test Loss: 0.4837, Test Accuracy: 0.9489
Epoch 22/500 - Train Loss: 0.3945, Train Accuracy: 0.9825, Test Loss: 0.4833, Test Accuracy: 0.9502
Epoch 23/500 - Train Loss: 0.3832, Train Accuracy: 0.9875, Test Loss: 0.4778, Test Accuracy: 0.9506
Epoch 24/500 - Train Loss: 0.3740, Train Accuracy: 0.9950, Test Loss: 0.4800, Test Accuracy: 0.9476
Epoch 25/500 - Train Loss: 0.3881, Train Accuracy: 0.9900, Test Loss: 0.4789, Test Accuracy: 0.9454
Epoch 26/500 - Train Loss: 0.3663, Train Accuracy: 0.9950, Test Loss: 0.4749, Test Accuracy: 0.9484
Epoch 27/500 - Train Loss: 0.3662, Train Accuracy: 0.9900, Test Loss: 0.4815, Test Accuracy: 0.9449
Epoch 28/500 - Train Loss: 0.3731, Train Accuracy: 0.9925, Test Loss: 0.4897, Test Accuracy: 0.9427
Epoch 29/500 - Train Loss: 0.3725, Train Accuracy: 0.9875, Test Loss: 0.5008, Test Accuracy: 0.9392
Epoch 30/500 - Train Loss: 0.3782, Train Accuracy: 0.9875, Test Loss: 0.4875, Test Accuracy: 0.9441
Epoch 31/500 - Train Loss: 0.3569, Train Accuracy: 0.9975, Test Loss: 0.4781, Test Accuracy: 0.9489
Epoch 32/500 - Train Loss: 0.3624, Train Accuracy: 0.9950, Test Loss: 0.4734, Test Accuracy: 0.9519
Epoch 33/500 - Train Loss: 0.3547, Train Accuracy: 0.9975, Test Loss: 0.4765, Test Accuracy: 0.9489
Epoch 34/500 - Train Loss: 0.3635, Train Accuracy: 0.9975, Test Loss: 0.4767, Test Accuracy: 0.9489
Epoch 35/500 - Train Loss: 0.3558, Train Accuracy: 0.9925, Test Loss: 0.4766, Test Accuracy: 0.9484
Epoch 36/500 - Train Loss: 0.3551, Train Accuracy: 0.9950, Test Loss: 0.4767, Test Accuracy: 0.9441
Epoch 37/500 - Train Loss: 0.3547, Train Accuracy: 0.9950, Test Loss: 0.4816, Test Accuracy: 0.9423
Epoch 38/500 - Train Loss: 0.3462, Train Accuracy: 1.0000, Test Loss: 0.4810, Test Accuracy: 0.9432
Epoch 39/500 - Train Loss: 0.3542, Train Accuracy: 0.9925, Test Loss: 0.4876, Test Accuracy: 0.9401
Epoch 40/500 - Train Loss: 0.3602, Train Accuracy: 0.9925, Test Loss: 0.4830, Test Accuracy: 0.9401
Epoch 41/500 - Train Loss: 0.3567, Train Accuracy: 0.9925, Test Loss: 0.4812, Test Accuracy: 0.9432
Epoch 42/500 - Train Loss: 0.3604, Train Accuracy: 0.9950, Test Loss: 0.4832, Test Accuracy: 0.9414
Epoch 43/500 - Train Loss: 0.3449, Train Accuracy: 1.0000, Test Loss: 0.4830, Test Accuracy: 0.9423
Epoch 44/500 - Train Loss: 0.3464, Train Accuracy: 1.0000, Test Loss: 0.4814, Test Accuracy: 0.9427
Epoch 45/500 - Train Loss: 0.3400, Train Accuracy: 1.0000, Test Loss: 0.4759, Test Accuracy: 0.9462
Epoch 46/500 - Train Loss: 0.3467, Train Accuracy: 1.0000, Test Loss: 0.4729, Test Accuracy: 0.9454
Epoch 47/500 - Train Loss: 0.3463, Train Accuracy: 0.9975, Test Loss: 0.4744, Test Accuracy: 0.9462

Early stopping triggered at epoch 47
Best test loss: 0.4729
Best test accuracy: 0.9519
Plot saved as trained_models/Sweep run/metrics/loss.png
Plot saved as trained_models/Sweep run/metrics/metrics.png
Using GPU 0: NVIDIA GeForce RTX 3090
Epoch 1/500 - Train Loss: 1.7738, Train Accuracy: 0.4100, Test Loss: 2.0016, Test Accuracy: 0.2622
Epoch 2/500 - Train Loss: 1.0215, Train Accuracy: 0.8325, Test Loss: 1.4328, Test Accuracy: 0.7456
Epoch 3/500 - Train Loss: 0.5871, Train Accuracy: 0.9400, Test Loss: 0.8606, Test Accuracy: 0.8851
Epoch 4/500 - Train Loss: 0.4354, Train Accuracy: 0.9500, Test Loss: 0.5421, Test Accuracy: 0.9279
Epoch 5/500 - Train Loss: 0.3350, Train Accuracy: 0.9650, Test Loss: 0.4169, Test Accuracy: 0.9323
Epoch 6/500 - Train Loss: 0.2684, Train Accuracy: 0.9750, Test Loss: 0.3645, Test Accuracy: 0.9379
Epoch 7/500 - Train Loss: 0.2439, Train Accuracy: 0.9825, Test Loss: 0.3433, Test Accuracy: 0.9410
Epoch 8/500 - Train Loss: 0.2436, Train Accuracy: 0.9750, Test Loss: 0.3383, Test Accuracy: 0.9410
Epoch 9/500 - Train Loss: 0.2098, Train Accuracy: 0.9950, Test Loss: 0.3414, Test Accuracy: 0.9388
Epoch 10/500 - Train Loss: 0.2078, Train Accuracy: 0.9875, Test Loss: 0.3226, Test Accuracy: 0.9449
Epoch 11/500 - Train Loss: 0.1855, Train Accuracy: 0.9975, Test Loss: 0.3308, Test Accuracy: 0.9436
Epoch 12/500 - Train Loss: 0.2085, Train Accuracy: 0.9825, Test Loss: 0.3119, Test Accuracy: 0.9506
Epoch 13/500 - Train Loss: 0.1777, Train Accuracy: 0.9950, Test Loss: 0.3196, Test Accuracy: 0.9462
Epoch 14/500 - Train Loss: 0.1852, Train Accuracy: 0.9950, Test Loss: 0.3237, Test Accuracy: 0.9441
Epoch 15/500 - Train Loss: 0.2023, Train Accuracy: 0.9900, Test Loss: 0.3529, Test Accuracy: 0.9305
Epoch 16/500 - Train Loss: 0.2180, Train Accuracy: 0.9800, Test Loss: 0.3283, Test Accuracy: 0.9384
Epoch 17/500 - Train Loss: 0.1902, Train Accuracy: 0.9975, Test Loss: 0.3346, Test Accuracy: 0.9366
Epoch 18/500 - Train Loss: 0.1986, Train Accuracy: 0.9925, Test Loss: 0.3340, Test Accuracy: 0.9375
Epoch 19/500 - Train Loss: 0.1856, Train Accuracy: 0.9950, Test Loss: 0.3300, Test Accuracy: 0.9401
Epoch 20/500 - Train Loss: 0.1797, Train Accuracy: 0.9950, Test Loss: 0.3217, Test Accuracy: 0.9379
Epoch 21/500 - Train Loss: 0.1864, Train Accuracy: 0.9925, Test Loss: 0.3373, Test Accuracy: 0.9379
Epoch 22/500 - Train Loss: 0.1828, Train Accuracy: 1.0000, Test Loss: 0.3340, Test Accuracy: 0.9384
Epoch 23/500 - Train Loss: 0.1872, Train Accuracy: 0.9925, Test Loss: 0.3181, Test Accuracy: 0.9406
Epoch 24/500 - Train Loss: 0.1734, Train Accuracy: 0.9975, Test Loss: 0.3278, Test Accuracy: 0.9388
Epoch 25/500 - Train Loss: 0.1871, Train Accuracy: 0.9900, Test Loss: 0.3187, Test Accuracy: 0.9406
Epoch 26/500 - Train Loss: 0.1707, Train Accuracy: 1.0000, Test Loss: 0.3217, Test Accuracy: 0.9423
Epoch 27/500 - Train Loss: 0.1813, Train Accuracy: 0.9925, Test Loss: 0.3326, Test Accuracy: 0.9384

Early stopping triggered at epoch 27
Best test loss: 0.3119
Best test accuracy: 0.9506
Plot saved as trained_models/Sweep run/metrics/loss.png
Plot saved as trained_models/Sweep run/metrics/metrics.png
Using GPU 0: NVIDIA GeForce RTX 3090
